"Date / Time","City","State","Shape","Duration","Summary","Posted"
"12/27/76 19:00","Conshohocken","PA","Other","5 minutes","Cloud turning different colors for several minutes.","6/4/14"
"12/25/76 19:00","Winslow","ME","Disk","3 minutes","two disks edge on with light on botom flying in formation.","2/1/07"
"12/15/76 22:15","Junction City","KS","Diamond","2-3 minutes","saw large diamond shaped craft fly almost directly over head at night (bright moon w/thin clouds) . Craft made humming sound that wasn'","1/28/99"
"12/12/76 21:00","Minnetonka","MN","Disk","1-2 minutes","Disc shaped object, silent, with 2 search light beams, floating through airspace in Minnetonka, Winter or 1976.","10/3/14"
"12/6/76 05:30","Davie","FL","Changing","40 minutes","I have checked your log report and found that the sighting I reported shortly after December 6, 1976, was not filed. I am dismayed but","6/20/05"
"12/3/76 23:00","Monrovia","IN","Triangle","20 min","after being followed by a ufo, a beam of light shown down on my sister","2/16/99"
"12/3/76 15:30","Milford","CT","Disk","2 hours","Saw five craft  and observed signaling after work.","3/2/04"
"11/27/76 15:00","Stead Nevada (outside of Reno)","NV","Disk","3-5min","It was Thanksgiving 1975 or 76. When I came out of our house it was hovering over our neighbors one story house. It was daylight and I ","1/28/99"
"11/26/76 03:30","Houston","TX","Circle","15 minutes","Night patrolman rendered defenseless by ALIENS and ARMORED aliens. Interlect exam took place on roof top of building.","10/12/01"
"11/25/76 23:00","Omaha","NE","Rectangle","seemed like 1 minute, but","White rectangular &quot;door&quot; opens in night sky, emiting orange beam of light","10/31/03"
"11/25/76 20:20","Virginia (western part; rural?)","VA","Fireball","2 minutes","White light above cloud cover speed about 3000 mph;the fiery ball desending at a rate of 50 mph.","7/28/10"
"11/19/76 23:00","Sierra Vista","AZ","N/A","4-5 min.","very close encounter in 1976, in arizona, with extremely large craft,seen clearly","12/2/00"
"11/17/76 15:00","Pennsylvania (30,000 ft. above on coast)","PA","Disk","15sec","i was in a jet at 30,000 ft over penn on a clear sunny day looking out the window i saw a adamski style craft all silver 40 ft in diami","8/10/99"
"11/15/76 23:00","Bedford Heights","OH","Oval","10-15 MIN","LIGHT BLUE OBJECT LITE UP WAS SEEN DOING SUDDEN STARTS AND STOPS FREQUENT DIRCTION CHANGES FOR 10-15 MIN","7/25/04"
"11/15/76 22:00","Taunton","MA","Fireball","approx. 15 mins","Large orange/yellow sphere w/pulsating energy  imploded , disappeared then seemed to exploded returning to preious shape but larger.","7/23/00"
"11/15/76 21:00","Oscoda","MI","Disk","1 hour","No sound, Two search lights spotting the ground, moved slowly 10 ft. above the ground.","4/16/05"
"11/15/76 20:00","Cambridge (Galt) (Canada)","ON","Formation","15 mins","Nov. 1976, straight line of 7 or 8 red balls travelling northward, absolutely silent, moving up and down, changing positions","2/5/03"
"11/12/76 18:00","Tarboro","NC","Disk","1 hour/30 min.","We  saw  a  disc  with  lights,  it appeared  to  land  in  nearby  woods,  observed  strange  person.","8/16/02"
"11/11/76 20:00","Hartsville","SC","Light","15 minutes","A bright light object appearing to be the size of a house moving across the sky, making an abrupt triangle shape in the sky and leaving","4/27/07"
"11/5/76 19:30","Orchard Lake","MI","Rectangle","20 sec ?","rectangular  light dull white","4/27/04"
"11/1/76 21:30","Wilmington","DE","Disk","2 minutes","Silent hovercraft 35-50 feet above ground with searchlights beaming down on houses makes a 90 degree turn and vanishes.","2/18/13"
"11/1/76 18:00","Tuckahoe","NY","Disk","30 minutes","RED/WHITE LIGHTS REVOLVING AROUND DISK SHAPE.  3 WITNESSES.","1/7/15"
"10/31/76 20:00","Garland","TX","Other","2 minutes","Halloween-walking inside with parents, saw several missile shaped, copper crafts flying in a line formation at a low altitude, very slo","1/28/99"
"10/31/76 18:00","Los Angeles","CA","Oval","5-8 minutes","Ufo over downtown Los Angeles witnessed by  a husband and wife","3/11/03"
"10/30/76 22:50","Louisville","KY","Disk","several mins.","Sighted at the intersection of Preston Hwy. and Gilmore Lane on the saturday before Halloween around 10:30 to 11:00pm. Large dome-shape","4/2/99"
"10/30/76 16:30","Dallas","TX","Disk","16:40","Somethings out there","5/15/06"
"10/21/76 21:00","St. George (UT) to Las Vegas (NV)","UT","Light","30 minutes","A Bright red light in the southwestern sky approx. 45 degrees above the horizon.","2/16/99"
"10/20/76 22:00","Soldotna","AK","Sphere","2 hrs.","Strange Site and Time Red Orb Encounter","4/16/05"
"10/20/76 20:00","Davidsonville","MD","Disk","10 minutes","Saucer shaped disc hovering silently over the treetops, rural Anne Arundel County, MD. October 1976","3/11/16"
"10/20/76 00:00","Avon Lake","OH","Circle","10 to 15 Minutes","The object emitted a brilliant white light, two smaller objects separated from the main object, we ran into the house, the object must","7/16/06"
"10/16/76 00:00","New Gretna","NJ","Triangle","unending","the object was standing still in the sky , no noise,as close as tall skyscraper, triangle shaped, whites lights around the edges","4/16/05"
"10/15/76 23:00","Almena","WI","Unknown","4 hrs","Electrical failure of my reliable vehicle and some missing time.","10/31/03"
"10/15/76 21:00","Eveleth","MN","Light","10-15 minutes","Lights above Eveleth Mn in mid 70's","3/21/03"
"10/15/76 19:30","Rochester","NY","Unknown","10 seconds","Flashing red light appeared a foot above my car then sped away at incredible speed.","8/28/03"
"10/15/76 17:30","Mineral King","CA","Disk","8 hours","Two people view UFO  in Mineral King National Park , California . Investigation by air traffic controller .","2/1/07"
"10/15/76 15:00","Portales","NM","Other","3 minutes","Close encounter with non-human/meta human.","11/26/14"
"10/12/76 23:00","Emporia","KS","Disk","5 minutes","Disc hoovers over train and seems to x-ray it.","6/9/09"
"10/10/76 20:30","Washougal","WA","Oval","1 minute","Three extremely large lights hanging above nearby trees.","2/7/14"
"10/6/76 20:30","Smith Mountain Lake (near Gretna and Penhook)","VA","Disk","20 minutes","THE COMPLETE SAUCER STORY:  WHAT WE SAW AND HOW WE SAW &#9;&#9;&#9;&#9;&#9;&#9;IT TWICE!  It was the middle of the week. Andy knew what he was","10/10/14"
"10/2/76 22:00","Limestone","ME","Disk","30","Craft was seen over the nuclear storage area of Loring A.F.B.","1/28/99"
"10/2/76 01:00","Charleston AFS","ME","Unknown","20 Min","On this date I was stationed at Charleston AFS, ME and worked in the reciever section of the AN/FPS-27A Search radar located at the sit","4/16/05"
"10/1/76 21:00","Thonotosassa","FL","Disk","15 minutes","Mid-1970's Thonotosassa, Florida sighting at Stacey and Knights Griffin","10/30/06"
"10/1/76 19:00","Fairport","NY","Disk","10 minutes","Disk shaped UFO with continous changing color band in the middle.  Hoovered for a few minutes about 3 stories off the ground above a cr","3/2/04"
"10/1/76 07:00","Hartville","OH","Disk","2 minutes or less","A disk shaped flying object followed the path of our car just above the telephone lines.","1/11/02"
"9/27/76 03:00","St. Paul","MN","Unknown","1 hour or so","Their was a green fog. I saw what appeared to be an oval shaped object wrapped or swaddled in a somewhat goldish, metallic material.","4/27/04"
"9/25/76 22:00","Akron","OH","Light","15 mins","large ball of light, made no sound","12/2/00"
"9/20/76 07:30","Williamsburg","KY","Circle","30 seconds","Father and I saw lg round object, looked like a setting sun in the East over a mountain.  Lit up whole side of mountain.  Just appeared","1/28/99"
"9/19/76 22:00","Bordentown","NJ","Oval","1hour","Classic case of &quot;Missing Time&quot; in Bordentown New Jersey in 1976","1/22/04"
"9/15/76 21:00","Centralia/Walnut Hill area","IL","Other","5 min","Orange line of light seen travelling from the south in southern Illinois leaves burned remains of a tree.","12/2/00"
"9/15/76 21:00","Hoodsport","WA","N/A","1-2 minutes","Heard Strange sounding flying object above tree tops","6/18/04"
"9/15/76 20:00","Sacramento","CA","Oval","6 minutes","In September 1976, I had another UFO encounter.  This time I was out of the Army and living with my former girlfriend H. L. in an apart","5/15/06"
"9/15/76 19:30","Lynch Station","VA","Light","10 min","Silent bright craft releases smaller craft in 1976.","12/12/11"
"9/15/76 18:00","Laredo","TX","Oval","Seconds","In the fall of 1976, three of us saw a grayish oval ufo with lighted windows hovering very low above some trees.","10/10/11"
"9/15/76 16:30","Rancho Palos Verdes","MT","Sphere","5 minutes","teen girl alone by stable sees dark grey hovering sphere","2/1/07"
"9/15/76 04:00","Fairbanks","AK","Triangle","10 minutes","I have video of surgery in my left shoulder that was found by my Doctor. My experience began when I was a child, it was like a dream bu","9/29/15"
"9/10/76 23:00","Albany","NY","Circle","2 minutes","It was a warm night for early September in upstate New York. It was &quot;trash night.&quot;  My parents purchased a new easy chair for","7/4/12"
"9/10/76 22:00","New York City (Bronx)","NY","Disk","15 Minutes","1976 Sighting - 2 disks over NY city.","5/14/02"
"9/10/76 15:30","O'Fallon/Fairview Heightss","IL","Disk","unknown","Disk, up close, colored lights around perimeter and red dome on top.  Off hwy 50 by Belscott and Aikens Grocery Store","7/3/13"
"9/10/76 03:00","Franconia","NH","Other","28 seconds","Crystal clear sky, White Mountains, NH (checking out satellites) tracking a satellite it stopped, four (whatevers) shot out 4 direction","3/19/09"
"9/5/76 02:00","Broadview Heights","OH","Disk","3 minutes","Low flying metalic saucer slowly flying over apartment complex  (30 feet in air and silent)","5/28/05"
"9/2/76 03:00","Moose Lake","MN","Disk","5 minutes?","Floating down the light beam","8/5/01"
"9/1/76 23:00","Ahwahnee","CA","Fireball","2 minutes","Huge fireball hit and one big or three smaller  crafts with blue lights came from where it hit the ground","3/11/03"
"9/1/76 22:30","Belzoni","MS","Light","15-20 min.","Spotted air craft hubbering about 1/2 out infront of us as we got out of our car. Stood and watched it for 15-20min. until it sped away","4/26/99"
"9/1/76 22:00","Washougal","WA","Light","20 minutes","Red light in sky, in evening, stayed in place for 15 to 20 minutes.","2/7/14"
"9/1/76 21:00","Lighthouse Point","FL","Disk","10 minutes","Saw a saucer with extreme brightness, spinning rapidy, with windows surrounding the ship, and no sound.","9/21/00"
"9/1/76 20:00","Burlington (Canada)","ON","Unknown","10 minutes","Massive array of lights roughly 60 feet in the air pass directly overhead, at low speed, totally silent.","4/18/12"
"9/1/76 19:00","St. Agatha","ME","Light","10 minutes","This very bright light getting brighter and not moving,  I kept my eyes on it ,","2/18/01"
"9/1/76 09:00","San Antonio","TX","Sphere","5 seconds","i was about 7years old. my parents and sister and brother were sitting at the table eating breakfast when the greyish metalic sphere hi","7/5/08"
"9/1/76 04:00","Canon City","CO","Oval","2 min","Aug 1976  Canon City Colo      Disk shap  duration    2 min   just came over mountain and flew by","2/18/11"
"8/30/76 02:00","Portland","OR","Cigar","3-4 minutes","Cigar shaped object over Porland Oregon 8/76","7/4/12"
"8/25/76 22:00","Jonesboro","LA","Triangle","30 min.","Triangular craft w/ flashing lights in 1976","9/2/05"
"8/20/76 20:00","Kissimmee","FL","Disk","15 mins","Vi junto con mis abuelos y mi hermana, un UFO muy grande, claro y n&iacute;tido, como a 100 metros de nosotros y a una altura de 30 metros apr","4/14/09"
"8/20/76 13:00","Holden","MO","Disk","?","While inside this craft I noticed it was circle.","10/16/15"
"8/20/76 01:00","Los Angeles (90 miles east of)","CA","Rectangle","3 minutes","A dark rectangular object appears over my car out on the road and telepathically tells me not to panic, that I knew it was there.","7/4/12"
"8/18/76 17:00","Sycamore","IL","Triangle","15 minutes","I looked up and saw hovering directly over my head at about two story roof height three lights in a triangular pattern.","1/17/04"
"8/15/76 23:00","Ossipee","NH","Light","unknown","Huge brilliant light like the sun rising in the mid night sky, no noise, no logical reason","10/15/02"
"8/15/76 23:00","Tierra Verde","FL","Changing","5 minutes","Watched rectangular shaped amber colored UFO perform S turns, change shape and exit atmosphere at impossible speed and left an ion trai","10/30/06"
"8/15/76 22:30","Hatboro","PA","Sphere","10 minutes","Glowing Orb with 2 satellites circling","3/21/03"
"8/15/76 22:30","Weekapaug","RI","Formation","5 seconds","Three globular lights in a tight triangular formation passed east to west at low altitude","8/5/01"
"8/15/76 22:00","Lincoln Park","MI","Circle","5 minutes","3  round  lights in the sky","12/23/02"
"8/15/76 21:00","Kenosha","WI","Triangle","10 minutes","triangular object,white lights in pyramid rows.very high in sky,half the size of the united states.watched object for 10 minutes.","6/9/09"
"8/15/76 21:00","Fort Alexander (Canada)","MB","Circle","1 hour","Gold colored globes","4/1/01"
"8/15/76 19:00","Buellton","CA","Other","not sure, at least 5 minu","Stealth looking glider hung 20 feet over our house for a minute or so","2/12/04"
"8/15/76 18:00","Birmingham","AL","Disk","5 minutes","I HEARD YELLING AT THE APARTMENT BELOW US, SAYING &quot;LOOK !, LOOK !&quot; I WENT TO THE LIVING ROOM WINDOW AND PULLED BACK THE DRAPES AND SAW","6/3/03"
"8/15/76 16:30","McDermitt (NE of;  Lat 42 05'N  Lon 117 00'W","NV","cylinder","3-5 min","5 witness long tubular shaped object moving S to N low to the ground with 6-7 oval lights.  The first and last lights were colored red,","1/28/99"
"8/15/76 02:00","Avenue City","MO","Light","days","balls of bright light with consciousness","8/5/01"
"8/11/76 21:00","Portland","OR","Triangle","20 min","Large triangle remembered in Portland, Oregon","10/10/11"
"8/10/76 22:30","Sebago","ME","Light","6 seconds","a point of light appeared, moved from N to S, stopped. from stopping point to west, back to stopping pt., then to east. back to s.p., t","2/16/99"
"8/10/76 21:00","Arcola","VA","Cross","20 seconds","Vivid Cross in the sky for 5 -10 seconds, then gone","3/2/04"
"8/10/76 01:00","Northwood","IA","Light","15 Min","point of light ,like on a jet, divided into 2 points with large flash and disappeared over horizon in 12 seconds","9/2/05"
"8/8/76 23:30","Port Richey","FL","Formation","2 minutes","5 glowing, pale green spheres in a chevron formation slowly flying north to south","1/10/09"
"8/8/76 23:00","Mountlake Terrace","WA","Triangle","5 minutes","Triangle craft headed towards Boeing Everett, WA facility","3/27/14"
"8/8/76 19:30","Sacramento","CA","Rectangle","5 min.","fire emitting rectangle shaped object traveling at high velocity, low attitude roocket blasting noise then vanished silent.","4/8/02"
"8/1/76 23:20","Houston","TX","Unknown","10 to 13 mins","Unknown object with flashing lights and laser beam behind the Hou ARTCC building/very fast moving","5/15/06"
"8/1/76 21:00","San Jose","CA","Disk","1 hour","Hovering Saucer over South San Jose in the August Evening","6/4/04"
"8/1/76 18:00","Arlington","VT","Disk","3 minuutes","The object emitted two smaller objects and made no sounds whatsoever.","2/14/10"
"8/1/76 17:00","Lockport (near Selkirk) (Canada)","MB","Light","1-2 minutes","White light deposited two red lights and then zipped off into the sky.","7/1/02"
"8/1/76 00:00","Georgetown","TX","Light","6 hours","ABDUCTED BY BRIGHT LIGHT","4/18/12"
"7/30/76 20:00","South Africa","AR","Oval","day","Three pilot crews from 3 different airlines observed and confirmed seeing an unidentified flying object.","3/4/08"
"7/28/76 21:00","Fort Lauderdale","FL","Disk","8 minutes","Slow moving classic disc 50ft up","6/12/08"
"7/28/76 03:30","Fort Lauderdale","FL","Disk","15 minutes","Classic &quot;flying saucer&quot; moving low and slow through condos in gated Ft. Lauderdale prestige golf community.","2/14/06"
"7/27/76 01:00","Cowley","WY","Cylinder","10 min. ??","Witnessed a cylinder shape object, very close, moving slowly, deep humming sound,  illuminated portals showing mechanical rooms.","2/14/10"
"7/26/76 19:00","Warwick","NY","Light","3 minutes","UFO sighting?  Unbelievable expierience!","6/12/07"
"7/26/76 13:00","Kit Carson","CO","Cylinder","5 minutes","Black and silver cylindrical object at very close range.","11/6/15"
"7/25/76 18:00","Casper","WY","Circle","1 hour","UFO Sighting in Casper, Wy. in summer of 1976","9/2/05"
"7/21/76 23:00","Brevard","NC","Sphere","5 minutes","Saw two star-like objects, one bluish, theother orange, remain stationary for at least 5 minutes, then, in sequence and at about a 2 mi","11/19/98"
"7/21/76 01:00","Warren","MI","Disk","15-20 sec","It shot up and out of sight","8/11/04"
"7/20/76 23:30","Durham","FL","N/A","20-30 seconds","Stealth craft at night","3/19/09"
"7/20/76 22:50","Newbury Park","CA","Unknown","20 minutes","I saw what appeared to be the lights of a plane that seemed to be going to crash nearby which then became a swirling mass of light and","6/18/04"
"7/20/76 21:00","New Gulf","TX","Triangle","10-15 minutes","we were driving around town.there is a golf course and one of the holes is close to the road.when all of a suuden as we were passing by","12/12/09"
"7/20/76 05:30","Roseville","MN","Rectangle","15 seconds","Saw something extraordinary","9/1/04"
"7/19/76 21:00","Tucson","AZ","Disk","4 minutes","Large metallic disc over central Tucson in thunderstorm.","1/16/15"
"7/17/76 21:00","Iowa City","IA","Cigar","70 mins","9 stars in the summer sky,","11/21/10"
"7/17/76 01:00","Hampton","NH","Unknown","4.5 hours","FInally come to grips with this one....but when I was about 8 yrs....my family was taken and examined.....however, i beleive that i was","10/30/06"
"7/15/76 23:00","Bokchito","OK","Circle","10-15 SECONDS","round, luminous, pulsating object with dull places moving across the southwestern horizon then vanished 7/76","2/14/06"
"7/15/76 23:00","Leominster","MA","Unknown","5-7 minutes","Bright beam of light with faint sound.","10/10/11"
"7/15/76 23:00","Greenup","KY","Light","10 seconds","2 brilliant lights a few seconds apart, unbelievable speed no trail stopped like hitting a wall and made a 90 degree turn to the south","2/1/07"
"7/15/76 22:30","St. Charles","MO","Light","Aprox 20-30 min","On the night in question, my best friend Richard C. Bean &amp; I were camping outside my parents townhouse in St. Charles Mo. We had star w","1/28/99"
"7/15/76 22:00","Pine City","MN","Oval","2 hours","stargazers looking at a beautiful sky full of stars on a perfectly clear night, wittness several craft buzzing over Cross lake. One cra","4/26/99"
"7/15/76 21:50","Leakey","TX","Light","5 minutes","1976 observation in W.Texas of 3 rapidly moving lights at very high alt. moving in a way that wouldn't be possible for man made craft","7/5/08"
"7/15/76 21:30","Memphis","TN","Light","5-7 minutes","Bright white light in rural area of Memphis in 1976 responds to kid's and their sealed beam flashlight.","7/16/06"
"7/15/76 20:00","Silverthorne","CO","Disk","10 seconds","a light appeared to my left and a metalic object suddenly appeared, saucer shaped","2/1/07"
"7/15/76 20:00","West Liberty","IA","Circle","15-20 seconds","Circular orb sighting at close range (about 25 feet) that moved in a straight line floating above the ground","11/21/10"
"7/15/76 20:00","Orlando","FL","Disk","10 mins","Large disc shaped with light panels around the edge of this disc","9/4/03"
"7/15/76 19:00","Kissimmee","FL","Circle","15 minutes","A few days after de bicentennial.","4/8/02"
"7/15/76 16:00","Sault Ste. Marie (north of) (Canada)","ON","Other","3 seconds","Flaming object","1/31/11"
"7/15/76 15:00","Berthold","ND","Cigar","10:00","Bright violet cigar shaped Berthold North Dakota","11/28/07"
"7/15/76 14:30","Vashon Island","WA","Sphere","5 sec.","Soccer ball sized orange glowing sphere bounced from one side of the road to the other.","4/16/05"
"7/15/76 14:00","Hyde Park","NY","Disk","5-10 mins","flat saucer-multiple white lights on the bottom,going on and off,one at a time, in rotation. light in center of disc (red?) altitude es","12/16/05"
"7/15/76 13:00","Medford","MA","Disk","20 seconds","Disk-Shaped silver craft glided over my home.","7/3/15"
"7/15/76 13:00","St. Louis","MO","Cylinder","1 minute","chased by 3 foot silver cylinder in sky.","5/13/12"
"7/15/76 10:00","Winter Park","FL","Fireball","20 minutes","Glowing light coming from between trees.","7/16/06"
"7/15/76 03:00","Santa Monica","CA","Unknown","30 to 60 seconds","Two UFO's sighted over Los Angeles and reported on ABC channel 7 news the nest day.","4/16/05"
"7/15/76 02:00","Nevada","MO","Light","30 minutes","We were star gazing on a beautiful summer night at approximately midnight.  Many stars where visable and after perhaps an hour...probab","10/12/01"
"7/15/76 00:00","St. Louis","MO","Light","1-2 seconds","Confirmation of previous report in Nevada, Mo., 1976.  This really happened.","1/5/16"
"7/12/76 18:01","Warwick","RI","Cigar","30 min","I saw a fast moving, brightly lit, huge object, within 25 ft of me for half an hour.","3/19/09"
"7/10/76 23:00","Strongsville","OH","Triangle","2min","I looked up and saw three lights in a triangle shape moving quietly across the sky spinning.","4/27/04"
"7/10/76 11:30","Phoenix","AZ","Disk","6 secs.","Phoenix, AZ, mid-July, 1976, 11:30 am, shiny silver disk- shaped object hovering over vacant lot at about 200'.","6/12/02"
"7/8/76 15:00","St. Clair Shores","MI","Disk","4 min.","As I was walking across my yard,I heard a deep low humming sound which prompted me to scan the ground around the yard,I saw nothing,unt","4/27/07"
"7/5/76 23:45","Kings Bay","GA","Light","8-10 minutes","yellow ball of light changin to yellow/orange when changing directions","1/31/11"
"7/5/76 02:46","Allentown","PA","Unknown","00:02:00","MY FAMILY AND I HAD BEEN UP WATCHING BI-CENTENNIAL FESTIVITIES FROM COAST TO COAST ON NATIONAL TELEVISION; TALL SHIPS, ETC.  BY 2AM MOS","4/2/99"
"7/4/76 23:59","Taylorville","IL","Light","2 to 5 minutes","4--20 year old males--encountered a UFO with 2 amazing lights, with instant speeds---in the country.","5/15/13"
"7/4/76 22:00","Ausable Forks","NY","Sphere","15 minutes","Crowd of many witness flying saucer during Forth of July fireworks show in 1976","7/14/13"
"7/4/76 02:00","Ridinger Lake","IN","Rectangle","3-4 minutes","Large Rectangular Craft  with lights on its corners. VERY loud, VERY slow.","1/17/04"
"7/4/76 01:00","Allenspark","CO","Teardrop",".50","I was backpacking with my brother and our next door neighbor in and around Allens Park on July 04 1976. These were not firesworks. I wa","2/14/10"
"7/3/76 21:00","Boulder","CO","Disk","5 minutes","close range sighting of lit up disk at drive in theater","12/2/00"
"7/1/76 23:30","San Diego","CA","Light","30 minutes","Faint star-like object became larger and sat over the ocean for at least ten minutes.","3/11/06"
"7/1/76 22:00","Gadsden","AL","Disk","30 seconds","Flashing lights and scrambled jets","7/23/00"
"7/1/76 22:00","Ft. Belvoir","VA","Formation","3-4 MIN","Saw three lights in a triangular shape flying  from the east to west.  It moved as one unit passing by within moments. A plane was in t","6/2/98"
"7/1/76 21:00","Daytona (south)","FL","Fireball","4 miuntes","Approx 200 feet in the air about 50 feet in diameter maybe larger. Looked like swirling lava - but stationary","11/16/02"
"7/1/76 21:00","Hudson","MI","Cigar","10 minutes","Cigar shaped craft spotted just before dark- observed also by police officer","5/24/05"
"7/1/76 21:00","Charleston","SC","N/A","seconds","i was standing on the maindeck of anavy ship in port watching the lighting of athunderstorm ,i saw a solid bar of green light appear in","6/6/00"
"7/1/76 20:00","Philadelphia","PA","Oval","30 minutes","While driving north on 7th st our 3 year old son shouted for my husband and I to look up in the sky.  We looked up, and saw what I thou","4/16/05"
"7/1/76 20:00","Lompoc","CA","Circle","2 MINUTES","A 2.5 foot diameter disc shaped ufo disguised as the full moon suddenly moves to within inches of my face. 500 Lights On Object0: Y","3/19/09"
"7/1/76 15:00","Corpus Christi","TX","Cylinder","5 minutes","UFO in broad daylight in front of a baseball game.","4/4/14"
"7/1/76 14:00","Grand Chain","IL","Fireball","5-10 min ?","UFO near nuclear plant","8/12/08"
"7/1/76 08:00","Boise","WA","Oval","15 minutes","In July of 1976, I was at the Boise Post Off., while facing the front doors i looked of to my right, what i saw a flaming orb (i could","7/23/15"
"7/1/76 00:00","Santa Cruz","CA","N/A","two events that happened ","Organized human-alien abduction","11/26/03"
"6/30/76 23:00","Brooksville","FL","Disk","1 minute","Upclose saucer experience","12/12/09"
"6/30/76 22:00","Springfield","LA","Disk","~3 minutes","My body was scanned by a beam from a small flying object and I received a message of kindness/love.","12/20/12"
"6/30/76 21:15","Elmira Heights","NY","Circle","10-20MIN","Not dreaming becasue I went back to the same police officer","5/15/06"
"6/30/76 20:00","Simi Valley","CA","Light","35 seconds","Thought were satellites, but too low and 90 degree &quot;turns&quot;, twice.","12/12/09"
"6/30/76 20:00","Hadley","KY","Oval","1-2 minutes","1976 20:00 Hadley Ky oval  1-2 minutes silent nearby shape moving north to south","5/13/12"
"6/30/76 18:00","Cambridge","MA","Diamond","1 minute","Jefferson Park, Cambridge Mass, 2 children sight 50ft craft-speak about it 30+years later","8/21/11"
"6/30/76 12:00","Berrien Springs","MI","Disk","five minutes","I have seen two UFOs clearly.","7/19/10"
"6/30/76 07:00","San Jose","CA","Sphere","1 hr not sure","remembered","10/10/11"
