"Date / Time","City","State","Shape","Duration","Summary","Posted"
"4/15/84 02:00","Lake Worth","FL","Disk","2 hours","Saw obj out window appx 0100. Enter E-W slow bright. Outside stared obj 1h. Hypn 5 yr later. Abduct, exam, unsettl","1/28/99"
"4/11/84 21:30","Southwest City","MO","Light","12 minutes","MISSOURI INVESTIGATORS GROUP Report:  The witness noticed some strange lights.","12/7/06"
"4/11/84 02:00","Monahans","TX","N/A","1 hour","strange lightning","10/30/06"
"4/5/84 21:30","Arlington","TX","Triangle","4-5 minutes","I have a childhood memory of looking out front window, and seeing a glowing, pink house floating in the sky.  When I read the book Comm","11/1/98"
"3/30/84 13:00","Griffin","GA","Circle","15-20 seconds","When I was a child ,I  looked up into the sky and saw a huge brown ball with spikes passing over.","10/30/06"
"3/27/84 23:00","Rosendale","NY","Circle","30 minutes","Mass sighting in 1984, two newspaper reports about it, police and other reputable peole also made reports.","5/11/05"
"3/27/84 20:00","Mettacahonts","NY","Formation","20 minutes","Slow moving football-field sized object caused traffic jams on rural Rt. 209 from Ellenville to Marbletown NY.","2/14/06"
"3/24/84 08:00","Newburgh","NY","Circle","25min","3/24/84 Newburgh NY  circle  25min One large mass. Longer than a football field. Saw it for 25min.","9/29/04"
"3/18/84 02:30","Alton","ME","Other","40min","Mother Ship sighting in 1984","10/15/02"
"3/15/84 21:30","Greenville","VA","Triangle","20 minites","Seen 6 bright objects flying over mountains behind our house in v shape formation","8/7/07"
"3/15/84 20:00","Griffin","GA","Circle","3 months","7 large yellow lights with red center  estimated by distance to be at least 400 feet across, seen form top of hill just above tree line","5/15/06"
"3/14/84 16:00","Cowansville","PA","Triangle","few minutes","Myself and 3 other people saw a very large triangular space ship appear over the treeline along the edge of a field on our farm.","4/2/99"
"3/1/84 22:00","Eugene","OR","Triangle","10 minutes","Large Black colored triangle shaped ship. Eugene, OR 1984","7/26/02"
"2/10/84 22:00","Marlow","NH","Fireball","30 - 45 seconds","Orange fireball with strange movement","8/7/07"
"2/1/84 21:00","Columbia/Denmark (between; on US 321)","SC","Unknown","~1 minute","Large object with lights at tree top level.","7/3/13"
"1/26/84 19:30","Rolla","MO","Light","1-2 Minutes","Strange yellowish lights seen southeast of Rolla, Missouri","4/27/07"
"1/24/84 00:00","Kirkland","IL","Circle","20 minutes","((HOAX??))  Dammed scared and we all went home. Noone believed us and we just didnt talk about it anymore","5/12/09"
"1/23/84 06:45","Bozeman","MT","Cigar","10 min","Driving on I-90 East toward Bozeman at 6:45 a.m. over the mountains a huge cigar shaped white object (looked like sun reflecting off of","3/17/04"
"1/21/84 21:00","Valier","MT","Light","3 minutes","10-15 lights were seen in the sky south of Valier, MT","12/2/00"
"1/13/84 02:12","Idaho (I-90 interstate)","ID","Changing","30 Minutes","Amazing Sight and Long Encounter time  - Shape Change of Object","12/2/00"
"1/8/84 22:00","St. George","UT","Formation","1 minute","Eight lights all different colors traveling accross the sky  in a  uneven V formation with small vapor trails.","5/11/05"
"1/3/84 13:00","Fayetteville","NC","Fireball","13:30","I stood there watching as the sun finally started to show its face throughthe sky, a light blinded me. Then.... it was gone.","7/11/00"
