"Date / Time","City","State","Shape","Duration","Summary","Posted"
"5/17/95 21:05","Rochester","NY","Flash","10 minutes","I was a superviser in a machine shop B shift,my guys had lunch at nine.They were going out to get something to eat,and I was still ","12/23/02"
"5/16/95 23:00","Freeport","TX","Other","3 minutes","my brother and i and a few of his friends were in the back yard of our property. As we were watching our kids on their trampoline we no","7/5/05"
"5/16/95 22:45","Lake Oswego","OR","N/A","30 min.","Woman sees bizarre disc outside house.  Looked like &quot;red/orange circle w/ blurred edges.&quot;","11/2/99"
"5/16/95 11:00","Lakewood","WA","Fireball","3 min","I didn't know that there was  a place to report such things. It took place back when I was 16, I am 34 now.","10/10/11"
"5/16/95 04:00","Hillsborough","NJ","N/A","N/A","Local police relay sighting rept.:  Citizen repts. sighting of two round, bizarre objects in sky near town.","11/2/99"
"5/15/95 18:30","Killawog","NY","Light","4 minutes","Two sightings on two consecutive Thursdays of sphere like lights.","1/11/02"
"5/15/95 18:00","Claverack (East Rt.23)","NY","triangle","2 min.","Saw two large triangles,hazy/transparent,hovering a few feet apart north of Rt.23","9/28/02"
"5/15/95 16:15","N. Seattle","WA","N/A","30 sec.","Woman gets very good view of bizarre obj. moving across sky very fast.  Second sighting over Seattle in recent months.","11/2/99"
"5/15/95 15:00","St. Bonifacious","WI","Light","15 min","Orbs over Minnetonka, MN","2/1/07"
"5/15/95 12:30","W. Chicago","IL","N/A","15 min.","Woman repts. stationary obj. in sky.  Looks round, possibly reflecting sunlight.  Started moving, then &quot;just disappeared.&quot;","11/2/99"
"5/15/95 10:30","Portland","OR","N/A","5 min.","Man repts. seeing silver flash, then sees silver, shiny craft w/ thin fuselage, but no wings!  Drifted off, disappeared from sight.","11/2/99"
"5/15/95 04:30","Sage","CA","Fireball","N/A","a ball of light, that fell from the sky, suddenly so bright, and big, then nothing,","5/15/06"
"5/15/95 04:00","Geneva","OH","Sphere","N/A","An unusual bright white sphere follows an uneasy driver","8/1/03"
"5/15/95 03:30","Kalama","WA","Other","pm","In a tree farm I was doing studies. My brother and I were Taking several pictures. We heard no noise saw nothing. When I got my film ba","1/28/99"
"5/15/95 00:00","Normal","IL","Triangle","25 Minutes","Large hovering triangle UFO seen at close distance, object followed us home,","11/21/10"
"5/14/95 20:37","Silver Beach","NY","N/A","25 min.","Woman repts. eight people observing very large obj.--1/2 diameter of full moon--visible in western sky.  Moves to south.","11/2/99"
"5/14/95 03:00","Lake Forest","IL","Unknown","5 mins","3 AM.  Delivering papers 1 block north of Fort Sheridan, off Sheridan Rd.  Dark, floating, soundless UFO floats across sky.","5/24/99"
"5/14/95 00:54","Dayton","OR","N/A","N/A","Man reports witnessing &quot;diamond shaped&quot; object in sky.  (Facts incomplete.)","11/2/99"
"5/13/95 21:40","Framingham","MA","N/A","10 min.","Woman repts. triangular ship flies overhead, stops, hovers.  Simply &quot;winked out.&quot;  Object very bright.  First sighting for her.","11/2/99"
"5/13/95 21:30","Neah Bay","WA","N/A","2 hrs.","Man &amp; woman camped on shore witness flashing, pyramid-shaped obj. w/ multiple flashing lights.  Radiated beams of light.","11/2/99"
"5/13/95 20:25","Tampa","FL","N/A","3 sec.","Man looks at disc of moon w/ binoculars.  Sees bright, round &quot;dot&quot; move very fast across face of moon.  Convincing rept.","11/2/99"
"5/13/95 19:30","Seattle (west side)","WA","Triangle","2+ minutes","MY father and I were looking at the stars and we saw a triangle UFO with 3 white lights on each corner and 1 red light in the middle...","7/11/00"
"5/13/95 14:00","Scottsdale (North of)","AZ","Other","20 minutes","Broad daylight sighting of enormous craft outside of Scottsdale Arizona May 13, 1995 around 2:00pm by husband and wife for about 20 min","4/28/01"
"5/12/95 22:50","Duarte","CA","N/A","3 min.","Young woman repts. triangular ship suspended in SE sky, three smaller lights below larger object.  Objs. fly off.","11/2/99"
"5/12/95 20:00","Santa Fe","TX","Chevron","2hours","incredibly massive slow moving craft, chevron or wing shaped with multiple lights of the same hue of red.","12/19/03"
"5/12/95 14:00","Ozark","MO","Cigar","30 to 40 sec.","Clear blue sky,no wind,no sound,very large,and very wicked looking and lights on the second one.","10/12/01"
"5/12/95 12:00","Lackland AIR FORCE Base TX","TX","Disk","20 minutes","2 Identical Saucer to Diving Bell Shaped U.F.O.s Scalloped Lead Bottoms With Transparent Glass Tops.","2/27/14"
"5/12/95 07:30","Starkey","OR","N/A","20 min.","Experienced logger repts. three very bright lights in morning sky.  Middle one rises, accelerates into distance; others follow!","11/2/99"
"5/12/95 02:00","Madison","WI","N/A","N/A","University of Wisconson students observe strange boot-like object in sky over Lake Mendota","11/2/99"
"5/12/95 00:15","Carmichael","CA","N/A","N/A","Man repts. &quot;red thing&quot; near North Star.  Obj. seems to illuminate clouds.  Called Sacramento Sheriff's office.","11/2/99"
"5/11/95 00:15","Palm Desert","CA","N/A","45 min.","Man repts. two &quot;stars&quot; that appear to be moving erratically.  (Possible twinkling star,  except for reported motion of objects.)","11/2/99"
"5/10/95 19:00","Houston  (West)","TX","Light","2 hrs","Swirling lights coming out of larger light at high altitude. Fast with trails.  Aware of us observing.","12/16/99"
"5/10/95 19:00","Whiteriver","AZ","Light","5 minutes","lights over apache community","11/21/10"
"5/10/95 03:00","Columbia","MO","N/A","2 min.","Man repts. son's bizarre sighting of small humanoid creature in back yard.  Reptd. in Acteon Journal, St. Louis UFO newsletter.","11/2/99"
"5/9/95 21:10","Vista","CA","N/A","10 min.","Man repts. witnessing circular disc, 1/2 diam. of moon, moving very slowly across sky to W.  Stopped, disappeared.","11/2/99"
"5/8/95 23:00","Lindsey (Canada)","ON","Sphere","a few seconds","Suddenly a yellow orange orb travelled from one cloud to another.... it was too fast to look for distinguising features,but it was too","2/8/05"
"5/7/95 23:45","Seattle","WA","N/A","N/A","Man calls regarding sighting of triangular ship he witnessed over Univ. of  Washington campus.  (Reported in l993.)","11/2/99"
"5/7/95 12:20","Massillon","OH","N/A","N/A","Young woman &amp; friend witness bizarre, red disc fly north in front of their car.  Engine failed, radio acted strangely. Disappeared.","11/2/99"
"5/7/95 10:00","Surrey (Canada)","BC","Other","3 seconds","I was looking at the clouds and just over these distant mountains I saw a sliver colored craft. It looked like a hazey straight line","12/2/00"
"5/7/95 04:25","Cannon","NH","N/A","1 minute","Woman momentarily &quot;blinded&quot; by bright flash of light directed at her face.  She &amp; husband witness thin disc, streaks off FAST.","11/2/99"
"5/7/95 01:30","Gresham","OR","N/A","10 sec.","Man repts. very clear sighting of a very bright disc, below clouds flying from SW sky.  Made zig-zag movements, flew off.","11/2/99"
"5/7/95 01:00","Phoenix","AZ","Formation","one hour","formations over phoenix","4/27/07"
"5/6/95 23:30","Lebanon","OR","N/A","N/A","Woman repts. seeing two large, bright objects, like &quot;funnels of light,&quot; in eastern sky from top of Snow Peak.","11/2/99"
"5/6/95 21:00","Watertown","CT","Light","2 minutes","Strange Hovering Light - Noticed and Approached Us","7/16/06"
"5/6/95 14:00","Huntington","NY","N/A","N/A","Woman repts. strange obj. in daytime sky.  Looked like face of clock w/ cross-bars, &quot;like hands of clock.&quot; Drifted off behind trees.","11/2/99"
"5/5/95 22:00","Conifer","CO","Circle","10 seconds","Turkey Creek Canyon Road, Conifer Colorado sighting (3 witnesses)","2/18/01"
"5/5/95 15:15","Fremont","OH","Cone","25 min","2 cone shaped objects, at first where conjoined, then seperated and flew away. metalic at first then changed color as they where flying","5/3/00"
"5/3/95 22:30","Alden","NY","light","10-20 minutes","I was just about to goto bed and I looked out my window for some strange reason and I looked to the south and I saw this very bright li","1/28/99"
"5/3/95 04:05","Amsterdam","NY","N/A","4 min.","Prof. trucker repts. sighting disc while driving on I-90.  Was very bright, white light.  Could see disc &amp; dome.  Good rept.","11/2/99"
"5/3/95 00:54","Reno","NV","N/A","10 min.","Man reports up to nine bizarre, white  objects flying strangely overhead. (Calls 2nd time to report  they are birds.)","11/2/99"
"5/2/95 12:00","Memphis","TN","N/A","N/A","Woman reports that her grandfather, an American Indian, tells tribal stories very similar in nature to UFO reports.","11/2/99"
"5/1/95 22:00","Zanesville","OH","Unknown","2 minutes","loud sound coming from water","9/24/03"
"5/1/95 21:30","Brockton","MA","Triangle","2 minutes","came out of nowhere, disappeared into the sky","6/12/02"
"5/1/95 21:00","Sun Prairie","WI","Cross","2 minutes","Apparent cross shaped object seen in sky near Madison, Wisconsin.","11/19/98"
"5/1/95 18:00","Killawog","NY","Light","5 min.","I saw three balls of light. Two yellow and one red on one occation. One yellow ball exactly one week later@around the same time of day","10/12/01"
"5/1/95 12:00","White Sands","NM","Chevron","N/A","Large, unusually-shaped metallic object over White Sands NM, May 1995","10/31/08"
"4/30/95 23:30","Lansing","MI","Circle","15 minutes","Observed hundreds of clear orbs in the sky appearing to be looking at me.","12/2/13"
"4/30/95 22:00","Riverview","FL","N/A","N/A","Man &amp; wife witness multiple, multi-colored objects, some of them &quot;large.&quot;  Neighborhood dogs barking wildly.  (Facts unclear.)","11/2/99"
"4/30/95 20:55","San Diego","CA","N/A","75 min.","Father &amp; son,  fishing,  witness bizarre flashing light, which moved across sky,  increased height. Bizarre through binoculars.","11/2/99"
"4/30/95 11:55","Mt. City","TN","N/A","N/A","Computer engin. repts. strange conversation re UFO's w/ USAF officers at Patrick AFB, FL.  They used (seemingly) covert names.","11/2/99"
"4/28/95 09:30","Grand Rapids","MI","Triangle","5 mns","Triangle Flotation","3/10/11"
"4/28/95 02:45","Flagstaff (Coconino National Forest area)","AZ","Triangle","5 min","A  pitch black triangular shaped craft with a red circular light at each point of the triangle.","11/20/01"
"4/25/95 15:15","Brooklyn","OH","N/A","N/A","Man report strange, machined metallic sphere in backyard.  Calls later to rept. that son, a metallurgist, had left it there.","11/2/99"
"4/25/95 12:30","Portland","OR","N/A","75 min.","Man, lying on bed, sees very bright ball of light enter apt.. Could feel heat from obj., felt paralyzed.  Loud humming above","11/2/99"
"4/25/95 02:30","Grape Creek","IL","N/A","3 sec.","Two youth  witness flash in sky, then &quot;vapor trail&quot; streaking down.  Witness green strobe, &quot;like lightning,&quot; in woods nearby.","11/2/99"
"4/25/95 01:30","Quartzsite","AZ","Triangle","5minutes","TRIANGLE flies over I 10 IN AZ.","11/21/10"
"4/24/95 22:14","Beaver Creek","OR","N/A","30 min.","Five witnesses rept. observing strange light in eastern sky.  Saw it on 21FE and 22FE, as well.  (Possible star?)","11/2/99"
"4/23/95 21:30","Bradenton","FL","N/A","5 min.","Man &amp; wife witness &quot;Armada of bright objs,&quot; streak across sky in formation.  Fly SE.  Very unusual.  Not meteors!","8/16/02"
"4/23/95 21:30","Hickory Corners","MI","N/A","1 sec.","Woman hears strange, loud humming overhead, which ceases, then starts again.  Looks up, sees multiple strange lights.","11/2/99"
"4/23/95 03:45","MM 99 mile Exit/I-5","WA","N/A","15 sec.","Truck driver repts. witnessing &quot;elongate triangle, almost transparent&quot; in morning sky.  Traversed 60 deg. of sky quickly.","8/5/01"
"4/23/95 01:30","Wheeling","WV","Light","10 minutes","Was out in backyard stargazing I guess you could say, when I notice what looked like a bright star, and that's what I thought it was to","9/6/02"
"4/22/95 23:49","Oregon","IL","N/A","60 sec.","Local police relay rept. from youth, who had reported seeing saucer-shaped obj. w/ dome and marker lights.","11/2/99"
"4/22/95 22:37","Seattle","WA","N/A","4 sec.","2 univ. stud. see dramatic &quot;meteor&quot; in S sky, then witness  chevron of lights &quot;like kite&quot; in same area of sky. Zig-zags off!","11/2/99"
"4/22/95 21:44","Bakersfield","CA","N/A","N/A","Anonymous caller repts. strange, multi-colored lights in SW sky; appears to move.  Will call next night after looking at sky.","11/2/99"
"4/22/95 17:15","Portland","OR","N/A","N/A","Woman in hammock witnesses brightly lighted &quot;red ball&quot; descend from sky, fly into garage!  Ascends, flies to 2nd obj. in sky.","11/2/99"
"4/22/95 15:00","Milpitas","CA","N/A","N/A","Former U.S.Navy gunner's mate witnesses &quot;light beige disc&quot; streak overhead.  Est. 60' wide, 10' tall; velocity 1500 mph!  Good rept.","11/2/99"
"4/22/95 01:05","Oregon City","OR","N/A","1 hour","Woman repts. two objects in proximity; witnessed two nights sequentially in same part of sky.  (Possible stars??)","11/2/99"
"4/22/95 00:30","Louisville","KY","N/A","N/A","Woman repts. shiny object, that suddenly got bright, then dimmed, as it moved across sky.  Became crescent shaped, winked out.","11/2/99"
"4/21/95 23:49","Oregon","IL","N/A","60 sec.","Younth &amp; friend witness saucer-shaped obj. w/ dome pass overhead.  2 lights on each side, red in front, strobe behind red.","11/2/99"
"4/21/95 23:00","Newport","OR","N/A","N/A","While looking at stars, man sees &quot;satellite.&quot; 2nd obj. streaks up to 1st, merges w/ it. Then, 3rd obj. streaks up to 2 others.","11/2/99"
"4/21/95 09:30","Palatine","IL","Fireball","8 Seconds","Bright red fireball in the sky.  Seen two seperate occasions.  Resembled a flare.","4/27/04"
"4/20/95 23:20","Watauga","TX","N/A","15 sec.","Man repts. obj. fly overhead W to E.  Looked like 4 lights in a square pattern, blue in front, 3 white lights on other corners.","11/2/99"
"4/20/95 00:02","Fargo","ND","N/A","2 min.","Female student w/ friend witness huge red light in sky.  2 others witness.  Obj pulsated, started to flicker.  Winked out.","11/2/99"
"4/19/95 23:00","Lake Sullivan","ID","Light","5-6 HRS. APPROX.","((This is the third of several of these experiences, all of which I now feel are connected. If visitors to this site have any questions","2/16/99"
"4/19/95 22:19","Augusta","ME","N/A","N/A","ME State Police relay rept. of huge, fluorescent object reported by caller in Augusta.","11/2/99"
"4/19/95 21:45","Richmond","VA","N/A","15 min.","Family &amp; 12 athletes witness huge, black disc w/ dome in center.  Very close. Returns on second occasion.","11/2/99"
"4/19/95 21:44","Binghamton","NY","N/A","5 sec.","Man witnesses cluster of objects &quot;like arrows&quot; streaking overhead at (apparently) high altitude.  Called FAA office to rept.","11/2/99"
"4/19/95 19:58","Clovis","CA","N/A","90 sec.","Woman witnesses obj. like &quot;round planet w/ rings&quot; in NW sky, which then moved very fast to E sky. Daughter witnesses obj.","11/2/99"
"4/19/95 19:30","Pembrook Pines","FL","N/A","10 sec.","While stopped at traffic signal, woman sees &quot;blimp&quot; in W sky.  Obj. started moving, then suddenly diminished in size.  Bizarre.","11/2/99"
"4/19/95 00:30","New Smyrna Beach","FL","N/A","10 sec.","Man witnesses four strange lights in formation in NW sky.  2 lights  were bright &amp; large; 2 were dull &amp; smaller.  Disappeared","11/2/99"
"4/18/95 22:34","Gilbertsville","PA","N/A","10 min.","14-yr. old youth w/ friends witness very bright, white, oval light in NE sky.  (Facts unclear)","11/2/99"
"4/18/95 20:30","Leesport","PA","N/A","3 min.","Teen w/ friends witness two large, orange lights hovering.  Objs. descend, move away.  1/4 diameter of full moon.","11/2/99"
"4/17/95 23:00","Pacificia","CA","Oval","2 hours","I and a friend went outside for an evening cigarette at approx. 11:00p.m. The evening was crystal clear. Because it was so clear we loo","5/24/99"
"4/17/95 19:00","Milton","DE","Disk","4 hours","over  DE bay  flickering lights moving over DE shore/ New Jersey shore .warm air temp. for April/sky colors","5/24/05"
"4/16/95 22:10","Tacoma","WA","N/A","2 min.","Man repts. witnessing two &quot;grayish-white&quot; discs flying S to N apparently above clouds.  Flight was steady,  non-erratic.","11/2/99"
"4/16/95 22:00","Dunkirk","IN","Unknown","5 minutes","Silent craft and many more smaller objects over rural Indiana.","6/5/15"
"4/16/95 21:45","Villa Rica","GA","N/A","N/A","GA Hwy. Patrol dispatch repts. trooper observed advertising blimp for video company in area of prior report.","11/2/99"
"4/16/95 21:25","Carrollton","GA","N/A","N/A","GA Hwy. Patrol relay rept from Sandhill, PA, area.  One observer repts. strange obj. headed in direction of Atlanta.","11/2/99"
"4/16/95 20:30","Medford","MA","N/A","10 sec.","Man witnessed 2 rectangular &quot;lights&quot; that looked like &quot;strips of green light.&quot;  He watched 2 sets of them pass across sky.","11/2/99"
"4/16/95 10:30","Great Falls","MT","Oval","10 minutes","Metallic Oval hovers in broad daylight at Great Falls International Airport","3/19/09"
"4/16/95 01:10","Woodinville","WA","N/A","45 sec.","Woman (prior caller) repts. 3x12' rectangular section of driveway illuminated from above.  Similar to her incident 22FE95.","11/2/99"
"4/15/95 23:30","Kilgore","TX","Circle","60 minutes","Prone to being &quot;ESCORTED&quot;  by bright ball of light???","6/12/02"
"4/15/95 22:00","Pinehurst","NC","Triangle","30 seconds","Two triangular craft, hovering low","12/3/04"
"4/15/95 22:00","Urbana","OH","Circle","N/A","I saw a UFO in 1995 in  Ohio.","12/12/11"
"4/15/95 22:00","Gilbert","AZ","Unknown","1 minute","1995 Phoenix SE Valley &quot;shooting star&quot; turns 90&#176; and crosses sky in couple of seconds.","2/14/08"
"4/15/95 22:00","Asheville","NC","Triangle","it seemed like 15+ mins.","it hovered above us for a while.....","12/2/00"
"4/15/95 19:30","Earlville","PA","N/A","30 sec.","Young man repts. daylight sighting of egg-, or cigar-, shaped silver object.  (See other sightings from Phila./Pottstown PA.)","11/2/99"
"4/15/95 12:00","Austin","TX","Other","10 seconds","SEEN IN BROAD DAYLIGHT- large craft that looked like two pie plates facing each other with a short cylinder in between, yellow and oran","11/30/99"
"4/14/95 22:00","Boston","MA","N/A","N/A","Man repts. strange green glow, which lit up sky and moved dramatically across sky.  Witnessed 3, then 4 objs. Strobed effect.","11/2/99"
"4/14/95 21:00","Tacoma","WA","N/A","N/A","Amateur astronomer repts. sighting peculiar, blinking obj in eastern sky w/ telescope. (Time &amp; date uncertain).","11/2/99"
"4/13/95 23:08","Brooklyn","AR","N/A","2 sec.","Memphis FAA 2nd rept. Two men witness huge, blindingly bright obj. streak overhead. Splits into 2  w/smoke tails.","11/2/99"
"4/13/95 23:07","West Memphis","TN","N/A","5 sec.","Memphis FAA controller relays sighting rept.--- Man sees green &quot;roman candle&quot; descend to ground, streak north.","11/2/99"
"4/13/95 23:07","Brooklyn","AR","N/A","5 sec.","Witness repts. huge, brilliantly bright triangle passes overhead.  Lit up area, hovered, turned, streaked off.","11/2/99"
"4/13/95 12:00","Pottstown","PA","N/A","N/A","Journalist from Pottstown  (PA) Mercury calls to request information about multiple sightings in area.","11/2/99"
"4/12/95 23:00","Friday Harbor","WA","Diamond","3","The craft was diamond in shape, It  was huge about 1/2 an acre wide made only a slight humming sound.","4/1/01"
"4/12/95 21:45","Richmond","VA","N/A","N/A","Multiple witnesses to huge black ship, which hovers over basketball court.  Within 30' of ground.  Seen again 21JN &amp; 10JL95.","11/2/99"
"4/12/95 21:00","Norristown","PA","Circle","30 min","large circular craft hovering over river underneath a bridge","10/31/08"
"4/10/95 21:00","Newport","MI","Other","45 minutes","A montage of events, you figure out what this was, I really am not sure.","2/1/07"
"4/10/95 12:00","Yarldey","PA","Other","5 Minutes","While in Trafic on Oxford Valley Road on way to eh Oxford Valley Mall craft flew over SLOWLY and very low.","1/7/00"
"4/10/95 02:25","Goleta","CA","N/A","5 sec.","Anonymous caller repts. bizarre white ball of light seen descending to S of Goleta.  (Rept. from commo. cntr.?)","11/2/99"
"4/10/95 02:25","Tajunga","CA","N/A","7sec.","Woman witnesses big ball of white light descending in E sky.  Size of full moon.  NBC newsman reported, also.","11/2/99"
"4/10/95 01:30","Apple Valley","CA","N/A","3 min.","Man  woman witness white light descend from sky to low altitude, turn blue, streak off.","11/2/99"
"4/10/95 00:30","Alvin","TX","Other","2-7 minutes","An object with flashing lights moving at a very slow rate of speed over a tree line.","10/30/06"
"4/9/95 17:00","Pridice Valley","AZ","Triangle","2 mins","12 silent lights flying in a triangle formation.","11/9/02"
"4/7/95 21:00","Boulder","CO","N/A","7 sec.","College stud. sees 3 objs. in formation pass directly overhead.  Very fast.  Covers 120 deg. in 7 seconds.","11/2/99"
"4/7/95 17:00","Hendersonville","TN","Triangle","10 minutes","Triangle shape seen in Hendersonville in 95","3/19/09"
"4/6/95 00:58","Burlington","NJ","N/A","30 sec.","Man &amp; wife witness orange, &quot;dirty yellow&quot; cigar-shaped obj. above W horizon.  Passed behind tree, faded out.","11/2/99"
"4/5/95 21:45","Boyertown","PA","N/A","1 hour","Young woman sees bizarre green, white, &amp; red &quot;stick,&quot; which rotates 90 deg., expands laterally.  Good rept.","11/2/99"
"4/5/95 12:01","Mesa","AZ","Disk","5 min","They're here whether you like it or not.","9/24/03"
"4/5/95 01:00","Bakersfield","CA","N/A","1 hour","Young man repts. stationary, bright, colorful light in E sky.  (Possible star)","11/2/99"
"4/5/95 00:00","Rio Grande (Puerto Rico)","PR","Unknown","5 hours","alien body photographed","9/17/00"
"4/4/95 23:50","Folsom","NJ","N/A","N/A","Woman repts. stationary light in sky, which dims when aircraft pass by.","11/2/99"
"4/4/95 04:00","Williamsburg","VA","Sphere","25 minutes","Sphere witnessed in VA","10/31/03"
"4/3/95 10:30","Haslett","MI","N/A","2 min.","Young boy witnesses two discs 50-60' from home.  Takes polaroid photo of one w/ smoke trail. Good photo.","11/2/99"
"4/3/95 02:00","Bakersfield","CA","N/A","3 hrs.","Woman &amp; boyfriend witness 3x strange obj., &quot;sheet of green, laser&quot; light.  Project beams of light to ground.","11/2/99"
"4/2/95 23:25","Smith River","CA","N/A","20 min.","Family reports strange lights to west over water.","11/2/99"
"4/2/95 13:00","Central U.S. (enroute, in-flight)","ND","Diamond","a few seconds","My family and I were flying from St. Peters FL to Winnipeg MB. We had been in the air for about 1.5hrs. I looked out my window on the r","4/2/99"
"4/2/95 10:20","Knoxville","TN","N/A","N/A","MUFON State Dir./TN calls to request information about UFO sightings/explosion over TN on 01/07/95. Investigating incident.","11/2/99"
"4/1/95 21:00","Mountlake Terrace (Seattle)","WA","N/A","N/A","Mother repts. young son witnessed, frightened by saucer in evening sky while playing w/ friends. Luminous tail.","11/2/99"
"4/1/95 18:00","Albany","OR","Other","1 or 2 minutes","There were bright bursts of color in a concentrated area of cloud for a couple of minutes.","4/27/04"
"4/1/95 18:00","Holyoke","MA","Light","10-20 Minutes","Strange moving light over Holyoke Ma in 1995","11/21/10"
"4/1/95 16:30","Bakersfield","CA","Disk","60 seconds","Flying disk seen; more events since then, every few years.","6/5/15"
"4/1/95 05:30","Costa Mesa","CA","N/A","N/A","Teacher repts. 14-yr. old photog. stud. photographs strange obj. that appeared black, white, red, elongate.","11/2/99"
"3/31/95 21:45","Placerville","CA","N/A","5 sec.","Ex-USAF/aerospace empl.(ret.) sees very bright, pure white light descend vertically. Extraordinary sighting.  Good rept.","11/2/99"
"3/30/95 23:32","Murphy","NC","N/A","1 minute","Woman and grandson witness large, oval, brightly lighted obj. W of Murphy, NC.  Similar sighting 03/28/95 @8pm","11/2/99"
"3/30/95 19:30","Warren","MI","N/A","10 min.","Man calls to report woman's sighting. She had seen bright light 1-2 miles away; dims, then splits into 6 obj.","11/2/99"
"3/30/95 05:30","Hollywood","CA","Cigar","5 minutes","early-morning cigar-shaped UFO hovered behind trees in Hollywood near Harold Way/101 Freeway in March '95","6/18/04"
"3/30/95 04:45","Eugene","OR","N/A","N/A","Man reports strange flash of light struck hood of his car.  No sighting of object.","11/2/99"
"3/29/95 23:54","Mt. Ranch","CA","N/A","N/A","Man sees bizarre, solid light pass directly overhead.","11/2/99"
"3/29/95 20:35","Jacksonville","FL","N/A","10 min","Woman reports bright, &quot;neon-like&quot; light, which moved, got brighter,  ascended vertically very fast.","11/2/99"
"3/29/95 20:15","Elma","WA","N/A","N/A","Police detective/MUFON investigator repts. alleged sighting by multiple witnesses.  Begins investigation.  (Star later confirmed)","11/2/99"
"3/29/95 14:36","Rainsville","AL","N/A","N/A","Man repts. seeing 2 glowing orange globes, &quot;size of VW,&quot; in distance over highway.  Later sees wedge-shape craft near truck.","11/2/99"
"3/29/95 06:30","Shippensburg","PA","Other","3 minutes","Large, wingless ship hovers over university building.","2/1/07"
"3/29/95 01:31","Ventura","CA","N/A","45 sec.","Man reports three brightly lighted obj. over mtns. Move erratically, then fly west very fast.  Calls 911.","11/2/99"
"3/28/95 22:00","McAllen","TX","Disk","2 minutes","An out of control disk shape ship with an interesting white light.","9/6/02"
"3/28/95 00:36","Cordova","AK","N/A","15 min","Person reports &quot;clump of fog&quot; circles car six times, changing shape each time.  Hovered.  2nd ship on ground.  Dramatic.","11/2/99"
