"Date / Time","City","State","Shape","Duration","Summary","Posted"
"12/31/95 19:00","Longview","WA","N/A","N/A","Woman, husband, son witness &quot;star&quot; that began to move, stopped, maneuvered erratically.  Moved behind trees, winked out.","11/2/99"
"12/31/95 21:00","Lake Stevens","WA","Fireball","15 seconds","RED LIGHT HOVERING LAKE STEVENS  AREA MADE NO SOUND","1/5/11"
"12/30/95 01:00","Seattle","WA","N/A","15 min.","Woman's attention drawn to very faint light over Puget Sound.  Obj. grows brighter, then suddenly moves to W and disappears.","11/2/99"
"12/30/95 09:30","Livingston","MT","Fireball","10 secs","Close fireball flying at approx. 2000 mph flies over Interstate 90.","6/10/03"
"12/29/95 23:00","San Diego","CA","Cross","5:00","Driving North on the 805 frwy just north of the 8 frwy, saw four very bright white lights in the northern sky moving towards me, one of","1/28/99"
"12/28/95 04:35","Indian Falls","NY","N/A","-5min","Too close for comfort!","3/4/08"
"12/27/95 20:15","California (Rte. 40)","CA","N/A","5 sec.","Man w/ wife witness bizarre &quot;grayish yellow light&quot; streak almost vert. from night sky, go to horizon.  (Awaiting written rept.)","11/2/99"
"12/27/95 13:00","Orlando","FL","Circle","~30 seconds","I was amazed at the light bulb like glow and silence of the craft.","5/29/15"
"12/27/95 03:00","Winnipeg (Canada)","MB","Other","5-15mins","Weird lights over Winnipeg","2/18/01"
"12/24/95 23:30","Christiansburg","VA","Triangle","1-2 min.","4 adults see 2 conventional mil. aircraft &quot;pursuing&quot; a 3rd &quot;triangular craft w/ tiny red lights.&quot; 4th a/c approaches at high speed.","11/2/99"
"12/24/95 22:00","Centreville/Selma (area on state road 219 between)","AL","Fireball","+/- 5 seconds","Fireball over rural Alabama","8/5/01"
"12/24/95 17:30","Moro (Lee Co.) and Brinkley (Monroe Co.) (Between)","AR","Triangle","30 minutes","Star like light followed our car, changed to a triangle shape, changed back, followed airplane.","9/28/02"
"12/23/95 23:50","Warren","MA","Unknown","5 min.","A large beam of light in the back yard","10/8/07"
"12/21/95 19:30","Birchwood","AK","Fireball","6-7 minutes","Highly unusual lengthy meteor observation.","12/18/14"
"12/20/95 23:50","Schnecksville","PA","N/A","3 min.","Man &amp; daughter witness triangular obj. w/ 3 very bright white lights on the corners, 1 red light in the cntr. Obj. circled their home!","11/2/99"
"12/19/95 17:40","Indian Heights","IN","N/A","1 hour","Man, other residents, witness bizarre cluster of lights--&quot;red in middle, 3 white lights around it.&quot;  Reported to flicker.","11/2/99"
"12/19/95 15:20","Joliet","IL","Oval","10 mins","2 objects seen in clear sky hovering. seen while driving E on US 30. Object 1 appeared to 'float' around object 2. Glint from top of on","3/7/98"
"12/18/95 21:45","Scottsdale","AZ","N/A","30 min.","Man (pilot) &amp; woman witness stationary bright obj. w/ strobe lights in NE sky.  Regular strobing pattern. FAA radar negative.","11/2/99"
"12/18/95 21:00","Clinton","MS","Triangle","5 minutes","Trinagular Object","9/17/03"
"12/18/95 20:00","New York City","NY","Triangle","5 minutes","Over 28th &amp; Lexington Ave,  A Huge, hovering,  triangleish shape hovering probably over 1000 feet above crowd including 4 NYC Cops","3/21/03"
"12/17/95 20:15","Greenville","NC","N/A","7 sec.","Man witnesses 3 orange lights in triangular pattern hover momentarily, glide across sky, pause, pivot, the fade from view.","11/2/99"
"12/15/95 22:00","Ainsworth","NE","Light","30 minutes","Stationary light turns off then on then remains in sky for the entire next day, but nobody notices?","3/8/07"
"12/15/95 20:50","Hawesville","KY","Changing","Less than 5 minutes","Strange orange light/craft hovering noiselessly overhead.","7/16/06"
"12/15/95 19:30","Elkridge","MD","Fireball","4 seconds","Late December 1995 green fireball with pale green tail flew over I-95 at around 7:30. Also spotted in Annapolis around the same time.","1/7/00"
"12/14/95 21:40","Las Vegas (western; I-40, MM 264)","NV","Unknown","Couple of Seconds","Saw thick blue beam of light come down out of the sky accross a field and then back up again.","9/15/05"
"12/14/95 14:45","Pomona","CA","Round","15 min.","While delivering packages, man observes 16 round, or oval, tiny golden objs. overhead.  Objs. maneuvered, suddenly disappeared.","11/2/99"
"12/14/95 04:24","Boise","ID","N/A","N/A","FAA employee observes six objects descend out of the night sky and explode into fragments very close to ground.  Bizarre sight.","11/2/99"
"12/13/95 18:45","Upper Makefield","PA","N/A","30 sec.","Two young girls witnessed extremely bright white, spinning lights overhead.  Lts. turned blue, disappeared. Local power failure.","11/2/99"
"12/12/95 22:30","Glen","NY","N/A","15 sec.","Young woman &amp; friend witness bizarre, round obj. w/ intensely bright blue/white lights.  Pursued obj. in car;  obsrvd. it on ground.","11/2/99"
"12/10/95 23:00","Jolliet","IL","N/A","3 sec.","Man witnesses bright red streak of light travel from W to E in front of his car as he is driving N on highway.","11/2/99"
"12/10/95 22:45","Houston","TX","N/A","5 sec.","Man &amp; wife on freeway see round disc w/ red blinking lights streak by.  Obj. flipped on edge.  Wife saw door or hatch on bottom.","11/2/99"
"12/10/95 18:12","Phoenix","AZ","N/A","15 min.","Man, neighbor, 6 kids witnessed first three bright objs. in twilight sky, then two others streaked up to 1st 3.  Not stars or planets.","11/2/99"
"12/10/95 06:00","Clayton","NM","N/A","45 min.","Nurse &amp; daughter see 2 very bright objs. in a.m. sky, flashing red, white, blue lights in constant pattern. Both moved.  Not stars.","11/2/99"
"12/10/95 05:00","Rapid City","SD","Circle","15 sec","It was very early morning and I was delivering papers. I heard a very large BOOM!!! and everything turned blue. I looked toward the noi","9/9/04"
"12/9/95 18:30","Springfield","IL","N/A","9 hrs.","IL State Police/Morgan Co. Sher. relayed mult. repts. of peculiar, very brightwhite&amp;blue flashes in sky. Seen by citizens, troopers.","11/2/99"
"12/8/95 18:00","Pacific Northwest - flying from Portland to L.A., Ca/Or","CA","Changing","45 minutes","While flying from Portland oregon to Burbank, Ca. - saw a solid bright light alongside aircraft for about 45 minutes. Object would chan","1/28/99"
"12/7/95 20:40","Oldsmar","FL","Light","4 sec.","Six witnessed very bright obj. streak from N to S in E sky.  1/4 size of full moon.  Blue head,  short orange/blue tail. Silent.","11/2/99"
"12/6/95 22:45","Lynnwood","WA","N/A","2 sec.","Five youth watching TV see a &quot;black obj., w/ no lights&quot; streak by apt. window.  Later, saw beam of light over pond.  Called 911.","11/2/99"
"12/6/95 17:00","Bothell","WA","N/A","4 min.","Father &amp; daughter driving in car witness &quot;beautiful electric blue&quot; triang. shaped obj. in evening sky.  Flipped on side, maneuvered.","11/2/99"
"12/5/95 23:10","Salluit (Canada)","QC","Fireball","15-30 seconds","Blue fireball seen by three children in arctic","8/7/11"
"12/5/95 20:30","North Bend","WA","N/A","N/A","Newspaper reporter calls seeking information regarding sighting of peculiar object over N. Bend on prior night.","11/2/99"
"12/5/95 20:30","North Bend","WA","Chevron","4 min.","Two adults, 7 children, witness &quot;an orangey light, like an 1/8th moon,&quot; hover,  move south, then hover again in clouds. No sound.","11/2/99"
"12/4/95 22:16","Geneva","NY","N/A","25 min","Woman rpts a very bright stationary light in SE sky &quot;below Orion's Belt&quot; that looks &quot;like a horseshoe.&quot; Alternating red, blue, white.","11/2/99"
"12/4/95 02:14","Seattle","WA","Light","2 sec.","Man reports a brief power failure, looks outside and witnesses a luminous obj., size of star, streak from W to E in southern sky.","11/2/99"
"12/4/95 02:00","Deming","NM","Changing","40 -60 Min","Driving I10 west of Las Cruces NM a random shape object visable for more than 60 mins seem to follow my U-Hall truck.","12/7/06"
"12/3/95 23:00","Bakersfield (45 miles from)","CA","Light","N/A","We were on a road 1000 ft high from a lake driving up hill I see 1 light then 3 lights in a tryangal the 3 light come at us fast as tha","4/30/15"
"12/3/95 22:00","Nisqually Delta","WA","N/A","15 sec.","Woman &amp; husband, while driving S on Hwy. I-5, witness obj. beside road light up huge area of sky for 3 sec.,  again 10 min. later.","11/2/99"
"12/3/95 21:00","Boring","OR","N/A","15 min.","Woman, son, &amp; friend witness multiple, rapid red flashes in clouds in distance, then overhead.  No sound.  Other repts. to 911.","11/2/99"
"12/3/95 11:20","Chandler","AZ","N/A","12","Woman sees bright light in daytime sky. Was &quot;oriented vert,&quot; and was moving E to W, then to SW.  Moved fast. Saw 2nd light.","11/2/99"
"12/2/95 22:00","Sebastopal","CA","N/A","N/A","Man in car witnesses 2 peculiar lights, which suddenly became 3 lights, then began to move slowly.  Heard &quot;engine sound.&quot;","11/2/99"
"12/1/95 23:40","Orland Park","IL","N/A","18 min.","Man repts. seeing 4-5 very bright, multi-colored lights in southern night sky.  Appear to move, but very little. (Twinkling stars?)","11/2/99"
"12/1/95 22:55","Owosso","MI","Light","5 sec.","Pilot, former FAA controller, sees 5 &quot;pinkish&quot; small lights in clear area of sky, arranged in precise staggered-V formation, streak.","11/2/99"
"12/1/95 21:00","Mount Shasta","CA","N/A","N/A","Comm. pilot repts. witnessing multiple peculiar flashes of light from N of Mt. Shasta to Eugene, OR.  Bursts moved N w/ aircraft.","11/2/99"
"12/1/95 17:20","Waukesha","WI","N/A","2 sec.","Woman in car witnesses &quot;shooting star&quot; descend vertically, suddenly stop, suddenly shoot of horizontally.  Multiple lights on it.","11/2/99"
"11/30/95 22:35","Howell","NJ","N/A","5 min.","Man saw 2 lights, apparently coming directly toward him, then a 3rd appeared, forming a triangular shape.  Hovered nearby, faded.","11/2/99"
"11/29/95 21:28","Glen Ellen","CA","N/A","15 sec.","Woman calls to rept. that her son &amp; husband had seen a huge obj. w/ 3 red flashing lights.  &quot;Shape of sub on Seaquest TV program.&quot;","11/2/99"
"11/29/95 19:05","Redding","CA","N/A","5 min.","Woman witnesses bright &quot;star&quot; in NW sky which suddenly splits into two lights.  1 descends to hor., other rises vert., disappears.","11/2/99"
"11/29/95 16:40","Antelope Valley","CA","Light","10 sec.","Man on Hwy. 14 sees two bright objs. w/ trails behind them flying slowly along a parallel course.  Larger becomes black dot.","11/2/99"
"11/28/95 21:30","Bellevue","WA","N/A","15 sec.","Software engin. witnesses &quot;stripe&quot; of green light in N/S orientation across sky above scudding clouds. (Adv. laser light rptd. 28NO.)","11/2/99"
"11/28/95 21:00","Palm Springs","CA","N/A","38 min.","FAA employee calls regarding a shimmering, very colorful, stationary light in the eastern sky.  (Twinkling star??)","11/2/99"
"11/27/95 23:00","Fort Morgan","CO","N/A","2 hrs.","Woman reports a very bright, colorful, stationary object &quot;below the Belt of Orion.&quot;  (Possible flickering star??)","11/2/99"
"11/27/95 20:00","Lyons","CO","Other","20 minutes","Hole (50 feet by 30 feet) opens up on hill side.  Light streams from it along with motor noise.  Closes again and leaves no sign of exi","1/28/99"
"11/27/95 00:00","Hickory","NC","Sphere","7-10 minutes","Two bluish white orbs one bigger then other then at end did a u turn into space almost like something in a movie with no noise.","8/8/14"
"11/25/95 20:01","Woodland","CA","N/A","2 sec.","Two young boys witness 2 bright, white oval objs. streak to E, then to NE below the clouds.  Objs. were very bright.","11/2/99"
"11/25/95 00:42","Wishkah River","WA","N/A","N/A","Experienced MUFON investigator/law officer relays rpt that woman, son witnessed bizarre bright light, green beam near home.","11/2/99"
"11/24/95 18:00","Portland","MI","Disk","20-25 seconds","large saucer object with red and green light over highway that sped away at unbelievable speeds.","3/19/09"
"11/23/95 19:00","Loveland/Fort Collins","CO","Triangle","30 minutes","Triangle ship following a ball of light.","6/15/15"
"11/23/95 01:00","Gaithersberg","MD","Formation","15sec-1min","November, 1995 sighting of a red &quot;V&quot; formation followed by a wavy string of greenish lights.","1/11/05"
"11/22/95 20:03","Haltbro","PA","N/A","1 minute","Woman reported witnessing a cluster of &quot;gold cigars.&quot; Passed overhead very fast.  Objs. were thicker in center.  Distinctly gold.","11/2/99"
"11/22/95 19:45","Woodland","CA","N/A","N/A","Mother reported her son had become very agitated after witnessing a strange craft outside his bedroom.  Disc w/ &quot;fluttering&quot; sound.","11/2/99"
"11/21/95 23:30","Washburn","ND","Triangle","20 seconds","A bluish triangular object moving in a clockwise direction.","11/28/07"
"11/21/95 22:00","Memphis","TN","N/A","2 min.","Woman &amp; neighbor witness bizarre obj. pass overhead.  Obj. had long wings, &quot;like a glider,&quot; w/ 8-9 lights on each. It folded wings!!","11/2/99"
"11/21/95 18:00","Peyton","CO","N/A","5 min.","Young man&amp;mother; 2 intensely bright white lights, side by side, moving erratically across sky.  Green flashes, sonic","11/2/99"
"11/20/95 22:00","Christmas Valley","OR","Light","5 minutes","Three sitings, all in Oregon, at night, no visible moon","11/26/03"
"11/20/95 21:50","Bremerton","WA","N/A","2 sec.","Woman reports witnessing peculiar lights in W sky, which suddenly disappeared from sight.  Lights &quot;looked round.&quot;","11/2/99"
"11/20/95 20:25","Federal Way","WA","N/A","1 minute","Woman, friend,  observe very large obj. in sky w/. bizarre lights.  Stationary at first, then began to drift to W.  No sound.","11/2/99"
"11/20/95 19:12","Sumter","SC","N/A","20 sec.","Woman repts. her husband had just witnessed two bizarre ships, &quot;a round one, and a long torpedo-shaped obj.,&quot; pass overhead.","11/2/99"
"11/20/95 19:00","Mayfield","KY","Triangle","10 min.","family followed by darting, triangular objects.","9/24/03"
"11/20/95 13:42","Tampa","FL","N/A","N/A","Nursery owner repts. peculiar ring of flattened grass on his property.  Grass had been killed earlier w/ spray, but was matted down.","11/2/99"
"11/20/95 06:15","Belle Fourche","SD","N/A","2 sec.","MUFON State Dir. relays rpt:  Postal empl. heading W on highway witnesses very large white w/ green tail streak vert. to horizon.","11/2/99"
"11/20/95 05:15","College Station","TX","Light","15 seconds","One third larger and twice as bright as venus. The object did not twinkle as one would expect if it were a star.","1/28/99"
"11/20/95 02:00","Elizabethtown","KY","Other","2 minutes","The craft was about 200 feet in the air above the field and an adjacent house.","8/5/09"
"11/19/95 23:06","Virginia Beach","VA","N/A","25 sec.","Mother heard high-pitch whine pass over house.  Daughter witnessed large circular craft w/ multiple circular whitish, yellow lights.","11/2/99"
"11/19/95 23:06","Virginia Beach","VA","Circle","20-30 Seconds","A circular object with lights on the bottom, flying very low to the house, possibly about six stories high, there was a humming noise.","3/19/09"
"11/19/95 21:50","Olathe","KS","N/A","1 hour","Family repts. a stationary obj. in night sky that is flashing red, blue, silver.  Appears to rotate.  (Not inconsistent w/ star.)","11/2/99"
"11/19/95 20:45","Holton","KS","N/A","15 min.","Youth w/ friend pursue on Hwy. 16 &quot;triangular thing in sky, w/ yellow, blue, and green&quot; lights. Obj. turned abruptly, flew north.","11/2/99"
"11/19/95 18:37","Redding","CA","N/A","10 min.","Father w/ children witness orange ball of light bob above trees.  Suddenly witness streak of white light w/ green tail&quot; finger wide.","11/2/99"
"11/19/95 18:35","Placerville","CA","N/A","3 sec.","MUFON investigator relays rept. of multiple sightings of bizarre &quot;meteor.&quot;  Multiple newspaper articles.","11/2/99"
"11/19/95 18:30","Redding","CA","N/A","3 sec.","Woman in car facing E saw very bright, bizarre obj. streak horizontally from L to R.  Head was blue, tail was yellow, orange, red.","11/2/99"
"11/19/95 18:30","Carson City","NV","N/A","2 sec.","Woman calls after dramatic sighting of &quot;a red streak of light, w/ blue in middle&quot; moving SE to NW.  Width &quot;as thick as my thumb!&quot;","11/2/99"
"11/19/95 18:00","Trenton","IA","N/A","3 min.","Young man hunting sees two peculiar bright lights hovering in sky, &quot;like planets.&quot;  Suddenly they flashed, changed color, moved.","11/2/99"
"11/19/95 17:30","Phoenix","AZ","N/A","5 min.","Woman, grandson, and several other witnesses rept. approx. 10 shiny objs. maneuvering, reflecting sunlight overhead.  Streaked off.","11/2/99"
"11/19/95 00:26","Framingham","MA","N/A","50 sec.","Young woman repts. seeing w/ friends a large, round, bright obj. overhead.  Filled car w/ green light.  &quot;Pains in head.&quot;","11/2/99"
"11/18/95 21:00","Ringgold","GA","Delta","15 min.","On Saturday evening just after dark on November 18, 1995 an arrowhead-shaped ufo was spotted to the east approx. 100 yrds. from Davis R","4/26/00"
"11/18/95 17:40","Mojave","CA","N/A","35 min.","Woman repts. 2 objs., &quot;big and small,&quot; hovering in clear sky to SW.  Lights appear to blink or strobe.  Other witnesses.","11/2/99"
"11/18/95 15:08","Seattle","WA","N/A","N/A","Nat. UFO Rpt. Ctr. phones AP &amp; UPI wire services.  They have no info re 17NO95 sightings; express no desire to inspect data.","11/2/99"
"11/18/95 01:15","Muskegon","MI","N/A","12 min","Woman repts. daughter encountered intensely bright red, triangular obj. sitting on side of road.  Obj. rose, disappeared suddenly.","11/2/99"
"11/18/95 00:00","Orlando","FL","N/A","N/A","Woman repts. bizarre &quot;half circle&quot; obj. in sky to SE.  Projects ray downward!  Something appeared to &quot;fall&quot; from the main object.","11/2/99"
"11/17/95 23:30","Seattle","WA","N/A","20 min.","Young woman in Seattle Univ. dormitory sees bizarre, pronounced red, pink, blue intense, multiple flashes of light in clouds to east.","11/2/99"
"11/17/95 23:30","Seattle","WA","N/A","38 min.","2nd Seattle Univ. student calls to report remarkable &quot;pink and &quot; blue flashing lights in, or above the clouds.","11/2/99"
"11/17/95 23:30","Seymour-Johnson AFB","NC","N/A","N/A","Duty sergeant rpts multiple calls from citizens regarding 1 or more (?) objects hovering, maneuvering near USAF base. Radar neg.","11/2/99"
"11/17/95 23:00","Seattle","WA","N/A","3 hrs.","Young woman repts. witnessing multiple &quot;flashes of red and blue light&quot; in and above the clouds.  Were to the NE of Capitol Hill.","11/2/99"
"11/17/95 23:00","Arlington","WA","N/A","N/A","MUFON member relays multiple reports about people who witnessed &quot;pink and blue flashes&quot; same night as sightings over Seattle.","11/2/99"
"11/17/95 23:00","Seattle","WA","N/A","3 hrs.","Man repts. witnessing peculiar red and blue flashes over Seattle.  One flash filled 180 deg. of sky w/ red light.  Observed an orb.","11/2/99"
"11/17/95 22:35","Biddeford","ME","N/A","2 min.","Man leaves work at hospital, encounters large &quot;plate-shaped obj. w/ 3 multi-color rings around it.&quot;  Obj crossed road, rose vert.","11/2/99"
"11/17/95 22:30","Fall River","MA","N/A","10 sec.","Young woman saw extremely bright white light with green tail streak toward the south.  No sound.","11/2/99"
"11/17/95 22:27","York","ME","N/A","5 sec.","Father, son, &amp; many bystanders witness incredible &quot;starlike&quot; obj. w/ &quot;white aura, long green tail,&quot; STREAK FAST from NE to SW.","11/2/99"
"11/17/95 22:26","Yarmouth","ME","N/A","5 sec.","Young man reports huge, bright white light, &quot;w/ green wake,&quot; pass overhead very fast.  Other witnesses stopped cars.","11/2/99"
"11/17/95 22:25","Lower Nazareth","PA","N/A","3 min.","Woman witnesses huge, triangular-shaped ship, covered w/ bizarre lights, &quot;like traffic lights.&quot;  Very dramatic sighting.","11/2/99"
"11/17/95 22:20","Basking Ridge","NJ","N/A","4 sec.","Young man, while driving N, witnesses dramatic white fireball to east streak N to S.  Sees similar red streak N to S in W sky!","11/2/99"
"11/17/95 22:20","FAA (Sector 18)","NY","N/A","5 sec.","FAA Boston Cntr. relays 2 rpts:  2 comm. jetliner crews rept very bright light, green tail, pass by them on N side very fast. Close.","11/2/99"
"11/17/95 22:20","Orange","VT","N/A","15 minutes","Woman witnesses multiple red, radiant objs. hovering over her mountaintop farm, then immense white flash.  Objs. streaked S (?).","11/2/99"
"11/17/95 22:05","Moriches (Long Island)","NY","Other","1-2 mins","NY Radar Air Traffic  Controllers see UFO over Long Island.","5/13/12"
"11/17/95 21:00","Merrick (Long Island)","NY","Chevron","30 sec.","Reading text of Lufthansa Pilots sighting that night,  jogged my memory, of my own sighting that night.","2/24/07"
"11/17/95 17:18","Simsbury","CT","N/A","2 sec.","Woman &amp; friend (pilot) see very large blazing yellow/orange &quot;comet&quot; streak horiz. E to W, explode. Changed course, dropped vert.!","3/19/02"
"11/17/95 00:30","Tacoma","WA","N/A","N/A","Young man repts. he returned home from store, neighborhood boys excited about strange obj. that had just passed overhead.","11/2/99"
"11/16/95 21:40","Elk Grove","CA","N/A","40 sec.","Woman outside smoking sees bizarre craft &quot;w/ red lights&quot; pass silently overhead.  When she peered around house, was gone.","3/19/02"
"11/15/95 23:00","North East","MD","Oval","10 minutes","UFO hovers right above a rural house and field","3/16/01"
"11/15/95 22:30","Boulder","CO","Formation","10 sec.","I was sitting in my back yard talking on the phone.When I saw 1 green dot fly south Followed by 2 more green dots flying parallel to ea","11/17/99"
"11/15/95 22:00","La Puente","CA","Other","15 seconds","Four large luminous disks arranged like the engines of a 4-engine plane flew north to south at low altitude and silently.","8/5/01"
"11/15/95 19:30","Milwaukee","WI","Fireball","15 seconds?","Fireball in Milwaukee","9/9/03"
"11/15/95 03:00","Green Co.","TN","N/A","2 hrs.","FAA empl. relays facts of written rept.  Man and woman encounter 3 bizarre ships that hovered over them on Hwy. 70.","11/2/99"
"11/14/95 18:45","Midway","GA","N/A","2 min.","Mother notices &quot;aircraft&quot; over Midway River, suddenly &quot;engine noise&quot; seem to slow.  She &amp; kids see 2 &quot;mushroom shaped&quot; craft.","11/2/99"
"11/14/95 18:30","American Canyon","CA","N/A","30 min.","Woman and daughter witness w/ binoculars 2 strange lights in sky.  Flashing white, red, green.  (Not inconsistent w/ twinkling star.)","11/2/99"
"11/13/95 19:50","Lake Oswego","OR","N/A","12 min.","Woman repts. three peculiar green beams of light overhead.  (MUFON investigator reptd. was probably laser-based adv. light.)","11/2/99"
"11/13/95 00:15","Birmingham","AL","N/A","2 sec.","Man standing outside sees what looks like &quot;shooting star.&quot; Obj. split into 3 lights, &quot;like isosceles triangle,&quot; shot across sky to SE","11/2/99"
"11/12/95 23:20","Roy","UT","Triangle","10 Minutes","At 11:20 PM as I saw a triange shaped object with 7 red lights moving slowly to the south.","1/28/99"
"11/12/95 21:00","Las Vegas","NV","N/A","45 min.","Woman repts. two stationary, &quot;colorful,&quot; lights to W &amp; NW of her position.  (Description not inconsistent w/ twinkling stars.)","11/2/99"
"11/12/95 19:00","Keesler AFB","MS","N/A","1 hour","Man rpts. bizarre obj moving in night sky near &quot;Keesler&quot; (AFB?).  Other objs near.  All w/ strange red &amp; blue lights, maneuvered.","9/19/02"
"11/11/95 21:45","Kirkland","WA","N/A","10 sec.","Woman on cruise boat sees large obj. w/ 8-10 strange red lights, passes overhead N to S, dips, rises vert. out of sight! No sound.","11/2/99"
"11/11/95 19:00","Solvang","CA","N/A","10 min.","Two young women driving to party encounter a large cylindrical-shaped obj. &quot;w/ a lot of lights on it.&quot; Drifted slowly, streaked.","11/2/99"
"11/11/95 18:25","Rock Island","WA","Light","20 sec.","Man on Hwy 28 sees extremely bright obj. &quot;shoot across windshield,&quot; blow up into many fragments when it entered cloud of fog.","11/2/99"
"11/11/95 10:00","Pichacho Peak","AZ","Circle","15 min","Driving from Phoenix to Tucson Arizona,about half way (Marana Arizona), Nov. 11, 1995 I looked toward Kitt Peak (the famous observatory","10/31/03"
"11/11/95 01:15","Eugene","OR","N/A","10 min.","Three adults hear a strange noise, see a strange &quot;star&quot; to W.  Obj. does gyrations, then streaks N.  10 min. later, they see 3 more.","11/2/99"
"11/10/95 23:45","Brownsville","TX","Circle","10 minutes","A late night experience of a rotating ball with changing colors, and a aura","3/16/01"
"11/10/95 23:25","Auburn","WA","N/A","10 sec.","Man experienced 15 sec. power outage in Enumclaw, then witnesses major blue, then green flash south of Auburn. 50 deg. of sky.","11/2/99"
"11/10/95 21:00","Eilmsport","PA","N/A","N/A","PA Emer. Man. Agency relays report from citizen regarding &quot;UFO sighting.&quot;  (Established 19NO95 they were advertising lights.)","11/2/99"
"11/10/95 20:00","Embarrass","MN","Disk","1-3 mins","craft sighted hovering over trees in rural minnesota","8/4/03"
"11/10/95 19:50","Beaverton","OR","N/A","40 min.","Family returns from restaurant and notice &quot;emerald green beam&quot; of light going horizontally over their home. Beam ended abruptly.","11/2/99"
"11/9/95 16:30","Elizabeth","NJ","Oval","90 seconds ?","While driving on Route 1&amp;9 in Elizabeth Near Newark Airport I was looking at an airplane that was taking off on an upward incline. At t","8/30/99"
"11/8/95 19:00","Pilot Rock","OR","Light","1 hour","Two brothers witness cluster of 4 bizarre blue-white lights ahead on highway.  Strange effects. Drove 98.7 miles on 2 gal. gas.","11/2/99"
