"Date / Time","City","State","Shape","Duration","Summary","Posted"
"10/3/05 12:00","Westfir","OR","Other","20 minutes","clear real photo graph of extraterestrel","10/11/05"
"10/3/05 11:00","San Jose","CA","Formation","3 min","It was 11:00 am, my daughter 4 1/2 was our front feeding our dog, I was inside. Then I hear her yell  &quot;Momma, Momma, come look at the s","10/11/05"
"10/3/05 07:09","Sacramento","CA","Oval","east","a small oval object in the sky wit a flash in on it.","10/11/05"
"10/2/05 19:30","Hillsborough","NJ","Triangle","5 minutes","Very large, bright orange triangle shaped object moving slowly through the sky.","10/11/05"
"10/2/05 18:20","Strasburg","CO","Oval","15 min","Metallic oval or cylinder , daytime, visable for 15 min, splits into 3 objects,Strasburg Colorado","10/11/05"
"10/2/05 18:00","New York City (Manhattan)","NY","Other","3 minutes","Did anyone see a very strange object flying above New York City on October 2, 2005?  I have pictures","2/14/06"
"10/2/05 17:30","Providence","RI","Changing","5 minutes","White tear drop shaped object that was visible to the naked eye that I noticed after an aircraft flew overhead.","10/11/05"
"10/2/05 15:00","Toronto (Canada)","ON","Egg","2 minutes","It zigzaged  around and went very fast. It had lights that were not flashing","10/11/05"
"10/2/05 09:15","San marcos","TX","Diamond","1.5 hours","Very bright light was seen over South direction","10/11/05"
"10/2/05 05:00","Dividing Creek","NJ","Circle","10min","Round, red object flew liesurely then soared  at tree level-it's color intensified and it quickly zig-zagged (3x) then traveled away.","10/20/05"
"10/2/05 04:00","Chicago","IL","Light","3-4min","I saw a red lite moving accross the sky very slowly and totally silent.","10/11/05"
"10/2/05 03:00","Westfield","MA","Light",">1.5 Hours","Three bright lights appeard at different times.  Moving in zig-zag patterns in the sky over a long period of time.","10/11/05"
"10/2/05 02:00","Edina","MN","Formation","3-5 Seconds","Triangle Formation","10/11/05"
"10/2/05 00:30","Heflin","AL","Circle","five min","Object with bright red light hovered above my car siletly, and followed me for about five minutes then disappeared.","8/7/07"
"10/1/05 23:00","Tinley Park","IL","Light","minutes","Seen over the Tinley Park, IL. area. Three red lights hovering in the sky. Changed from red to green and back again.","10/11/05"
"10/1/05 22:30","Portage La Prairie (Canada0","MB","Other","30 seconds","Six lights in a strange formation surrounded by two long rectagular objects","10/30/12"
"10/1/05 22:00","Central Lake","MI","Unknown","25 min","Lights over Traverse Bay 35min moving than fixed position","10/11/05"
"10/1/05 21:41","Montr&eacute;al (Canada)","QC","Changing","Don't know","I just want to take a picture of Montr&eacute;al and when i come here in front on my computer i see that green and orange thing in front of me","10/11/05"
"10/1/05 21:30","Laurelville","OH","Unknown","5 mins","Very slow moving object that made no sound.","1/10/09"
"10/1/05 21:30","Oklahoma City","OK","Light","45mins","I WAS LEAVING EL RENO,OKLAHOMA,APPROXIMATELY 40 MILES WEST OF OKC ABOUT 9PM. TRAVELING NORTH ON HWY 81 I NOTICED A VERY BRIGHT STAR-LIK","10/11/05"
"10/1/05 20:30","Napa","CA","Unknown","20 minutes","Dim Flapping Object in Napa Sky October 1st","10/11/05"
"10/1/05 20:08","Hamilton (Canada)","ON","Light","15 seconds","2 bright lights simutaneously travelling north - Hamilton Ontario Canada -","10/11/05"
"10/1/05 20:05","Liberty Hill","TX","Light","15 minutes","seven objects sighted with one apparantly landing","10/11/05"
"10/1/05 20:05","San Jose","CA","Chevron","10mins","One star shaped object, another V shaped object blending in with the nighttime clouds","10/11/05"
"10/1/05 19:58","Rogers","MN","Triangle","17 Minutes","Triangular UFO hovered with Stench","10/20/05"
"10/1/05 19:00","Winnamac","IN","Triangle","15 seconds","orange triangular shape that turned on and off two times","10/11/05"
"10/1/05 18:00","West Palm Beach","FL","Teardrop","1 min","I've seen the black teardrop/sphere/baloon too....","3/11/06"
"10/1/05 17:00","Los Angeles","CA","Formation","25 mins","4 UFOs in a big arrowlike formation at high altitude over downtown part of Los Angeles","10/11/05"
"10/1/05 15:00","Phoenix","AZ","Oval","3 minutes","A huge, metallic-silver colored,  oval object  was observed over the Estrella Mountains during the day.","5/15/06"
"10/1/05 12:00","Lake Worth","FL","Sphere","3 minutes","LARGE SPHERE SHAPPED OBJECT SIGHTED HOVERING WEST OF LAKE WORTH","10/11/05"
"10/1/05 09:30","Albuquerque","NM","Disk","10 minutes","Two blue pinpoints of light merge onto one silver disk.","10/20/05"
"10/1/05 08:30","Vanderbilt","MI","Circle","N/A","white light bright 60 - 75 mph it was about 30 min long","10/11/05"
"10/1/05 08:22","Homestead","FL","Light","5mins","its the same spot where my brother said he saw sumtin up in tha sky a few years earlier....","10/11/05"
"10/1/05 06:30","Greenup","KY","Circle","30 seconds","This has happened more than once! We saw a orange circle of light moving slowly through the sky, shooting about two inches to the human","10/11/05"
"10/1/05 03:00","Posen","IL","Light","10-20 minutes","3 Red lights in triangle formation moving slowly and silently","10/11/05"
"10/1/05 01:10","Alsip","IL","Light","8 minutes","RED LIGHTS SEEN IN ALSIP ILLINOIS","10/11/05"
"10/1/05 01:10","Cuyahoga Falls","OH","Other","5-7 seconds","V-shaped object seen in sky of Cuyahoga Falls, Ohio","2/14/06"
"10/1/05 01:10","Oak Forest","IL","Light","15-30min","3 red lights over chicagoland area","10/11/05"
"10/1/05 01:10","Oak Forest","IL","Cylinder","2 hours","There were 3 red lights, sometimes they were in a trianlge and than in straight line. they went away one by on. After 1:00 am","10/11/05"
"10/1/05 01:10","Manhattan","IL","Triangle","10 seconds","Tinley Park Lights Are Back!!!","10/11/05"
"10/1/05 01:10","Crestwood","IL","Light","5 min","3 small lights formed a triangle then straight line, took a digital picture, zoomed in a saw 3 lights inside each individual","10/11/05"
"10/1/05 01:10","Tinley Park","IL","Triangle","N/A","sitting in my yard 1:10 am i saw three red lights above my house in a triangle form i shined a light on it when i noticed it came close","10/11/05"
"10/1/05 01:10","Oak Forest","IL","Unknown","60 seconds","it lasted for about one minute","10/11/05"
"10/1/05 01:10","Hillside","IL","Changing","1/2 hour","Initially observed a white dot in the northwestern sky which prompted me to obtain my binoculars to obtain a closer look. I then observ","10/11/05"
"10/1/05 01:08","Evergreen Park","IL","Light","8 minutes","Two red lights sitting in the sky, but I couldn't not make out an object.","10/11/05"
"10/1/05 01:03","Oak Forest","IL","Light","20:00 minutes","red dots seen in sky formed triangle","10/11/05"
"10/1/05 01:00","Tinley Park","IL","Formation","20 minutes","Three Red Lights Over Tinley Park","10/11/05"
"10/1/05 01:00","Tinley Park","IL","Circle","10 minutes","3 red lights in Tinley Park sky","10/11/05"
"10/1/05 01:00","Oak Forest","IL","Changing","5-10 minutes","3 red lights altered formations and each indiviadual light disappeared at different times","10/11/05"
"10/1/05 01:00","Midlothian","IL","Light","20-25minutes","Red lights, southland Chicago","10/11/05"
"10/1/05 01:00","Tinley Park","IL","Triangle","15 mins.","saw three red glowing lights in the sky above, in Tinley park Il.","10/11/05"
"10/1/05 01:00","Posen/Midlothian","IL","Formation","about 15 minutes","3 Red Lights slowly flew over South Suburbs of Chicago at 1am 1Oct05, then disappeared one at a time.","10/11/05"
"10/1/05 01:00","Oak Forest","IL","Light","Five to Ten Minutes","That night after closing my garage door I glanced as I normally do towards the North Star..to my amazement just west of the North star","10/11/05"
"10/1/05 01:00","Tinley Park","IL","Triangle","30 min +","I saw 3 red flashing/blinking  lights in sky 1:00am 10-1-05 over Tinley Park IL","10/11/05"
"10/1/05 01:00","Tinley Park","IL","Triangle","N/A","3 red lights in Tinley Park","10/11/05"
"10/1/05 01:00","Tinley Park","IL","Circle","10 mins","Three red blinking dots in the sky that hoovered unlike an airplane that I know of.","10/11/05"
"10/1/05 01:00","Tinley Park","IL","Triangle","?","3 red lights in a triagular shape that held position for awhile, then one light flew off very quickly","10/11/05"
"10/1/05 00:57","Orland Park","IL","Light","7 minutes","Red lights in sky over Orland Park, Illinois","10/11/05"
"10/1/05 00:57","Orland Park","IL","Light",":06","Red lights over Orland Park","10/11/05"
"10/1/05 00:55","Midlothian/Posen","IL","Light","10-15 minutes","3 pulsing red lights in triangular formation over Midlothian &amp; Posen, IL...One by one they flicker out and dissappear.","10/11/05"
"10/1/05 00:53","Tinley Park","IL","Circle","15-20 minutes","3 red lights over Tinley Park","10/11/05"
"10/1/05 00:40","Orland Park","IL","Diamond","45 min","3 red lights hovering in the northeast sky","10/11/05"
"10/1/05 00:30","Oak Forest","IL","Light","hour","I saw the three red lights in the sky over Oak Forest Illinois. They flashed like beacons. This happened around 12:30am","10/11/05"
"10/1/05 00:00","Evergreen Park/Tinley Park/Orland Park","IL","Light","from 11pm - 1:30 Am","strange. dozens saw it . happens all the time","10/11/05"
"10/1/05 00:00","Harrisburg","MO","Light","40 minutes","The waves of lights seemed to materialize high in the sky and move in an &quot;ocean tidal manner&quot;  that is one wave after another,","12/12/09"
"10/1/05 00:00","Oak Forest","IL","Circle","1 hour","At approximitly 0:00 I spotted three red circular lights in the western skies over Oak Forest, IL.  The three large red light seemed mo","10/11/05"
"9/30/05 23:50","Orland Park","IL","Light","15-20 minutes","Two pulsing bright red lights in eastern sky seen around 11:30 p.m. from my backyard in Orland Park, IL","10/11/05"
"9/30/05 23:45","Tucson","AZ","Light","30 seconds","Brilliant light over the Catalinas","10/11/05"
"9/30/05 23:30","Tinley Park","IL","Changing","15-20 min","red lights over tinley park, IL","10/11/05"
"9/30/05 23:30","Oak Forest","IL","Circle","five minutes","red circle in sky flashing on and off","10/11/05"
"9/30/05 23:30","Tinley Park","IL","Circle","hour","The 3 red lights of south chicago","10/11/05"
"9/30/05 23:30","Tinley Park/Oak Forest","IL","Formation","not sure","Tinley Park Lights May have retured Three red lights in a triangular formation","10/11/05"
"9/30/05 23:30","Orland Park","IL","Triangle","10-15 minutes","Three red lights that formed a triangle.","10/11/05"
"9/30/05 23:30","Grande Prairie (Canada)","AB","Light","7 - 8 seconds","4 lights moving across the Grande Prairie Night Sky","10/11/05"
"9/30/05 23:25","Tinley Park","IL","Light","7-10 minutes","Two red lights in the sky","10/11/05"
"9/30/05 23:25","Orland Park","IL","Light","10 minutes","Red lights over sky of Orland Park, IL","10/11/05"
"9/30/05 23:23","Palos Heights","IL","Light","5 minutes","UFO spotted over Chicago's Southwest suburbs","10/11/05"
"9/30/05 23:18","Tinley Park","IL","Circle","10 min","Sept. 30th 2005 Red Lights Sighting 11:18pm Tinley Park, IL","10/11/05"
"9/30/05 23:15","Oak Forest","IL","Circle","20 minutes","two bright lights moving slowly from  west to east. bright red stars","10/11/05"
"9/30/05 23:15","Oak Forest","IL","Sphere","10 minutes approx","2 Red light ufo's passing across sky 9/ 30/05 from west to east and 3 red lights ufo's on 10/1/05 w/ ext. video","10/11/05"
"9/30/05 23:15","Sugar Grove","IL","Light","15 Min","3 red lights - triangle shape N NE sky 45 degree angle off of horizon","5/15/06"
"9/30/05 23:15","Oak Forest","IL","Light","30minutes","2 Bright Red lights above my house, then gain altitude before heading east very slowly","10/11/05"
"9/30/05 23:15","Tinley Park","IL","Unknown","15 minutes","2 red lights moving west to east","10/11/05"
"9/30/05 23:15","Orland Park","IL","Formation","20-25 minutes","Two red lights of undetermined origin over Orland Park, IL (USA)","10/11/05"
"9/30/05 23:10","Joliet/Orland Hills","IL","Light","25min","Red Lights over Illinois","10/11/05"
"9/30/05 23:00","Orland Park","IL","Light","45min","there were 3 red lights seen in the east sky, in the shape of a triangle.  there was originally one light and then 2 more came from the","10/11/05"
"9/30/05 23:00","Orland Park","IL","Circle","2 hours","3 red objects in the sky","10/11/05"
"9/30/05 23:00","Oak Forest","IL","Triangle","30 minutes","Strange red lights as big as stars, blinking slowly.","10/11/05"
"9/30/05 23:00","Tinley Park","IL","Light","20-30 min","RED LIGHTS IN TINLEY PARK  THIRD TIME IN 13 months","10/11/05"
"9/30/05 23:00","Orland Hills","IL","Unknown","15min","Two red light just hovering","10/11/05"
"9/30/05 23:00","Tinley Park","IL","Light","1 hour","2 objects that moved uniformally slowly, quickly, and stopping and staying together","10/11/05"
"9/30/05 23:00","Orland Park","IL","Light","45 minutes","September 30th sights in Orland Park Illinois of the 3 red lights.","10/11/05"
"9/30/05 23:00","Tinley Park","IL","Light","10 min","Two round red lights moving from wws to een in the night sky.","10/11/05"
"9/30/05 23:00","Tinley Park","IL","Triangle","20 minutes","On Friday,September 1st at 11:00 PM, four of us who live in Tinley Park spotted 3 red lights that formed a triangle in the night sky. I","10/11/05"
"9/30/05 23:00","Orland Park","IL","Light","5-7 minutes","Strang red lights appear in the sky.","10/11/05"
"9/30/05 23:00","Oak Forest","IL","Sphere","10 minutes","two red lights were dangling in the air looking just like stars just disappeared  after about 10 minutes","10/11/05"
"9/30/05 23:00","New Lenox","IL","Light","5 min","strange red lights verticle  in a row in the sky.","10/11/05"
"9/30/05 23:00","Orland Hills","IL","Light","15:00 min.","My wife and I both watched 3 red lights to the east of our home for about 15:00 min.They didn't do much just slowly got closer to e","10/11/05"
"9/30/05 23:00","Tinley Park","IL","Light","15min","2 red lights nest to star. hovered for fifteen minutes or so, moving in a vertical fashion(up&amp;down). Had blinking red lights","10/11/05"
"9/30/05 23:00","Oak Forest","IL","Light","20:00 minutes","red dots seen in sky looked like a cell phone tower","10/11/05"
"9/30/05 23:00","Tinley Park","IL","Circle","10-15 Minutes","Two  bright red objects move across sky west to east with no set speed or direction.","10/11/05"
"9/30/05 23:00","Tinley Park","IL","Unknown","30 minutes","UFO red lights in sky over tinley park, very descriptive explanation.","10/11/05"
"9/30/05 23:00","Orland Park","IL","Other","10-15 minutes","My friends and I saw three lights that resembled bright red stars rearranging themselves in the northern sky.","11/3/05"
"9/30/05 22:30","Ashland","PA","Circle","45 minutes","Circle of lighst  ((NUFORC Note:  Suspected sighting of a star or planet.  PD))","10/11/05"
"9/30/05 22:30","Crystal Lake","IL","Cigar","4 Minutes","Cigar shaped oject over Crystal Lake, IL with one red and several white lights hovering slowly then faded into space leaving a trail","10/11/05"
"9/30/05 22:00","Mitchell","IN","Light","Hours","((NUFORC Note:  Star or planet?  PD)Brilliant white light, very high, swaying left, right, up, down, slowly but continuously moving up","10/11/05"
"9/30/05 21:45","Pueblo","CO","Triangle","20 SEC","TRIANGLE IN THE SKY","10/11/05"
"9/30/05 21:15","Chicago","IL","Light","3 mins","several peculiar red lights flew about in a formation and appeared to climb","5/15/06"
"9/30/05 20:52","Ventura","CA","Sphere","5-8 seconds","2 &quot;cotton balls&quot; of light on same course moving quickly East to West","10/11/05"
"9/30/05 20:30","Summit","IL","Flash","2 min.","I was sitting in the back seat of my mom's car at the Summit Amtrak station waiting for my sister's train to arrive.  It was approximat","10/11/05"
"9/30/05 20:20","Overgaard","AZ","Sphere","30 - 40 seconds","Brilliant white sphere instantly appearing in night skies over Heber-Overgaard, Arizona","10/11/05"
"9/30/05 20:15","New York State Thruway / Catskill","NY","Light","15 mins","UFO Spotted over the New York State Thruway !!","10/11/05"
"9/30/05 19:20","Bourbonnais","IL","Light","6 to 8 seconds","((NUFORC Note:  Possible satellites?  PD))  Bourbonnais, Il,   09-30-05  (2) bright moving lights,very high - lasting  6 - 8 seconds","10/11/05"
"9/30/05 18:45","Reno","NV","Fireball","less than a minute","Fireball seen in sky over SE Reno.","10/11/05"
"9/30/05 18:28","Coral Springs","FL","Disk","1 minute","SHIP BY THE SUN  TOOK A PICTURE IN AMAZEMENT","10/11/05"
"9/30/05 16:00","New York City (Manhattan)","NY","Other","10 mins","Silver object above Manhattan, NYC","10/11/05"
"9/30/05 15:15","Monticello","KY","Rectangle","30sec.&amp;1mim.","We saw a sm, rectang. object 2x with a hum &amp; circ., wavy-patterned air around it make quick 90 deg turns w unbelievable speed","10/11/05"
"9/30/05 10:00","Bellefonte","PA","Cigar","2 hours","Black tubular telephone size object flying over the Bellefonte PA (near a airport &amp; Penn State) approximately 10:30am on 9/30/2005.","10/11/05"
"9/30/05 09:30","San Antonio","TX","Light","4 minutes","Three bright orbs of light over San Antonio suburb.","8/7/07"
"9/30/05 07:50","Vacaville","CA","Disk","10 minutes","saucer octagon shape lights on corners and a blue light on the bottom","10/11/05"
"9/30/05 07:50","New Haven","IN","Cigar","6 minutes","Big as a jumbo jet, silver and red, no noise, no smoke, danced acrossed the sky.","10/11/05"
"9/30/05 05:04","Farmington","UT","Rectangle","25 Seconds","Farmington Utah bright white light with blue in the middle in the shape of fixed wing aircraft flying Southwest to Northeast.","10/11/05"
"9/30/05 04:55","Paducah","KY","Triangle","8 min","Strange encounter with unknown craft.","10/11/05"
"9/30/05 04:45","New Lenox","IL","Triangle","5 minutes","triangle of stars breaking off in diffrent directions","10/11/05"
"9/30/05 02:10","Prescott Valley","AZ","Fireball","6 minutes","At 2:10 AM i was in my back yard and saw an orange glow through my neighbors trees.  It was going up (or approaching from the distance)","10/20/05"
"9/30/05 01:00","Lapeer","MI","Light","N/A","((NUFORC Note:  Suspected advertising lights.  PD))  3 glowing objects making a unique pattern in the sky.","10/11/05"
"9/29/05 21:30","Plymouth","PA","Sphere","7","Sphere shaped object very similar to a star very close to it, only larger and brighter.","10/11/05"
"9/29/05 20:45","Fayetteville","AR","Cigar","10 seconds","Ultra black, cigar shaped object streaks across night sky over Fayetteville, Arkansas","10/11/05"
"9/29/05 20:40","Franklin","TN","Light","120 seconds","Fast moving noiseless object with three solid red lights shining at approximately -2.5 magitude.","10/11/05"
"9/29/05 20:30","Media","PA","Flash","4 min","During Astronomy Lab course at Delaware County Community College. Students were looking at the constellation Cassiopeia when left of th","10/11/05"
"9/29/05 20:25","Ocean City","MD","Circle","20 mins","North of Ocean City Md on 9/29/05 white blinking light moved quickly north then returned and left again","10/11/05"
"9/29/05 20:00","Port Richey","FL","Unknown","1 hour","Bright Lights Above Port Richey.","10/11/05"
"9/29/05 19:15","East Meadow","NY","Other","5 seconds","Bright Shooting Object Observed Flying North at Rapid Speed and Appeared to Loop Straight Down","10/11/05"
"9/29/05 19:00","Miami","FL","Fireball","5sec","HUGE OBJECT ON FIRE APPROACHING EARTH AT HIGH SPEED SEEN FROM MIAMI, FL","10/11/05"
"9/29/05 19:00","Florida (coastline)","FL","Fireball","about 20 secs","Fireballs seen along Florida's coastline in a couple weeks","10/11/05"
"9/29/05 18:50","Lake Worth","FL","Unknown","seconds","we just saw a big flash in the sky on the eastern horizon , when we looked up the only thing there was a  line of smoke like if a airpl","10/11/05"
"9/29/05 18:00","West Palm Beach","FL","Unknown","30","bright light streaking and smoke floowing the burn up.","10/11/05"
"9/29/05 12:00","Fresno","CA","Formation","10-15 minutes","15-20 flying formation objects seen from Fresno, CA","10/11/05"
"9/29/05 08:45","Spring Valley","CA","Egg","10 seconds","Egg-shaped metal object that remained stationary in sky, and disappeared as I watched.","10/11/05"
"9/29/05 06:10","St. Michaels","AZ","Light","50 minutes","Multiple Lights Appear in the Morning Sky, Persist For At Least 40 Minutes","10/11/05"
"9/29/05 04:07","Reno","NV","Chevron","10 seconds","Dimly lighted chevron object moving quickly over NW Reno.","10/11/05"
"9/29/05 02:00","Carpinteria","CA","Circle","N/A","Circle of lights in the sky over Carpinteria CA","10/11/05"
"9/28/05 23:00","Duxbury","MA","Light","10 Minutes","Strange bobbing light above horizon.","10/11/05"
"9/28/05 23:00","Bamfield (Canada)","BC","Light","6 houres","We watched a light for 6 houres drag somthing off Diana Island and ride it out over the hurison.","10/31/08"
"9/28/05 22:30","Shoreview","MN","Circle","7seconds","glowing orb","10/11/05"
"9/28/05 22:00","Chicago Heights","IL","Cigar","5 minutes","high pitched whirling noise and random lights moving very quickly with sharp turns.","10/11/05"
"9/28/05 21:30","Kinston","NC","Formation","2 mins.","Vshape with light orange glow to it....very wide in shape","10/11/05"
"9/28/05 21:30","Oak Bluffs","MA","Oval","15 minutes","Went on my second floor balcony at 8:30 pm and noticed very bright yellowish light at 30 degrees above the horizon. Object too bright t","10/11/05"
"9/28/05 21:10","Valley Springs","CA","Light","5 to 6 minutes","Very bright light appears, disappears, reappears.","10/11/05"
"9/28/05 16:30","Wyoming (I-80, westbound)","WY","Other","20 minutes","Interstate 80, westbound, Wyoming,  flying object seen by police officer and family.","3/11/06"
"9/28/05 13:30","Pinecrest","CA","Disk","seconds","spider like threads and a saucer","10/11/05"
"9/28/05 05:52","Port Richey","FL","Other","3 Seconds","Unique Flying Boomerang Seen !","10/11/05"
"9/28/05 02:38","Jacksonville Beach","FL","Triangle","15 minutes","Huge triangle of lights gliding smoothly southeast with no sound.","10/11/05"
"9/28/05 02:29","Long Beach","CA","Fireball","1 second","Bright green fireball decended straight down from the sky, it faded about 100 feet before hitting the ground.","10/11/05"
"9/28/05 01:38","St. Charles","MO","Changing","20 seconds","We watched 4 lights expand and contract at astonishing speeds in the night sky, then vanish.","10/11/05"
"9/28/05 01:00","Colorado (site unspecified by witness)","CO","Fireball","N/A","I went outside to have a cigg. before I go to bed , and about 2 minutes after looking up at the sky a blue and orange something shoots","10/11/05"
"9/28/05 01:00","Morgantown","WV","Chevron","45 minutes","orange orb seen rising into large chevron shaped object, plus other crafts visible","10/11/05"
"9/27/05 21:00","Gail","TX","Circle","3 min","i live on lake thomas in borden co. we were out looking for sign of some wild hogs that go up and down the colorado river just after da","10/11/05"
"9/27/05 20:35","Goffstown","NH","Light","23 minutes","Two Bright Lights Hovered over Power Lines","10/11/05"
"9/27/05 20:30","San Antonio","TX","Light","10-15 sec","Light in night sky","10/11/05"
"9/27/05 14:00","Dockstader Park","UT","Disk","N/A","Two Disks Over Park.","10/11/05"
"9/27/05 06:30","Bakersfield","CA","Unknown","10 minutes","While driving to work at 6:30 am I observed a jet trail streaking across the sky at a very fast rate. what appeared to be faster than m","10/11/05"
"9/27/05 00:15","Jackson","NJ","Light","N/A","Light dimming and brightening.","10/11/05"
"9/26/05 23:48","Bay City","MI","Triangle","1 min","Huge non lite craft with spheres attached and trailing over Bay City Michigan.","10/11/05"
"9/26/05 23:39","Indian Harbour Beach","FL","Fireball","one minute","11:39 pm watched a  huge yellow ball of flame slowly cross the sky leaving glowing pieces falling behind","10/11/05"
"9/26/05 23:30","Warrenville/Wheaton","IL","Changing","3-4 minutes","RAPID MOVING","10/11/05"
"9/26/05 22:00","Kings Park","NY","Light","4 seconds","Intense Bright light  appears to make jet alter flight path","10/11/05"
"9/26/05 20:00","Kansas City","MO","Circle","20  minutes","Orange Glow over Kansas City seen for 20 minutes.","10/11/05"
"9/26/05 20:00","Ellsworth","WI","Formation","2+ Hours","I was driving home from Hudson, and had just driven through River Falls when I spotted the first one. It was a very bright light, large","10/8/07"
"9/26/05 19:00","Watsonville","CA","Triangle","25minutes","it was similar to a manta  ray with no tail bobbing in the sky, black with soft edges","10/11/05"
"9/26/05 11:00","Teton National Park","WY","Other","N/A","I like to look at this web-cam at the Grand Tetons about a couple of times a week because I think the Tetons are the most beautiful mou","10/11/05"
"9/26/05 09:24","Holland","MI","Triangle","N/A","4 Objecst Flow over us and the hot tub we wactched then all the objects disapeared.","10/11/05"
"9/26/05 03:15","Panama City","FL","Flash","In The Sky","Unidentifed Flashing Object In Sky, Observed.","10/11/05"
"9/26/05 00:05","Palm Springs","CA","Chevron","1 minute","Dark, unlit, wing-shaped UFO flew over Palm Springs - NNW to SSE - 12:05 am 9/26/05","10/11/05"
"9/25/05 23:45","Port St. Lucie","FL","Fireball","45 Sec","Orange firebal went across the sky from ~WNW to ESE over the ocean","12/16/05"
"9/25/05 23:18","Grantville","GA","Light","3 minutes","Mysterious Lights that seemed to have landed and taken off again","10/11/05"
"9/25/05 19:15","Prescott Valley","AZ","Fireball","approximately 2-3 minutes","Extremely bright glowing orange ball of light with some sort of dim object obove it, possibly a reflection on a larger surface","10/11/05"
"9/25/05 13:45","Melbourne","FL","Diamond","1","Unusual object in digital photo noticed only when downloaded on laptop...nothing seen during photo shoot","10/11/05"
