"Date / Time","City","State","Shape","Duration","Summary","Posted"
"5/18/05 20:00","Holloman AFB","NM","Light","10 minutes","Large stationary light, approx. 5 times larger than largest star-light out, no stars visible.  ((NUFORC Note:  Possible balloon.  PD))","5/24/05"
"5/18/05 19:30","Santa Rosa","NM","Sphere","appx 1 hr 10 min.","Stationary Spherical Light 1 Hour Duration over Santa Rosa, NM.  ((NUFORC Note:  Possible high-altitude balloon.  PD))","5/24/05"
"5/18/05 15:00","Black Mesa/Shonto","AZ","Disk","5 minutes","I saw a large round flying object moving very fast.","5/24/05"
"5/18/05 13:20","Edwardsville","IL","Sphere","8-10 seconds","ILLINOIS/MUFON REPORT:  Black sphere seen flying rapidly in a straight-line course under clouds.","5/24/05"
"5/17/05 22:30","Abilene","TX","Light","20 secs","two points of light traversing the west texas sky,  one seemingly in pursuit of the other","5/24/05"
"5/17/05 21:58","Kilgore","TX","Sphere","30 seconds","The object moved at incredible speed, making right angle turns and disappearing from sight.","5/24/05"
"5/17/05 14:00","Barstow","CA","Disk","N/A","We where in barstow taking pictures when we got home saw something strange on 1 would like someone to take it and see if they can tell","7/16/06"
"5/16/05 19:15","Oklahoma City","OK","Triangle","8 minutes","triangular shaped craft two.  hovering then following each other at highrate of speed.  three extreemly bright light two white one red","6/20/05"
"5/16/05 15:00","Long Branch","NJ","Other","10 min","I lived in an apartment right on the beach.  It was approximately 4 or 5 in afternoon and partly cloudy.  A friend and I were on the ba","10/30/06"
"5/16/05 10:38","Montague","MA","Light","7-10 minutes","A bright light hovering silent over a field 150 yards out, it moved over th tracks and was gone.","5/15/06"
"5/16/05 09:55","Trinidad","CO","Sphere","less than 1 min","Object over Trinidad","5/24/05"
"5/15/05 23:15","El Paso","TX","Circle","2 mins max","bright blue space ship?","9/2/05"
"5/15/05 23:00","Faber","VA","Triangle","1.5 min","craft was deltiod in shape had white lights at each end non blinking a red light in the center which blinked made a dull rumble when di","6/20/05"
"5/15/05 22:00","Tustin","CA","Diamond","2 minutes","My friends and i were outside at a local park. and all of a sudden we see an extreemly bright light, non of us had seen something that","5/24/05"
"5/15/05 22:00","Chicago &quot;highway&quot;","IL","Cylinder","1:00","Driving on highway and saw a white UFO moving very fast and low.","6/20/05"
"5/15/05 22:00","Tampa","FL","Unknown","1 minute","Moving &quot;star&quot; that started out stationary and sped off at high altitude.","5/24/05"
"5/15/05 21:40","DeBary (central FL)","FL","Light","5 minutes or so","lights joining and flying in formation across central florida sky","5/28/05"
"5/15/05 21:30","Orlando","FL","Light","3 to 5 mins","White lights  ((NUFORC Note:  Possible satellites?  PD))","5/24/05"
"5/15/05 21:30","Orlando","FL","Sphere","5 minutes","Lights moving across the Central Florida sky  ((NUFORC Note:  Possible satellites?  PD))","5/24/05"
"5/15/05 21:30","Lodge","SC","Formation","4 mins","I saw 5 little lights circling a 6th larger light in CW rotation then the little lights stopped the rotated in the opposite dir..","8/7/11"
"5/15/05 20:55","Las Vegas","NV","Light",">1 min","looked like a sattelite in speed,shape and color","5/24/05"
"5/15/05 20:30","Whittemore","MI","Unknown","half hour","Sightings in iosco county michigan by 4 diffrent people","6/20/05"
"5/15/05 20:00","Dana Point","CA","Cross","1 minute","The sun had just set at around 8 PM and I was looking in my binoculars in to the horizon which was still lit by the glow of the sunset.","5/24/05"
"5/15/05 19:35","Eagan","MN","Disk","1 minute","We saw them flying over the school about a half mile away. The came straight down and then stopped above the school and took off and di","5/24/05"
"5/15/05 18:00","Catasauqua","PA","Oval","N/A","After reviewing digital pictures on computer, I saw an object near a small plane that I didnt see through the camera.","5/24/05"
"5/15/05 17:00","Apple Valley","MN","Disk","N/A","I accidentally took a picture of a ufo.","6/20/05"
"5/15/05 16:40","Winnipeg (Canada)","MB","Changing","15 minutes","05/15/05 Winnipeg,MB,Canada - 16:40  Bright Object with lights , descended and lifted mid air","5/24/05"
"5/15/05 14:00","Saskatoon (Canada)","SK","Other","unknown","scrolling around on google maps, found a strange object at s7m1a8","7/16/06"
"5/15/05 13:17","Fresno","CA","Other","30 Seconds","Irregular shaped silver object","5/24/05"
"5/15/05 13:00","Lake Havasu City","AZ","Disk","30 minutes","Silver ufo dics observed from Lake Havasu City in broad light.","7/3/13"
"5/15/05 07:45","Parkersburg","WV","Oval","20 seconds","Saw a ufo on the way to school near a cow field.  ((NUFORC Note:  Student report.  PD))","7/15/05"
"5/15/05 07:30","Mebane","NC","Teardrop","6 to 7 minutes","Black object floating across Spring morning sky over Mebane","9/2/05"
"5/15/05 07:00","Peferlaw (Canada)","ON","Cylinder","4 min.","On my way to work one bright clear morning, I saw a shinning chrome like tube sitting completely still high in the sky. I spotted it wh","6/9/09"
"5/15/05 05:33","Clovis","NM","Unknown","20 minutes","saw bright, small object in the sky. may be hot air balloon","5/15/06"
"5/15/05 05:00","Troy","MI","Light","5 seconds","A blueish green ball of light that took off on an upward flight in a matter of seconds and disappeared.","11/28/07"
"5/15/05 03:00","Edmonds","WA","Unknown","1min+/-","Glow on porch and two beings plus a &quot;man&quot;","8/7/07"
"5/15/05 00:57","Las Vegas","NV","Triangle","30 seconds","Huge, glowing triangle flying over route 215 in Las Vegas, NV","5/24/05"
"5/15/05 00:00","Earp","CA","Triangle","4.5 hr","Massive number of UFO's observed in one location.","5/24/05"
"5/14/05 22:00","Adams County","OH","Flash","5 sec","((HOAX??))  SMALL!","3/31/08"
"5/14/05 10:30","Clear Lake (Beaver Co.)","OK","Unknown","30-40 seconds","Unknown sound of fast and low origin witnessed by three individuals.","5/24/05"
"5/14/05 08:30","Fort Collins","CO","Other","about 1min","iT WAS LIKE HALF BALL HALF TRYANGLE AND WAS YELLOW AND SUDDENTLY DISAPPEARED.","5/24/05"
"5/14/05 02:00","Cincinnati","OH","Circle","10 min","Orange round object appears dims and reappears no sound","5/24/05"
"5/13/05 22:58","Sebastopol","CA","Other","5 seconds","Just before 11 PM I had finished checking my boxes out in the poolhouse/cottage ( where my office is) and was standing in the dark, enj","5/24/05"
"5/13/05 21:30","Lake Forest","CA","Triangle","5 minutes","Witnessed several different sets of lights flying very low.","5/24/05"
"5/13/05 21:15","Emory","TX","Rectangle","about 1 minute","Man and wife experience a dramatic sighting of a UFO hovering nearby:  A &quot;disappearing cell phone radio tower&quot;","5/24/05"
"5/13/05 00:40","Blasdell","NY","Other","20 minutes","Too slow and bright to be man made.","5/24/05"
"5/13/05 00:30","Vista","CA","Fireball","7-8 seconds","Red/Gold streaking light w/ sparking trail flies North to South in straight line over Vista, Ca. (Shadowridge)","5/24/05"
"5/13/05 00:18","Kirkland","WA","Triangle","15-20 seconds","Black Triangle","5/24/05"
"5/12/05 23:00","Truckee","CA","Other","30 minutues","Several variouse lights of different color and irratic  movement.","5/24/05"
"5/12/05 22:12","Ball Ground","GA","Cross","1 minute","On May 12th, 2005 I saw a cross-shaped ufo cross over my Northern Georgia home at 22:12 heading north at low altittude.","5/24/05"
"5/12/05 22:00","Lake Wales","FL","Formation","30 minutes","Flashing lights that quickly moved across the sky, appeared and reappeared.  ((NUFORC Note:  Student report.  PD))","5/24/05"
"5/12/05 20:28","Parker","CO","Disk","10:28PM-10:32PM","it was 10-20 feet above my house.  ((NUFORC Note:  May not be a serious report.  PD))","5/24/05"
"5/12/05 18:30","Honeoye Falls","NY","Disk","2 minutes","While working in Honeoye Falls about 6:30 I spotted what vaguely  resembled a canopy with some sort of faint object suspended below it.","7/5/05"
"5/12/05 17:00","San Diego/National City","CA","Cigar","4-5 mins?","very bright, slanted, cigar-shaped object witnessed around San Diego 32nd st Naval Base (around National City)","5/24/05"
"5/11/05 23:25","Selinsgrove","PA","Fireball","20 sec","2-3 craft streak across the sky","5/24/05"
"5/11/05 22:00","Wilmington","DE","Unknown","30 min","Flashing red, green and white light. ((NUFORC Note:  Sighting of Sirius??  PD))","5/24/05"
"5/11/05 21:55","San Anselmo","CA","Unknown","1 minute","Bright as a distant star but moving across the whole sky on a &quot;path.&quot;","5/24/05"
"5/11/05 21:45","Northbridge","MA","Sphere","one hour","2 Darting UFOs, stationary at non-fixed intervals.  ((NUFORC Note:  Possible sighting of Sirius??  PD))","5/24/05"
"5/11/05 21:00","Montcalm","NH","Oval","60 seconds","New Hampshire","5/24/05"
"5/11/05 15:30","Kansas City","MO","Unknown","20 minutes","Whole bunch of lights flying in the air.","6/20/05"
"5/11/05 11:30","Petaluma","CA","Flash","1 Second","2 Flashes of light in the Petaluma Country","6/20/05"
"5/11/05 03:45","Phoenix","AZ","Other","5 minutes","Bright White Lights Phoenix","5/24/05"
"5/11/05 03:30","Oklahoma City","OK","Unknown","3 seconds","Bright orange light glowing through the kitchen window.","5/28/05"
"5/11/05 00:05","London (Canada)","ON","Diamond","45 sec","lights over southwestern ontario tues. may 11 2005  2 diamond shaped ships in &quot;northern lightslike&quot; purple cloud.","5/11/05"
"5/10/05 21:20","San Diego","CA","Sphere","15 minutes","6 white lights moving over san diego","5/11/05"
"5/10/05 21:15","Forest Hills","NY","Triangle","4 seconds","Two triangular shaped objects, flying parallel to each other, flew by, from east to west, very rapidly.","5/11/05"
"5/10/05 17:30","New Orleans","LA","Cylinder","30 sec","cylinderical ufo streaks low over New Orleans on weather tv broadcast","6/20/05"
"5/10/05 17:00","Sandpoint","ID","Other","10 sec.","A  missile/cigar-shaped object &quot;suspended&quot; just below the body of a small jet landing in Sandpoint. ID.","5/11/05"
"5/10/05 15:00","McLean","VA","Other","One Minute","Three balls of light (BOLs), bobbing in circular formation, seen in midafternoon low over homes .","2/14/06"
"5/10/05 15:00","Holstein","IA","Unknown","unknown","Time manipulation after possible abduction. 500 Lights On Object0: Yes","7/17/11"
"5/10/05 14:45","Columbia","MD","Sphere","1 minute","two silver ballls over skies in howad county vanish one by one","3/11/06"
"5/10/05 14:15","Kenosha","WI","Cylinder","3 minutes","Object metallic looking, hovering and then floated up and then sped off at a high rate of speed.","10/11/05"
"5/10/05 14:15","Willmington","CA","Light","5 minutes","bright white round light,moving little,over Long Beach,Ca.as seen from Willmington,Ca.","5/24/05"
"5/10/05 01:40","Mesa","AZ","Unknown","1second-12 min","Sonic booms over Mesa?","5/11/05"
"5/9/05 23:00","Chandler","AZ","Light","N/A","Light in sky, twice-15 mins apart","6/20/05"
"5/9/05 22:20","Austin","TX","Cigar","A few seconds","Long line of green rectangular lights in the hills of southwest Austin","11/8/05"
"5/9/05 13:00","Cumberland","ME","Cigar","15 minutes"," ((NUFORC Note:  Anonymous source.  Hoax??  PD))  I was at a party late on Tuesday night with about 4 of my friends from college.","5/11/05"
"5/9/05 11:30","Speedway","IN","Unknown","a few minutes","No stealth interaction","10/11/05"
"5/9/05 03:00","Carlisle","PA","Chevron","3 min.","I was sitting on the front porch, not able to sleep. My dog was with me. Suddenly my dog became very agitated and seemed to want back i","5/24/05"
"5/8/05 22:00","Black Canyon City","AZ","Unknown","10 minutes","saw a stationary very bright light that looked like a star at a very far distance. As we drove towards it , it started to move very slo","5/11/05"
"5/8/05 21:30","Culver City","CA","Triangle","20 seconds","Boomerang shaped aircraft 10 lights over Culver City, CA","5/11/05"
"5/8/05 20:00","Vermillion Parish","LA","Light","1-2 minutes","Bright red light that faded then suddenly then a second later a white streak shot to the east from where the red light was.","5/11/05"
"5/8/05 11:00","Phoenix","AZ","Sphere","10 seconds","Small sphere, moving very fast to the west, directly under my aircraft, 3,500 feet","5/11/05"
"5/7/05 22:00","Sedona/Verde Valley","AZ","Light","15 minutes","Erratic moving red and white light seen through night vision","6/20/05"
"5/7/05 21:55","Warminster","PA","Light","2 seconds","Looking southeast from Warminster, PA. I saw a bright neon-green light angle toward the ground low in the sky (about a 60 degree angle)","5/11/05"
"5/7/05 21:45","Johnson City","TN","Fireball","20 seconds","Very bright object in sky.","5/11/05"
"5/7/05 21:15","Sedona/Verde Valley","AZ","Light","5 minutes","Merging white lights near the cement factory and Mingus Mtn.","6/20/05"
"5/7/05 17:08","Corrales","NM","Sphere","1min","Sphere, cloud high","5/11/05"
"5/7/05 15:40","Laconia","NH","Disk","10 seconds","disk over Laconia","10/11/05"
"5/7/05 13:00","Pennington Gap","VA","Circle","N/A","It was very fast when it took off.","9/2/05"
"5/7/05 12:03","San Francisco","CA","Unknown","N/A","A very small craft","5/11/05"
"5/6/05 23:19","Blue Springs","MO","Unknown","Just over 7 minutes","Amber-ish burning light shapeshifting into an array of lights moving very in slow motion but fast at the same time.....can't explain it","5/11/05"
"5/6/05 21:00","Sedona","AZ","Light","5 minutes","Erratic lights west of Airport Mesa","6/20/05"
"5/6/05 15:06","Donnacona (Canada)","QC","Disk","Unknown","Hynek's classification:  Daylight Disc (D.D.)","5/28/05"
"5/5/05 23:00","Rustburg","VA","Unknown","5 minutes","it was four reddish orange lights then they turn white and it took off pretty fast faster then any plane i've ever seen","5/11/05"
"5/5/05 23:00","Bristol","CT","Triangle","3.5 min","Black Quiet Triangle Spotted","5/11/05"
"5/5/05 22:00","Margate","FL","Light","one minute","It looked like a shooting star but it lasted to long,It lasted about a minute and a half.","5/11/05"
"5/5/05 22:00","Troy/Rochester Hills","MI","Triangle","20-30 seconds","Small silent UFO witnessed by 6 people flying extremely close to the ground in Troy, Michigan on Cinco De Mayo 2005.","12/12/09"
"5/5/05 21:00","Louisville","KY","Triangle","15 MIN","objest appearig over small lake with beams entering water then assendind into sky","9/2/05"
"5/5/05 20:30","Ansonia","CT","Triangle","2 Minutes","Triangle, 3 lights, silent and slow. Low altitude.","5/11/05"
"5/5/05 20:24","Rockport","MA","Rectangle","1 minute","MUFON/MASSACHUSETTS REPORT:  Rectangle seen in Rockport, MA","5/11/05"
"5/5/05 17:30","Greenville/Port Jervis","NY","Cigar","5 seconds","Shiny, silver, cigar-shaped object appeared out of hazy clouds","5/28/05"
"5/5/05 16:00","Spokane","WA","Fireball","30 minutes","Dozens of free Flying Stars over Spokane on sunny afternoon, taking triangular formations.  White and Red Pulsing.","5/15/13"
"5/5/05 15:00","Burnsville","NC","Light","30 seconds","Light orb in daylight","2/20/15"
"5/5/05 14:00","Portage","MI","Sphere","30 minutes","Silver Sphere weaving in and out of a &quot;contral&quot;","5/24/05"
"5/5/05 11:45","Ronkonkoma","NY","Rectangle","5 minutes","It was Thursday morning at 11:45 AM on the 5th of May 2005. I was parked in a shopping center waiting for my girlfriend to finish cash","5/11/05"
"5/5/05 09:00","Horn Lake","MS","Cylinder","10 sec","2 cylinder or tube objects above the city of Memphis.","9/2/05"
"5/5/05 05:50","Burlington (Canada)","ON","Changing","5 min","quite large","3/11/06"
"5/4/05 22:00","Milford (between cities)","IN","Flash","About 5 seconds","It was the 4th of July and my parents and I were coming home from some fireworks. Occasionally, we would see small towns set off firewo","9/2/05"
"5/4/05 21:35","Beckville","TX","Light","apx. 4-5 min","Bright light moving steady across the sky from horizon to horizon.","5/11/05"
"5/4/05 21:00","Centerville","GA","Triangle","5 minutes","pulsing blue light with irratic movement","5/11/05"
"5/3/05 23:30","Portland","OR","Circle","2 min's","05/03/05 23:30hours. the we seen in portland Oregon It moved from north to south and vanished.","5/11/05"
"5/3/05 22:03","Glenwood Springs","CO","Formation","23 seconds","WHO KNOWS WHAT THAT WAS? ((NUFORC Note:  May not be a serious report.  PD))","5/11/05"
"5/3/05 20:30","Riggins","ID","Oval","2 evenings","Unbelievable speed and able to stop  and hover with no sound.","5/11/05"
"5/3/05 12:00","Norfolk","VA","Disk","2-4 minutes","When I was sitting there it was spinning around until it went up.","7/5/05"
"5/3/05 02:00","Solon","OH","Unknown","2 Minutes","Large dark soundless craft  - white lights - criss-crossed shapes on bottom - low flying","5/11/05"
"5/3/05 01:07","Troy","TX","Unknown","N/A","I woke to a dim green light a misshapen peanut  looking UFO in the sky and saw it once more a few days later.","7/5/05"
"5/2/05 21:45","Big Lake","TX","Light","1-1/2 hours","Bright white light in NW sky moved rapidly and erratically up, down, left, right and changed colors to blue ands blue green.","12/16/05"
"5/2/05 21:00","Clovis","CA","Light","about one minute","Bright white light flased in the sky, followed by 2 red flashing lights move up and down, back and forth.","5/11/05"
"5/2/05 21:00","Mt. Rogers (near)","VA","Cone","6-9 seconds","Camping out on a clear night, I saw a white cone of light touch the ground from outer space.","7/5/05"
"5/2/05 21:00","Clovis","CA","Light","1 minute","Follow up on the lights observed on May 2, 2005 in Clovis, CA","5/24/05"
"5/2/05 14:05","Palmdale","CA","Circle","14:15: 10 MIN","Two (2) silver bright round disk(s) that touched then seperated, numerous times, seem to follow chemtrail over Palmdale, California.","5/24/05"
"5/2/05 03:44","Greensboro","NC","Sphere","20 seconds","UFO flies over Gas Station","5/11/05"
"5/2/05 01:00","Waiparous (west of Calgary) (Canada)","AB","Flash","30 mins","The speed and color was amazing to see.","5/11/05"
"5/2/05 00:30","Angels Camp","CA","Circle","2 minutes","Strange Object in Angels Camp, CA.  ((NUFORC Note:  Probable sighting of the star, &quot;Sirius,&quot; we suspect.  PD))","5/24/05"
"5/2/05 00:00","Fort Knox","KY","Triangle","15 seconds","Flash of light made me look up to see a dark craft with three lights hovering above me.","8/24/10"
"5/1/05 23:00","Palmdale","CA","Sphere","5min","dancing light above lancaster","3/4/08"
"5/1/05 23:00","Oshawa (Canada)","ON","Other","15-25 minutes","Very large fire orange object in Oshawa, Ontario.","2/14/06"
"5/1/05 16:11","Fallbrook","CA","Changing","30 sec","Huge bright liigt","5/11/05"
"5/1/05 15:21","Luray","VA","Cigar","3 minutes","Extremely Long Needle (over 2,000 ft) UFO observed 1 May traveling over 1500 MPH at over 70,000 ft","5/11/05"
"5/1/05 13:00","Stevens Pass","WA","Other","moment","Tiny Mig type jet appeared and then was gone","5/11/05"
"5/1/05 06:20","Independence","KY","Other","5 minutes","stationary disk-like object seen near I-75/Independence, KY","5/11/05"
"5/1/05 04:00","Roman Nose State Park","OK","Other","3 min.","At 4am ai was camping at roman nose state park, when around 4am the wind started blowing very hard and I looked up above me and a craft","8/5/09"
"5/1/05 03:38","Rochester","MI","Triangle","20 seconds","A triangular craft, disguised as three stars, slowly glided for 20 secs untill it went into some cloud coverage. HUGE!!","5/11/05"
"5/1/05 03:00","Wayland","MA","Light","1 or 2 minutes","Light or energy flying object no lareger than 10-12 inches entered bedroom on more than one occassion","12/12/09"
"5/1/05 01:00","Portland","OR","Oval","3-7 minutes","Three amber/orange objects patrol Portland skyline","5/24/05"
"5/1/05 01:00","Portland","OR","Light","N/A","Portland OR May '05 event similar to Beaverton OR March '01 events.","9/2/05"
"5/1/05 01:00","Portland","OR","Disk","5 minutes","Orange disk-like orbs over Downtown Portland.  ((NUFORC Note:  Student report.  PD))","5/11/05"
"5/1/05 00:45","Portland","OR","Light","5+ minutes","Three reddish lights seen over Pearl District of Portland, OR","6/20/05"
"5/1/05 00:30","Downey","CA","Formation","10-15 min","4 orange-reddish objects lights in the sky traveling in non-static formation @ equal speeds and change in appearance","5/11/05"
"4/30/05 21:47","Murrieta","CA","Circle","1 minute","ORANGE UFO.","5/11/05"
"4/30/05 05:00","Hayden","ID","Light","10-15 secs.","someone please report back to me on this case.  It is unusual, in that I have not read too many similar descriptions on your site.P","10/10/11"
"4/30/05 02:50","Dunstable","MA","Triangle","5 minutes","coming home late from work, I saw a slow moving triangular shaped craft with red and green lights just above the tree  line.","7/5/05"
"4/29/05 23:00","Comfort","TX","Triangle","1-2 minutes","angular shaped object","5/11/05"
"4/29/05 23:00","New York City (Brooklyn)","NY","Circle","over 15 mins.","Stoof outside my apt and looking straight ahead saw light that I thought was search lights.  On closer observation, I noticed the objec","3/11/06"
"4/29/05 23:00","Cheltenham","PA","Disk","15 seconds"," Object was large and moved from one direction to another quickly","5/11/05"
"4/29/05 22:45","Floral City","FL","Triangle","25-30 seconds","((NUFORC Note:  Missile launch at 2055 hrs (EDT).  PD))   Triangular object traveling fast towards Tampa","5/11/05"
"4/29/05 22:33","Plant City","FL","Formation","two minutes","((NUFORC Note:  Missile launch at 2055 hrs (EDT).  PD))   Two objects that at first appeared to just be stars were moving","5/11/05"
"4/29/05 21:45","Waterboro","ME","Oval","10 minutes","((NUFORC Note:  Missile launch at 2055 hrs (EDT).  PD))  2 BRIGHT LIGHTS OVERHEAD ONE EMITTING 3 RAYS OF LIGHT","5/11/05"
"4/29/05 21:35","Olathe","KS","Light","Approx. 3 mins","Two lights in the night sky flying in apparent formation.","5/11/05"
"4/29/05 21:30","Jupiter","FL","Changing","10 MINUTES","((NUFORC Note:  Missile launch at 2055 hrs (EDT).  PD))   see above","5/11/05"
"4/29/05 21:30","Fort Bragg","NC","Circle","5 minutes","((NUFORC Note:  Missile launch at 2055 hrs (EDT).  PD))  Bbright object enters atmosphere, turns into 2 objects","5/11/05"
"4/29/05 21:30","Bradenton","FL","Oval","went to dinner","((NUFORC Note:  Missile launch at 2055 hrs (EDT).  PD))  I walked of of a restraunt and i sal something spining","5/11/05"
"4/29/05 21:20","Clearwater","FL","Fireball","2 Minutes","((NUFORC Note:  Missile launch at 2055 hrs (EDT).  PD))   Red/orange circle and planes flying","5/11/05"
"4/29/05 21:10","Charleston","SC","Other","5 min","Bomerang shaped blue haze followed by what appeared to be a star, then a flash like a firework explosion.","5/24/05"
"4/29/05 21:10","Lithia","FL","Formation","30 seconds","((NUFORC Note:  Missile launch at 2055 hrs (EDT).  PD))   There were three orange lights that came and then disappeared.","5/11/05"
"4/29/05 21:06","Tampa","FL","Light","3-5 Minutes","((NUFORC Note:  Missile launch at 2055 hrs (EDT).  PD))   there were three (they were the size of my fist) and two disappeared&#8230;","5/11/05"
"4/29/05 21:05","Tampa","FL","Light","approximately 10 minutes","((NUFORC Note:  Missile launch out of Cape Canaveral.  PD))  UFO Sighting 04-29-05 Tampa, FL","6/20/05"
"4/29/05 21:00","Contocook","NH","N/A","5 Min","((NUFORC Note:  Missile launch at 2055 hrs (EDT).  PD))  Atmospereic skipping and afterburners?","5/11/05"
"4/29/05 21:00","Truckee","CA","Light","15 seconds","A  single light following another single light closley and pretty fast no sound.","5/11/05"
"4/29/05 21:00","Goldsboro","NC","Unknown","10 minutes","((NUFORC Note:  Missile launch at 2055 hrs (EDT).  PD))   me and a friend were standing out side about 8:30 P. M.  Talking","5/11/05"
"4/29/05 21:00","Wilmington","NC","Fireball","5 minutes","((NUFORC Note:  Missile launch at 2055 hrs (EDT).  PD))  Exploding &quot;Star&quot;","5/11/05"
"4/29/05 21:00","Kissimmee","FL","Unknown","2:00 minutes","((NUFORC Note:  Missile launch at 2055 hrs (EDT).  PD))  I glanced to the sky and saw a plane passing by.","5/11/05"
"4/29/05 21:00","Miami","FL","Triangle","5 minutes","((NUFORC Note:  Missile launch at 2055 hrs (EDT).  PD))   Bright object seen in the sky, seemed to explode shortly after appearance.","5/11/05"
"4/29/05 21:00","Kennebunk","ME","Circle","3 minutes","((NUFORC Note:  Missile launch at 2055 hrs (EDT).  PD))   a bright moving star","5/11/05"
"4/29/05 21:00","Lake City","FL","Light","12 seconds","((NUFORC Note:  Missile launch at 2055 hrs (EDT).  PD))   3 orange lights forming triangle, 2 stationary lights","5/11/05"
"4/29/05 21:00","Chelmsford","MA","Sphere","1 minute","((NUFORC Note:  Missile launch at 2055 hrs (EDT).  PD))   Resembled what the ISS looks like when it went overhead one night","5/11/05"
"4/29/05 21:00","Palm City","FL","Changing","120 seconds","((NUFORC Note:  Missile launch at 2055 hrs (EDT).  PD))   rocket  type sighting","5/11/05"
"4/29/05 21:00","Palmetto","FL","Light","2 minutes","((NUFORC Note:  Missile launch at 2055 hrs (EDT).  PD))   Lights formed a plane and a haze appear after the lights changed","5/11/05"
"4/29/05 21:00","Cary","NC","Light","90 sec","((NUFORC Note:  Missile launch at 2055 hrs (EDT).  PD))  Two small yellow-white lights moving parallel to horizon; fuzzy ring of light","5/11/05"
"4/29/05 21:00","Daufuskie Island (off coast of)","SC","Other","1-2 minutes","((NUFORC Note:  Missile launch at 2055 hrs (EDT).  PD))  My husband and I were looking over the pool area into the  sky around 9PM","5/11/05"
"4/29/05 20:58","Deerfield Beach","FL","Fireball","2-3 min","((NUFORC Note:  Missile launch at 2055 hrs (EDT).  PD))   Shuttle Early?","5/11/05"
