"Date / Time","City","State","Shape","Duration","Summary","Posted"
"8/1/06 03:00","Fort Pierce","FL","Diamond","Unknown","Possible Abduction taken place in south FL in mid summer. 500 Lights On Object0: Yes","4/27/07"
"8/1/06 03:00","International Falls","MN","Light","3 minutes","Lights (on craft) moving in extremely rapid zig-zags through the night sky.","3/31/08"
"8/1/06 02:45","Phoenix","AZ","Triangle","1 minute","Triangle object seen flying thru the night sky, Weird.","10/30/06"
"8/1/06 01:00","Idaho Falls","ID","Cigar","2 mintues","CIGAR UFO RIGHT ABOVE US!!","10/30/06"
"7/31/06 23:00","High Point","NC","Circle","N/A","i was out side i looked at stars and seen moveing crafts it dont look like air plane it was moveing ever were but i looked 3 times on 4","10/30/06"
"7/31/06 21:30","Seattle","WA","Fireball","10m+","Fiery glow, moving in distance over Olympic Mountains","10/30/06"
"7/31/06 21:14","Carmel","IN","Oval","30 seconds","I noticed a black bug-like shaped craft","10/30/06"
"7/31/06 21:00","Cave Creek","AZ","Rectangle","10 seconds","The object moved west across the sky, paused, flashed a bright rectangular strobe light and then disappeared.","10/30/06"
"7/31/06 15:18","SOHO satellite photo","IN","Sphere","1 second","Spheres passing SOHO satelite one million miles from Earth","12/7/06"
"7/31/06 10:20","Valley City","OH","Light","2 seconds","Luminous green flash quickly travels the sky in straight line and abruptly dissapears.","10/30/06"
"7/31/06 04:00","Kelowna (Canada)","BC","Sphere","1HOUR","bright light seen over black mountain before crop circle reported","12/7/06"
"7/31/06 02:00","San Antonio","TX","Other","5 minutes","((HOAX??))  Flying object that looks like a Hawk or Eagle","3/4/08"
"7/31/06 01:00","New York City (Brooklyn)","NY","Formation","1+hours","Formation of lights moving at a plane like pace-dimmer ones leading brighter ones","10/30/06"
"7/30/06 23:42","Killeen","TX","Unknown","1 minute+","Red craft appearing directly above, maneuvering south, sw, w, then se, then fading.","10/30/06"
"7/30/06 23:30","Ontario (Canada)","ON","Light","5min.","I could see the spotlight in front, and then turn to our direction then go off.","2/1/07"
"7/30/06 23:00","Littig (rural)","TX","Triangle","2-4 minutes","Silent, slow moving black triangle over east Travis county.","6/13/14"
"7/30/06 23:00","Littig/Webberville (between; rural)","TX","Triangle","2 minutes","Giant black triange in rural East Travis County.","8/15/14"
"7/30/06 22:00","Henderson","KY","Light","30-40 mins","Roaring and erratic-moving lights over Henderson, KY","10/30/06"
"7/30/06 20:55","Port Allen","LA","Triangle","10 minutes","Mother witnesses first UFO flying directly over house -- with NO SOUND","10/30/06"
"7/30/06 19:30","West Gardiner","ME","Light","less than a minute","Very bright white object moving slowly then quickly going straight up till it could be seen no longer.","10/30/06"
"7/30/06 14:12","Honolulu","HI","Other","5 minutes","If a picture is worth 1000 words than this one is worth $1,000,000!","10/30/06"
"7/30/06 04:11","Midlothian","TX","Formation","5 minutes","Three star-like objects seen moving in shifting triangular formation.","10/30/06"
"7/30/06 04:01","Marysville","CA","Triangle","6 minutes","Three triagle craft fly near Beal Air Force Base and make sharp turns that normal planes could not do.","10/30/06"
"7/30/06 03:30","Hyannis","MA","Oval","1 second","Glowing orange craft zips away like a shooting star in hyannis, ma at around 3:30am 7/30/06","10/30/06"
"7/30/06 02:00","Indialantic","FL","Fireball","15 mins","We were sitting on the beach my wife and myself when we saw what looked like a military flare bright orange in the sky.   It was at abo","6/12/07"
"7/30/06 01:45","Afton","OK","Sphere","15 seconds","Brown out forced us outside to seek relife from heat. Total darkenss. Sphere traveling very fast from east to west, low in the horizon.","10/30/06"
"7/30/06 00:00","Sanford","FL","Light","over 1 hour","Unusual lights in Sanford Florida","10/30/06"
"7/29/06 23:00","Dolittle","MO","Light","30 seconds","i was looking at stars  when suddenly a light apperard. as i watche the ligh speeded off at a high rate of speed three to five min late","10/30/06"
"7/29/06 23:00","Yakima (on I-82)","WA","Fireball","30 sec","Big ball of fire coming down from the sky landed on I-82 near sunnyside,wa","1/10/09"
"7/29/06 22:00","Hillsboro","TX","Light","1 hour","Witnessed 14 lights moving erratically accross the Texas sky, over one hour period.","10/30/06"
"7/29/06 22:00","Myrtle Beach","SC","Flash","22:00 - 23:30","Red Flashing Lights Over the Atlantic","10/30/06"
"7/29/06 22:00","Salem-Portland","OR","Oval","3 min","Bright yellow light hovering over Interstate 5 - in Woodburn?","10/30/06"
"7/29/06 20:20","Manchester","VT","Light","30 minutes","ultra slow moving (~25 mph) light at ~250,000 ft altitude; 30 minutes","12/7/06"
"7/29/06 20:00","Exeter","NH","Changing","5 min","Black object of indeterminate, constantly shifting shape seen passing over Exeter, NH.","10/30/06"
"7/29/06 18:00","Wichita","KS","Oval","0:45","UFO over Wichita Kansas, at around 18:00 hr on Saturday July 29th 2006","10/30/06"
"7/29/06 14:30","Portland","OR","Sphere","15 mins","Metallic Spherical object(s) in sky above downtown Portland Oregon this evening.","10/30/06"
"7/29/06 13:35","Westminster","CO","Cigar","1-2 minutes","cigar shaped segmented flying object sighted over Broomfield / Boulder CO","10/30/06"
"7/29/06 13:00","Clinton","MO","Other","5-7 minutes","Triangle shape with three shiny balls connected by transclucent looking lines","10/30/06"
"7/29/06 12:47","Toronto (Canada)","ON","Unknown","5 min","two blinding lights over toronto","10/30/06"
"7/29/06 07:07","Fife","WA","Disk","1/640 second","Three disk shaped objects in photo of Mt. Rainier","10/30/06"
"7/29/06 04:30","Hudson","FL","Unknown","1 minute","Three lights in a perfect triangle, with the point trailing not leading, travelled across the sky toward the north.","10/30/06"
"7/29/06 03:00","Sonoma","CA","Circle","7-10min","An extremelly bright circular orange/amber light traveled NW to SW pausing for 20 sec. 3x. Not far away","10/30/06"
"7/29/06 03:00","Sonoma","CA","Circle","10min","this is an update","10/30/06"
"7/29/06 03:00","Sonoma","CA","Fireball","10 min. approx.","very bright orange/amber light moves, freezes, no noise not in usual air trafic path about 10 min.","10/30/06"
"7/29/06 01:28","Topeka","KS","Light","2+ hrs","It appeared to be a quickly moving star...","10/30/06"
"7/28/06 23:00","Nashville","TN","Light","5minutes","A high altitude red star began moving fast straight acrossed the sky, then turned up straight up and flew out of sight instantly and wa","10/30/06"
"7/28/06 22:30","Richmond","CA","Flash","3 min.","Electrical magnetic affects on at least three homes, lightning like flashes observed and blue haze in clouds","10/30/06"
"7/28/06 22:00","Surrey (Canada)","BC","Light","hours","bright white later yellow and blue light hovering over Fraser River for several hours from Surrey, Canada","10/30/06"
"7/28/06 21:00","Mayer","AZ","Unknown","45 min.","strange flying object zigzaging across thesky","10/30/06"
"7/28/06 21:00","Mayer","AZ","Light","1 hour +","two strage aircraft possibly millitary seen over mayer","10/30/06"
"7/28/06 17:00","Atlantic City","NJ","Oval","N/A","storm clouds very threating at edge very dark out toward ocean was light clouds didn't get there yet took 6 digital pics. when i got ho","10/30/06"
"7/28/06 15:00","Harrington (Canada)","QC","Triangle","1.5 sec each","Many transparent triangles going different direction very fast,  as if I had they were taking off because i was looking","10/30/06"
"7/28/06 12:00","New York City (Brooklyn)","NY","Circle","15 minutes","A white object disappears as 3 of the same reappear, is it a UFO?","2/1/07"
"7/28/06 11:30","Ephrata","WA","Chevron","2 minutes","we saw a brownish red cheveron circling and coming to a complete stop.then it would do it again.then it darted north across the sky.","10/30/06"
"7/28/06 07:00","Canyon Country","CA","Chevron","5-7 minutes","V shaped,  sequential red strobing lights on lateral surfaces, enormous size1/4 mile or greater, no sound.","10/31/08"
"7/28/06 04:40","Loveland","CO","Formation","1 minute","3 object formation over Loveland, CO","10/30/06"
"7/27/06 23:40","West Vancouver (Canada)","BC","Disk","1 minute?","A flying disk with very bright lights in Vancouver, B.C. Canada","10/30/06"
"7/27/06 21:50","Roanoke Rapids","NC","Disk","N/A","5-10 space crafts believed to be seen, not an airplane, helicpter, jet or satelite!","10/30/06"
"7/27/06 21:48","Antelope Acres","CA","Other","45 sec","odd single light in the sky","10/30/06"
"7/27/06 19:00","Montreal (Canada)","QC","Cylinder","15 minutes","Bright silvery cigar cylinder object seen floating over the Montreal sky","10/30/06"
"7/27/06 15:00","Gagetown (near) (Canada)","NB","Disk","1 minute","I can't explain what I saw.","10/30/06"
"7/27/06 10:52","Gamaliel","KY","Light","N/A","2 light blue spears of light flying low 20 ft. from the ground stoped for around 10 sec. and disapeard","10/30/06"
"7/27/06 08:30","Montreal (Canada)","QC","Cigar","15mins","UFO in Montreal Cigar shape","10/30/06"
"7/27/06 02:00","Methuen","MA","Oval","3 sec","Found an bright oval shape ball of light flying in the northeast directon...","10/30/06"
"7/27/06 01:00","Dublin","GA","Triangle","1 minute","Triangular-shaped metallic object ,several flashing lights on craft, 4 large lights (rear under-belly), flying low just above trees.","10/30/06"
"7/26/06 22:55","Massey","MD","Light","1 minute","very bright intence light and slowly fades to nothing and moving slow","10/30/06"
"7/26/06 22:30","McKinney","TX","Unknown","1 minute","Bright light near Dallas.","10/30/06"
"7/26/06 22:23","De Pere","WI","Other","12 seconds","glowing red bat-like object crosses sky","10/30/06"
"7/26/06 22:00","Seattle","WA","Light","4-5 minutes","N/A","10/30/06"
"7/26/06 22:00","Quincy","MA","Oval","10 seconds","small star like object traveled through sky like a plane then speed up as it came close to star went around and disappeared puff","10/30/06"
"7/26/06 19:00","Myrtle Beach","SC","Light","2 hours","Amber lights over Myrtle Beach South Carolina","12/12/11"
"7/26/06 18:50","New Iberia","LA","Unknown","Unknown","Streak of light appears in picture at dusk near New Iberia, LA.","12/7/06"
"7/26/06 12:30","Phoenix","AZ","Cigar","5 minutes","silver tube slowly travelling east in phx sky.","10/30/06"
"7/26/06 06:01","Moultrie","GA","Circle","45-50 seconds","The stars are alive","10/30/06"
"7/26/06 04:30","Fresno","CA","Light","30 sec","fresno early morning sighting","10/30/06"
"7/26/06 03:06","San Fransisco","CA","Diamond","15 seconds","bright light over San Fransisco","10/30/06"
"7/26/06 03:00","Colinga (near)","CA","Light","5 MINUTES","LIGHTS SEEN ON 5 NORTH NEAR COALINGA","10/30/06"
"7/26/06 00:40","Fenton","MI","Disk","1 minute","Whitish yellow saucer disk lights up near Phil's store in Fenton","10/30/06"
"7/26/06 00:30","Richmond","VA","Egg","3","UFO sighting near Short Pump, VA  stationary egg/box shaped object with three lights","10/30/06"
"7/25/06 23:00","St. Louis (Florissant)","MO","Light","light","i saw something in the sky blinking in a orange colored light moving for about 10 minutes.","10/30/06"
"7/25/06 22:50","Billings","MO","Light","2 minutes","shrinking lights","3/19/09"
"7/25/06 21:00","Chula Vista","CA","Light","5 minutes","A friend and I saw flashing lights in sync. before violently flashing and disappearing.","2/19/16"
"7/25/06 19:30","Delray Beach","FL","Sphere","2.Minutes","First observed travelling west to east. At what appeared to be an extremely high altitude. Turned abruptly south and at a high rate of","10/30/06"
"7/25/06 18:00","Bellevue","WA","Oval","15 minutes","object seen in sky chased away by military helicopter followed by a air force one sighting.","10/30/06"
"7/25/06 05:45","Fort Lauderdale","FL","Light","5 min","fast moving light, not flashing or blinking(excluding it being an airplane), turned quite sharply (est. 70 degrees)","10/30/06"
"7/25/06 04:31","Urbandale","IA","Light","6 seconds","Bright light","10/30/06"
"7/25/06 03:45","Corbett","OR","Light","5-10 min.","Slow-moving bright lights in V shape seen from Corbett, Oregon","10/30/06"
"7/24/06 23:45","Searcy","AR","Oval","30 seconds","Two peach colored pointed-oval objects wobble over Searcy, Arkansas travelling due east.","10/30/06"
"7/24/06 21:00","Gila Bend - 14 mile west of","AZ","Circle","30 minutes","firey balls observed 14 miles west of Gila Bend from Interstate 8 going out and coming on","10/30/06"
"7/24/06 04:00","Jonesboro","LA","Other","30 minutes","It slowley flew over the house stoped about25 or 30 yards past the back yard.it was a boomer rang shaped object it made no sound and wa","10/30/06"
"7/24/06 01:30","North Bay (Canada)","ON","Light","+1.5hrs","On this night, I went outside to have a cigarette before I went to bed. The sky was completely clear and you could see the entire sky w","10/30/06"
"7/24/06 00:00","Brookfield","CT","Other","1 hour","bright light in sky moving in circles and zigzags","10/30/06"
"7/23/06 22:30","Kiel","WI","Light","10 seconds","A very fast moving satellite look alike.","10/30/06"
"7/23/06 21:30","Danville","CA","Circle","1-2 mins","Dull yellow non flashing light traveling from south to north making no noise above the San Ramon Valley","10/30/06"
"7/23/06 19:36","Rome","NY","Circle","FEW SECONDS","BRIGHT ORB SEEN STILL IN THE SKY","10/30/06"
"7/23/06 04:00","San Bruno","CA","Unknown","seconds","((HOAX??))  thin rocket shaped, flying apparition,smoke cloud colored,fast ,no lights was i could tell it wasnt a meteor","10/30/06"
"7/23/06 03:00","Burton","TX","Other","15min.","gold box maybe 30 x30 feet very hot wavie loud like a jet plane i was 100 yards from it","10/30/06"
"7/23/06 02:30","Perth (west of) (Canada)","ON","Rectangle","4 minutes","rectangular shaped object with glowing lightblue lights at tree-top level while driving","10/30/06"
"7/22/06 23:00","Virginia Beach","VA","Disk","N/A","3 lighted disk","10/30/06"
"7/22/06 20:00","Southport","NC","Cigar","2 minutes","Two cigar shaped objects sighted over Southport-Fort Fisher Ferry.","10/30/06"
"7/22/06 16:45","Richmond","CA","Circle","30 minutes","One round white ball that sat in the sky.","10/30/06"
"7/22/06 15:00","St. Louis","MO","Triangle","2 minutes","Large black fast moving triangular shaped aircraft rumbling across the sky.","10/30/06"
"7/22/06 09:00","Prescott Valley","AZ","Circle","N/A","We saw a purple circle in the sky with green dots.","10/30/06"
"7/22/06 04:00","Azusa","CA","Egg","10 min","egg shaped orange light braks in 2 then disapears over azusa","10/30/06"
"7/22/06 03:00","Des Moines","IA","Light","30-45 seconds","Flash of white light turns into orb then dims to likeness of dimm star.","10/30/06"
"7/22/06 00:48","Deltona","FL","Circle","5 mintes.","There was a light,it shot to the right,stopped then shot to the left and disappeared.","10/30/06"
"7/21/06 23:35","Erie","PA","Light","15 Seconds","White light moved north to south and faded out.","10/30/06"
"7/21/06 23:00","Lincoln","NE","Oval","4-6 seconds","Bright, bluish-white glowing oval shoots rapidly and silently across the night sky","10/30/06"
"7/21/06 23:00","Novato","CA","Light","10-15 seconds","Mysterious gold light in the night sky in north San Francisco Bay area","10/30/06"
"7/21/06 22:00","Myrtle Beach","SC","Other","A few seconds.","Fading lights over Myrtle Beach, SC.","10/30/06"
"7/21/06 22:00","Sonoma","CA","Flash","30 seconds","Large Orb Expands, Then Vanishes","10/30/06"
"7/21/06 16:00","Middletown","OH","Other","20-30 seconds","I saw two black objects  --a large bug shape and a sickle looking shape  parade across the sky one cloudy afternoon.","10/30/06"
"7/21/06 10:45","Medford","OR","Light","3sec","small and bright","10/30/06"
"7/21/06 07:00","Palm Desert","CA","Unknown","N/A","a circl dottish kind of thing in the air that changed colors and move a few times","6/12/07"
"7/21/06 04:15","Florence/Queen Creek","AZ","Sphere","5 minutes","Spotted UFO, then object let out blinding white light, then shot off into the sky leaving a trail of fire like a astroid.","10/30/06"
"7/21/06 02:00","Three Rocks","CA","Triangle","5 seconds","triangle shaped craft flying low, rotating and turning before a freeway then taking a dive below some bushes.","6/12/07"
"7/21/06 01:20","Vancouver","WA","Disk","nearly an hour","Saucer like object with clear red &amp; blue lights","10/30/06"
"7/20/06 23:45","Kent","WA","Triangle","15seconds","Kent,wa. duration-15sec. flying from east to west, Triangular, lights on the three tips, red light on the bottom, huge","10/30/06"
"7/20/06 20:45","Portland","OR","Diamond","15 minutes","Daylight sighting: silent, black diamond flies over Portland, Or","10/30/06"
"7/20/06 19:50","Milwaukie","OR","Light","5 seconds","Bright round object seen in the sky and then disappeard as if it were leaving the atmosphere. It seemed VERY SHINEY!!!!!!!!!!!!!!!!!!!!","10/30/06"
"7/20/06 14:00","Adelaide  (South Australia)","SA","Circle","5 min","White UFO's over my house!!","12/12/09"
"7/20/06 10:32","Spokane","WA","Oval","approx 10-15 sec.","Reflective silver craft viewed in Spokane Washington","10/30/06"
"7/20/06 05:35","Shoreview","MN","Cigar","60 seconds","Early morning glowing object","10/30/06"
"7/20/06 05:30","Newport Beach","CA","Circle","6 min","a whiteish pink object shaped as a circle about 40,500 feet in the air that had a haze around it","10/30/06"
"7/20/06 05:00","Idaho Falls","ID","Sphere","20 min","Sphere in Sky","10/30/06"
"7/20/06 04:00","Girard","MI","Oval","30 -40 mins","bright light,white haze clouds","10/30/06"
"7/20/06 02:00","Branson","MO","Unknown","3 hours","UFO table rock lake, White lights.","8/7/07"
"7/20/06 01:40","Bremerton","WA","Circle","25 mins","stationary goldish round object with blue ,red,green and white lights  ,30 degrees above horizon in western sky","10/30/06"
"7/20/06 01:00","Yorba Linda","CA","Sphere","15 Seconds","I was standing on my driveway when I saw a sliver spherical object hover above my neighborhood high in the sky.","3/31/08"
"7/20/06 00:00","Zilwaukee","MI","Triangle","2 minutes","Triangle shaped lights stun passer-by's on Zilwaukee Bridge.","12/20/12"
"7/20/06 00:00","La Pine","OR","Circle","three hours","me and several people seen brite round objects VERY high in the night sky heading north west at a speed i thought impossible there was","10/30/06"
"7/19/06 23:20","Guilderland","NY","Triangle","1 minute","Phoenix Lights in New York?","10/30/06"
"7/19/06 21:30","El Monte","CA","Fireball","ONE SECOND","FIREBALL IN CLEAR SKY","10/30/06"
"7/19/06 21:24","Tucson","AZ","Changing","00:39","Fast and silent, bright and bewildering","10/30/06"
"7/19/06 21:00","Scottsdale","AZ","Formation","several minutes,","a squarish formation of dancing red/amber lights appeared in the distance. The twinkled for a very long time, over 1 hour. Formation wa","10/30/06"
"7/19/06 20:30","Sonora","CA","Fireball","2 secs","Large, low object shot across night sky.","10/30/06"
"7/19/06 19:20","Albuquerque","NM","Cigar","30 seconds","white, cigar shaped, silent and seemed to glow","10/30/06"
"7/19/06 18:33","Nampa","ID","Other","Short","Strange object in photo","10/30/06"
"7/19/06 03:30","Montgomery","AL","Disk","2 Hours","Massive UFO event in Montgomery, Alabama","10/30/06"
"7/19/06 01:30","Murfreesboro","TN","Cylinder","15 sec","Cylinder shaped object hovers near freeway","10/30/06"
"7/19/06 01:00","Coastline/offshore","TX","Other","30min.","((HOAX??))  gold box floating on water loud very loudare maybe floating above water it took off strate up.","10/30/06"
"7/18/06 23:25","Boise","ID","Circle","15 sec.","We reported this last night, but found a video on your site that better describes what we saw. It looked JUST like this video: http://w","10/30/06"
"7/18/06 23:20","Boise","ID","Disk","15 sec.","White/red glowing object, no sound as it moved from the East end of the Boise Valley, south to the north and then dissappearing.","10/30/06"
"7/18/06 23:00","Plainfield (near Shorewood)","IL","Other","10-15 seconds","2 low flying lights traveling east near Caton Farm Road and Red Hawk Drive, visible for 10 seconds.","10/30/06"
"7/18/06 23:00","Port Richey","FL","Triangle","N/A","a triangular object with rounded edges not pointed the size of the moon, glowing with white light was moving really slowly above","10/30/06"
"7/18/06 22:08","Dexterville","WI","Triangle","5-8 seconds","Close triangle shaped lights and 5 fighter jets in central wisconsin.","10/30/06"
"7/18/06 21:30","Lapeer","MI","Disk","30 seconds","((HOAX??  Student report.  PD))  I know I saw a unexplainable object.","10/30/06"
"7/18/06 21:00","East Meadow","NY","Other","30+","It is to my belief that it appeared to be three or four white lights in a row with  RED blinking lights on each end. I have been watchi","10/30/06"
"7/18/06 14:30","West Haven","CT","Disk","6 seconds","Flying disk","3/16/12"
"7/18/06 02:30","Big Sandy","WY","Light","Over 20 minutes","Two lights hoving in 2 diffent parts of the night sky, changing colors, slightly shifting about fixed points.((NUFORC Note:  Stars?PD))","10/30/06"
"7/18/06 01:15","Navarre","FL","Light","occuring now","refers to siting above....object moved....","10/30/06"
"7/18/06 00:15","Navarre","FL","Unknown","still occuring","large object with muliple lights moved impossibly and stood still ; a skeptic until tonight","10/30/06"
"7/17/06 23:30","Abbotsford (Canada)","BC","Egg","2 min.","Two egg shaped, Lighted, super fast moving, vibrating objects traviling north one behind the other.","10/30/06"
"7/17/06 23:00","Lebanon","IL","Triangle","3-4 minutes","triangle shaped &quot;thing&quot; with intense white lights and a &quot;haze&quot; around the outside of it flew over  my home and there was no sound comin","10/30/06"
"7/17/06 22:30","Leakey","TX","Light","less than a minute","My friend and I were sitting at the banks of a narrow river, across from a 127 foot cliff of a canyon. As we were looking at the stars,","6/12/11"
"7/17/06 21:30","Sevierville","TN","Unknown","45 sec","Several Aircraft looking lights stood still in sky for 45 seconds, then faded away.","10/30/06"
"7/17/06 21:30","Kettleman City/Coalinga (between)","CA","Triangle","15-20 minutes","Triangular shaped crafts and blue ball of light near Kettleman City and Coalinga California","10/30/06"
"7/17/06 21:30","Newport","RI","Light","7 minutes","A bright orange light. Moved awkwardly up and down as it traveled across the sky...Like a fireball at one point then suddenly moves","10/30/06"
"7/17/06 21:04","Las Vegas","NV","Sphere","three seconds","A large orb the size of a man`s fully extended hand passed over central Las Vegas at 21:04 this evening during a period of heavy lightn","10/30/06"
"7/17/06 20:45","Kent","WA","Teardrop","4 min.","On monday night at 8:45 PM, 7-17-06 in Kent, Wa., I was watching a jet plane flying overhead very low on it's approach to land at Boein","10/30/06"
"7/17/06 13:30","Langley (Canada)","BC","Disk","3 seconds","Saucer shape, quickly north wests direction over langley BC","7/4/12"
"7/17/06 13:00","Doraville","GA","Egg","1 hour","I was looking out my window, I first saw a red light it rotated and changed color to silver letalic. it moved west and dissapeared, the","10/30/06"
"7/17/06 09:40","Canton","GA","Light","10 seconds","I was talking to my wife on the cell phone and it kept on disconecting, I had full signal.  I decided to smoke a cigarette next to my w","10/30/06"
"7/17/06 07:15","St. Louis","MO","Rectangle","10 minutes","Black rectangle hovering","10/30/06"
"7/17/06 05:30","Pasadena","MD","Light","40+ mins","A light in the sky emmited multiple objects that came in our atmosphere, way more intense than any other sightings i've heard of.","10/30/06"
"7/17/06 03:00","Gig Harbor","WA","Triangle","30 minutes","strange blue and red colored stars turn into a ufo triangle that twitches and shoots out 'stars'","10/30/06"
"7/17/06 00:00","Kingston","NY","Light",".5 seconds","Bright light moving quickly before blinking out of existence.","10/30/06"
"7/16/06 23:45","Anthony","KS","Light","30 seconds","Bright white light, moving North. Faded from view on a clear night.  ((NUFORC Note:  Not ISS; was not visible on this date.  PD))","10/30/06"
"7/16/06 23:30","Van Nuys","CA","Triangle","4 hours","hovering lights flickering in the sky at tree level moving fast from left to right some landed others flew above us","10/30/06"
"7/16/06 23:00","Sim","FL","Triangle","30 minutes","Close to a shuttle launch","8/7/07"
"7/16/06 22:00","Smithfield","RI","Triangle","15 minutes","Red and Green blinking aircrafts flying fast and low","10/30/06"
"7/16/06 22:00","Villa Park","IL","Light","23 minutes","I believe I was abducted by Aliens","10/30/06"
"7/16/06 21:50","New York City (Brooklyn)","NY","Light","30 sec","roof-top UFO sighting","10/30/06"
"7/16/06 21:40","La Jolla","CA","Formation","3 seconds","Formation of approximately eight hazy illuminated triangles flew over La Jolla CA moving E to W.","10/30/06"
"7/16/06 21:00","Hilton Head","SC","Cigar","30 minutes","strange lights off south carolina coast","10/30/06"
"7/16/06 14:00","Chicago","IL","Circle","5-10 min","This is just to bring your attention to a report I made 7/16/06 of a Circular object sighting close to Ohare Airport(5 miles), and anot","12/7/06"
"7/16/06 13:30","Chicago","IL","Circle","30 seconds","Circular, silver stationary object over Chicago close to Ohare Airport at high altitude.","10/30/06"
"7/16/06 05:20","Seattle","WA","Rectangle","5:15","I first noticed the object 3/4 of a mile north of my location, at which point what seemed to look like a vertical floating monolith. As","10/30/06"
