"Date / Time","City","State","Shape","Duration","Summary","Posted"
"5/2/06 01:30","San Jose","CA","Changing","25min approx.","I saw a bright red VERY LARGE &quot;star looking&quot; object that shrunk and grew, Then shrunk to a small white blinking object that flew away.","5/15/06"
"5/2/06 01:00","Omaha","NE","Oval","2 Hours","Troubles With Unexplained Laser Beams","5/15/06"
"5/2/06 00:15","Tacoma","WA","Triangle","7 seconds","((HOAX??))  1 ship above bose elementary 3 lights on the ends.","11/28/07"
"5/1/06 23:35","Victoria (Canada)","BC","Light","1 min","I was having a smoke at about 11:35 PM and looked in the sky and noticed a very bright light and thought it was a plane.It was not movi","5/15/06"
"5/1/06 22:15","Canton","IL","Triangle","4 min.","A large black triangle with 3 lights was seen outside of Canton, Illinois on 5-1-06.","5/15/06"
"5/1/06 22:00","Wilmington","DE","Triangle","10 minutes","triangular shape with lights","5/15/06"
"5/1/06 21:20","Carthage","NY","Sphere","30 seconds","Red and blue sphere shaped object in the trees flew away","5/15/06"
"5/1/06 21:00","Cartwright","OK","Light","20 min.","Lights over Lake Texhoma.","5/15/06"
"5/1/06 21:00","San Onofre","CA","Light","3 seconds","Light caught on camera while camping at San Onofre.","10/30/06"
"5/1/06 14:30","Las Vegas","NV","Diamond","2min 30sec","Sighting from Stratisphere observation deck","5/15/06"
"5/1/06 13:00","Waxahachie","TX","Changing","30 minutes","as i was driving on the service rd to i35 beside and past the owens corning plant i observed over to the right and above my vehicle (i","4/27/07"
"5/1/06 00:00","Kingsville","MO","Other","5 minutes","On May 1, 2006, about midnight, I saw an object with alternating rectangualar white lights, totally silent, gliding close overhead.","5/15/06"
"4/30/06 23:30","Dana","IN","Triangle","3 Seconds","Triangular shaped object with 3 lights.","5/15/06"
"4/30/06 22:40","Roseville","CA","Other","5 Seconds","UFO over Sacramento, V formation or a single object","5/15/06"
"4/30/06 22:25","Euless","TX","Triangle","10 seconds","No lights flying very low, silent flew right over my head, blocked out view of stars as it passed.","5/15/06"
"4/30/06 22:15","Orange","TX","Triangle","7 SECONDS","DIM AMBER  LIGHTS IN TRIANGULAR SHAPE OVER ORANGE TEXAS","5/15/06"
"4/30/06 21:25","Yakima","WA","Light","3-5 min","Observed a single non-blinking bright light traveling from West to East at approx 9:35 pm.  ((NUFORC Note:  ISS at 21:25 hrs..  PD))","5/15/06"
"4/30/06 20:10","San Francisco","CA","Sphere","10 sec.","Coming from the South, going towards North/Northwest. Maybe arcing downward. Very bright white intense light. Moving fast, no sound...","7/16/06"
"4/30/06 16:00","Bear River/Evanston","WY","Sphere","2 min","Sphere zips across the sky","5/15/06"
"4/30/06 15:30","Sunflower","AZ","Other","30 Secs.","A black object appeared between the contrails of a jetliner for a short period of time and then disappeared.","7/16/06"
"4/30/06 00:20","Portland","OR","Diamond","3 seconds","Strange Diamond shaped object seen in Portland, Oregon","7/16/06"
"4/30/06 00:15","Walla Walla","WA","Circle","10 minutes","Objects appear in the sky in triangular formation, move at unbelievable speeds and percision. Make no sounds except when dropping stuff","5/15/06"
"4/30/06 00:11","Phoenix","AZ","Other","15 seconds","Golden flying wing.","5/15/06"
"4/30/06 00:05","Tigard","OR","Formation","45 sec.","Light Formation","7/16/06"
"4/29/06 23:55","Portland","OR","Light","3-5 minutes","Six Red Lights","5/15/06"
"4/29/06 23:54","Portland","OR","Sphere","ten minutes","Amber orb lights over downtown Portland.","5/15/06"
"4/29/06 23:50","Portland","OR","Changing","15/20 minutes","First time ever seeing these types of glowing objects!!","5/15/06"
"4/29/06 23:50","Portland","OR","Changing","15-20 minutes","I saw at least six bright glowing, orange in color objects in the sky over the city of Portland on Saturday night, 4-29-06.","5/15/06"
"4/29/06 23:50","Portland","OR","Changing","20 minutes","Six fiery, glowing objects, some at a standstill, then all six of them moved very slowly over the city of Portand, Oregon.","5/15/06"
"4/29/06 23:45","La Center","WA","Formation","2 minutes","Pairs of bright amber lights over Portland moving in formation","10/30/06"
"4/29/06 23:40","Portland","OR","Formation","5 min","orange lights over Portland OR","5/15/06"
"4/29/06 23:30","Portland","OR","Fireball","8 minutes","7 orange &quot;fireballs&quot;  in two groups over downtown Portland, OR","5/15/06"
"4/29/06 22:20","Jackson","CA","Circle","25 minutes","A starlike object developed a circle of light, moved a great distance rapidly, then released other smaller objects with flashing white","5/15/06"
"4/29/06 22:13","Idaho Falls","ID","Disk","15 seconds","5 UFOs Viewed Over the Course of 90 Minutes, 3 Saucers and 2 Odd Formations","5/15/06"
"4/29/06 21:00","West Yarmouth","MA","Unknown","30 min","Bright lights over Lewis Bay","7/16/06"
"4/29/06 19:30","New York City (Brooklyn)","NY","Cigar","3 minutes","My brother and I saw 3 objects flying over the 11203 zip code heading east out toward Long Island. 2 were flying in tandem a the 3rd wa","5/15/06"
"4/29/06 19:30","New York City (Brooklyn)","NY","Cigar","8 minutes","Three Cigarettes floating over Brooklyn","7/16/06"
"4/29/06 19:30","New York City (Brooklyn)","NY","Cigar","10 min","UPDATE,, I would like to cross ref my sighting with VANCOUVER, WA. His sighting appear to be the same as mines being that they saw 3 ob","7/16/06"
"4/29/06 19:30","South Salt Lake City","UT","Light","30 mins","The objects were small bright individual lights in the sky.","5/15/06"
"4/29/06 19:00","Minden","LA","Unknown","55 Seconds","WHILE I WAS TAKING A WALK I SAW TWO TINY DOTS IN THE SKY.","5/15/06"
"4/29/06 18:00","Philadelphia","PA","Rectangle","45SEC","MY WIFE AND I WAS ON OUR WAY TO OUR SON'S HOME WE WERE WALKING FROM THE CAR TO THE APARTMENT BUILDING AND ABOVE THE TREES IN FRONT OF U","7/16/06"
"4/29/06 13:55","Vancouver","WA","Triangle",":10","April 29, 2006: 3 black trangles observed flying slowly east over Vancouver, WA. Time 13:55-14:05.","5/15/06"
"4/29/06 13:40","Binghamton","NY","Unknown","20 seconds","high-altitude pulsed contrail","5/15/06"
"4/29/06 01:00","Boise","ID","Light","ongoing","v-shaped light suspende in the sky for long period of time.  ((NUFORC Note:  Possible celestial body.  PD))","5/15/06"
"4/29/06 01:00","Los Angeles","CA","Unknown","7 minutes","4/29/06 los angeles california 2 buble shape and transparent  last 1 minute in my room","5/15/06"
"4/29/06 00:30","College Place","WA","Circle","3 minutes","Two orange objects seen in eastern washington sky","5/15/06"
"4/29/06 00:02","Portland","OR","Light","5 mins","saw lite in sky at midnite on 29 april","5/15/06"
"4/29/06 00:00","Warren","OR","Disk","N/A","Clusters of Red Lights Seen In The Portland Area","7/16/06"
"4/28/06 23:10","Howard Prairie Lake Resort","OR","Rectangle","50min","We noticed a BIG, bright  light across the lake,  then it was instantly above us!","10/8/07"
"4/28/06 22:55","East Brunswick","NJ","Fireball","20 seconds","stationary bright fireball seen along the treeline","5/15/06"
"4/28/06 22:00","Jericho","VT","Rectangle","Half an hour or so but it","Rectangular object with rounded edges with gray outline around it and three lights which turned on and off from right to left in VT.","5/15/06"
"4/28/06 21:35","Reno","NV","Formation","45 seconds","Group of four points of light moving in a deliberate and manner unconventional for aircraft or satellites","5/15/06"
"4/28/06 20:04","Yakima","WA","Cigar","2 minutes","cigar-shaped object photographed on both the western and eastern horizon. 9 photos,2 sightings,1 object.","2/1/07"
"4/28/06 19:17","Los Angeles","CA","Triangle","10 minutes","Triangle trying to cloak over LAX airport","7/5/08"
"4/28/06 19:00","Salem","OR","Other","20 seconds","saw lazer light shaft 2 to 3 miles long.","5/15/06"
"4/28/06 18:00","South Shore","KY","Cigar","5 min","UFO over South Shore","5/15/06"
"4/28/06 12:00","Riverton","IL","Changing","5 minutes","An x shaped ufo seemed to change shape.","5/15/06"
"4/28/06 00:15","Theunisen (South Africa)","SA","Circle","45 minutes","object flash lights and move at fast speed","5/15/06"
"4/28/06 00:06","Vineland","NJ","Circle","5 MINS.","ENORMOUS, REDDISH/ORANGE , BRIGHT LIGHT, OVER TREE-LINE AREA, IN VINELAND, NEW JERSEY.","7/16/06"
"4/27/06 21:30","Williamsburg","VA","Other","3-4 min.","three aligned lights: white, red, white","5/15/06"
"4/27/06 16:30","Santa Maria","CA","Rectangle","approx 1 minute","Large rectangular object with red blinking lights that formed an arch, irratic movements, low flying, suddenly disappeared.","5/15/06"
"4/27/06 13:00","Portland","OR","Oval","1 minute","The UFO that I saw at 1 PM thursday the 27th of april 2006  ,hovering over downtown portland, was a white, rather opaque, imperfect cir","5/15/06"
"4/27/06 05:30","Naples","FL","Formation","15 seconds","Fuzzy lights over Naples, FL","5/15/06"
"4/26/06 22:50","Ishpeming","MI","Light","about 10 minutes","Odd light changing color, seemed to worry dog.","5/15/06"
"4/26/06 22:00","Mineola","TX","Other","1 hour","Slow moving, low flying 3 light object, not a helicopter, with a dual humming sound.","5/15/06"
"4/26/06 12:00","Alexandria","VA","Egg","Recess","((HOAX??))  Unidentifyed circuler objects near shcool, one repoted witness.","3/31/08"
"4/25/06 23:20","Portland (near)","OR","Rectangle","4 seconds","Faint transparent rectangle with red &amp; green southwest of Portland, Oregon.","5/15/06"
"4/25/06 22:30","Sturbridge","MA","Unknown","40 to 45 minutes","Cylinder of Light in the Night Skies.","5/15/06"
"4/25/06 14:45","Green River","UT","Teardrop","2-3 seconds","SILVER / CHROME METALLIC FLYING OBJECT 3 ft. to 4 ft. wide      by      8 ft. to 10 ft. long  Sighting:&#9;Object flew 37-50 feet above ou","7/16/06"
"4/25/06 12:00","Morgantown","WV","Fireball","20 seconds","Red/orange/blue bolt across the sky..","10/31/08"
"4/25/06 10:30","Biglake","MN","Light","3-4 minutes","SO WEIRD YOU WILL HAVE TO READ MY STORY","5/15/06"
"4/25/06 09:55","Wickenburg","AZ","Circle","night","2 orange lights in the sky stayed stationary and disappered and reapered","5/15/06"
"4/25/06 09:30","Mukilteo","WA","Disk","2 min","Departing KPAE Paine, Everett at approx 09:30 on 777, we notice 3 gray whales off the southern tip of wibley island.  While turning to","5/15/06"
"4/24/06 23:15","Yakima","WA","Light","10 minutes","Light....duration 10-15 minutes","5/15/06"
"4/24/06 22:15","The Pas (Canada)","MB","Light","2 hours","7 lights over period of 2 hours.","5/15/06"
"4/24/06 21:30","Loman","MN","Light","35 Minutes","Large red ball of light that multiplied into four separate lights at tree level, white lights flying at high altitudes.","7/16/06"
"4/24/06 19:32","Terrace (Canada)","BC","Light","5 seconds","Bright lights looked like flares going horizontal, out of no where, then disappeared","5/15/06"
"4/24/06 12:00","San Antonio","TX","Cigar","30 min","my brother and i wached 4 cigar shaped figures for about 20 min. ((NUFORC Note:  Student report.  PD))","7/16/06"
"4/24/06 04:30","Colorado Springs","CO","Unknown","while I am in here","This one is no obect- it moves about and doesn't seem to ever need any sleep though.","5/15/06"
"4/24/06 02:00","Sterling Heights","MI","Teardrop","15-30 SECONDS","Two teardrop shape crafts with orange lights hovered over parking area. Stayed high up.","5/15/06"
"4/24/06 00:36","Dallesport","WA","Changing","40 min.","egg-shaped UFO in south central Washington looked like a carnival ride in the sky","5/15/06"
"4/23/06 22:00","Roseburg","OR","Disk","still happening","sparkling, bouncing flashing light","5/15/06"
"4/23/06 21:30","Bremerton","WA","Other","1/2 second","Dissapearing Star?  ((NUFORC Note:  Flare from an Iridium satellite, we suspect.  PD))","5/15/06"
"4/23/06 21:15","Midland","TX","Changing","Sky watching","Shape changing orb with bright light in the middle that seems to take pictures.","5/15/06"
"4/23/06 21:15","Waynesboro","PA","Triangle","12 seconds","Crudely &quot;cloaked&quot; bomerang object flying do West across Pennsylvania night sky","5/15/06"
"4/23/06 20:30","San Diego","CA","Fireball","3-4 minutes","A flame floating through the sky moved slowly and closely above us before departing into space as a small red light.","5/15/06"
"4/23/06 11:45","Bluefield","WV","Fireball","40 seconds","AS MY WIFE AND I WERE COMING BACK FROM MY FAMILIES HOUSE IN MCDOWELL COUNTY, WE TOOK THE EXIT TO GO TO OUR HOUSE IN THE CITY OF PRINCET","5/15/06"
"4/23/06 11:00","Destin","FL","Unknown","1 minute","Large mirror-like object in the sky suddenly disappears during the daytime","5/15/06"
"4/23/06 05:30","Ogden","UT","Light","3 to 4 min","White dot of light  that changed directions a few time .","5/15/06"
"4/23/06 02:00","Fallbrook","CA","Light","2 minutes","yellow flashing lights from behind the hills","5/15/06"
"4/22/06 23:30","Pismo Beach","CA","Light","5-6 minutes","Strange lights in the sky above Pismo Beach","5/15/06"
"4/22/06 23:00","Chupadero","NM","Disk","20 minutes","2 bright lights chase each other within an illuminated cloud for 20 minutes north of santa fe, new mexico","5/15/06"
"4/22/06 22:10","Renton","WA","Light","5 seconds","driving home around 10ish.  I looked up into the sky and saw a bright light hovering.  Just as quickly as I saw it, it flew away at a t","5/15/06"
"4/22/06 22:00","Slater","MO","Light","2 minutes or so","Very bright light traveling slowly from West to East then shooting straight upward","5/15/06"
"4/22/06 21:45","Clarksville","IN","Fireball","20 min","Fireball floating in a circle patteren also making figure&quot;8&quot;s  slowly then speeding up out of sight","5/15/06"
"4/22/06 21:40","Anna","TX","Triangle","10 seconds","dark triangle no lights or sound","5/15/06"
"4/22/06 21:35","Springfield","OR","Light","10 min","looked like jupiter then began to fly eratically actross the sky from south to north","5/15/06"
"4/22/06 21:00","Asheville","NC","Unknown","2 minutes","2 UFO sightings in my area in the last week!","5/15/06"
"4/22/06 20:30","Whittier","CA","Fireball","20 minutes","We saw a bright red fireball like object that appeared to be too high to possibly be any earthling made air craft. The object appeared","5/15/06"
"4/22/06 20:30","Norwalk","CA","Light","15 Minutes","A bright, red, occasionally blinking object in the northeastern sky observed for about 15 minutes.","5/15/06"
"4/22/06 17:10","Lake Stevens","WA","Unknown","2 minutes","Daylight object, too small to be commercial aircraft at altitude, moved slowly west, paused, moved further west, then south.","5/15/06"
"4/22/06 17:00","Hanover","MD","Disk","30 Seconds","we were celebrating my 35th birthday, (having a cookout) and at about 5 PM Eastern Time, myself and 2 other people witnessed a &quot;disk&quot; m","5/15/06"
"4/22/06 03:15","Fairport","NY","N/A","8-10 sec","3-4 twirling noise whith no engine sound at all  -just a twirling noise","7/16/06"
"4/21/06 23:30","South Dennis","MA","Unknown","8 minutes","2 flying objects with revolving red lights blinking from right to left slowly flying south in night sky.I went out into my backyard","5/15/06"
"4/21/06 21:40","Albuquerque","NM","Triangle","10-12 sec","Strange light in a triangular formation","5/15/06"
"4/21/06 21:10","Burneyville","OK","Light","approx1min.","wobbly yellowish bright light passed overhead from southwest horizon to northeast horizon.  ((NUFORC Note:  ISS overflight.  PD))","5/15/06"
"4/21/06 21:05","Anza Borrego State Park","CA","Triangle","30 sec,","While camping in the Anza Borrego desert at the Fish Creek camping area, we had an excellent viewing of a large trianular aircraft.  It","5/15/06"
"4/21/06 21:00","Michigan City","IN","Sphere","2-3 hours","Flashing lights in the atmosphere.","5/15/06"
"4/21/06 20:30","Charlotte","NC","Unknown","10 min.","two UFOs crashed near my house","5/15/06"
"4/21/06 02:00","Austin","TX","Circle","2 seconds","3 grey saucers quietly souring through the sky, and disapearing.","5/15/06"
"4/20/06 22:40","Knoxville","TN","Cylinder","3 minutes","Green and orange lit cylinder flashed across the sky while outside at work.","5/15/06"
"4/20/06 22:05","Rochester","MN","Circle","4 minutes","1 satelight and  3 unknown white and red objects that followed in the opposite direction flying silent in the sky-","5/15/06"
"4/20/06 22:00","Newaygo/Croton","MI","Light","1hr +","Observed an object of pulsating lights moving in a circular nondescript pattern for greater than an hour.","5/15/06"
"4/20/06 19:43","Maricopa","AZ","Light","10 seconds ea","4-5 amber orbs seen over Sonoran Desert, south on 347","5/15/06"
"4/20/06 10:00","West Lafayette","IN","Fireball","couple seconds","Organge light that split into 3 then disappeare","5/15/06"
"4/20/06 09:10","Silver Spring","MD","Cigar","5 min.","Metalic cigar shaped objects passing over one another in Silver Sping Maryland.","5/15/06"
"4/19/06 22:50","Morinville (Canada)","AB","Other","2-3 minutes","Orange / yellow glowing wings with no persivible fuselage no sound.","5/15/06"
"4/19/06 22:20","Fort McMurray (Canada)","AB","Triangle","aprox 2min","On april 19th my girlfriend and were in the house when we decided to go out for a cigarette. We  went out the back and i looked up over","5/15/06"
"4/19/06 22:00","Peru","IN","Other","30 minutes","Saw a large number of UFOs flying rapidly above us, chasing each other, and suddenly disappearing unlike planes.","5/15/06"
"4/19/06 21:30","Claremore","OK","Light","3 seconds","white/blue light with white tail seen traveling south to north in Eastern Oklahoma","5/15/06"
"4/19/06 21:15","Kansas City","MO","Light","10 seconds","Bright Light Moving West To East In South KC","5/15/06"
"4/19/06 21:02","Newton","KS","Unknown","About 2 Seconds","Four or five lights, on a seeming spinning object.","5/15/06"
"4/19/06 20:10","Washington Court House","OH","Disk","2 minutes","Washington C.H. sighting on old US 35","5/15/06"
"4/19/06 20:10","Washington Court House","OH","Disk","5-8 minutes","April 19, 2006-Bright Light/Object in the sky in WCH, Ohio","5/15/06"
"4/19/06 19:15","Morrison","TN","Cone","8 min","brilliant bright light first falling down fast then stopped for several minutes","5/15/06"
"4/19/06 08:30","Maysville","NC","Sphere","10 seconds","I witnessed a spherical shaped object over Maysville, North Carolina on the morning of April 19, 2006","5/15/06"
"4/19/06 02:30","Las Vegas","NV","Light","about 2 hrs","Four short grayish black-eyed aliens appeared in my room.","5/15/06"
"4/19/06 00:30","Ottawa","IL","Light","30 min.","green lights circling from cloud to cloud","5/15/06"
"4/19/06 00:00","Mogollon Rim","AZ","Light","10 minutes","Weird lights in woods above Mogollon Rim, AZ.","4/27/07"
"4/18/06 22:18","DeLeon","TX","Light","20 seconds","See above","5/15/06"
"4/18/06 22:10","Crockett","CA","Other","on-going","The object sat in the sky twinkling blue, green and red lights for long time. It did not move at all.","5/15/06"
"4/18/06 22:00","Budd Lake","NJ","Light","5 to 7 minutes","Small starsized light, got brighter and changed direction twice beforte disappearing","5/15/06"
"4/18/06 14:36","Boyertown","PA","Triangle","2 minutes","Black Triange Shape Object watches two US Military Planes as they fly by in Boyertown, PA","5/15/06"
"4/18/06 14:30","Alexandria","VA","Sphere","2 minutes","I was on a bus leaving Landmark Mall Shopping Center.  It was a bright, sunny day with some high cumulus clouds.  As the mall sits on t","5/15/06"
"4/18/06 10:38","Eureka","CA","Sphere","2 to 3 minutes","Small black spherical object observed in the eastern horizon at about 30 degrees","5/15/06"
"4/18/06 08:36","Fairfield","CA","Unknown","2 min","invisible Helicopter","5/15/06"
"4/17/06 00:00","Grand Forks","ND","Circle","N/A","UFO looked black and moved very slow with no lights and was circular","5/15/06"
"4/17/06 23:00","West Fargo","ND","Circle","3 seconds","Small blue light traveling quickly across the sky.","5/15/06"
"4/17/06 22:31","Hartford","CT","Teardrop","2 minutes","Slow moving, glowing object sighted over Hartford.","5/15/06"
"4/17/06 22:25","Morgan","PA","Light","2 min.","2006-04-17 Silver light in SW sky flying North disappeared","5/15/06"
"4/17/06 21:15","Houston","TX","Oval","less than 30 seconds","Two light yellowish white luminescent oval objects moving in a straight path at an apparent high speed","5/15/06"
"4/17/06 19:30","Satellite Beach","FL","Light","6 minutes","4   flashing strobe-like objects move rapidly across the nite skyline and disappear into a light forming a many colored fast moving ob","5/15/06"
"4/17/06 17:45","Columbus","IN","Formation","few minutes","5-6 rapidly blinking lights seen travelling in a straight line.","5/15/06"
"4/17/06 14:00","Industry","CA","Oval","1 minute","White Ball over City of Industry","5/15/06"
"4/17/06 03:14","Surpriswe","AZ","Unknown","5 seconds","Bright white light followed by a tremendous boom sound","5/15/06"
"4/17/06 02:20","Surprise","AZ","N/A","1 second","At 2:20am a very powerful explosion sound occurred. It shook my entire house, woke the neighbors and set off car alarms throughout the","5/15/06"
"4/16/06 23:00","Washington, D.C.","DC","Triangle","20 minutes","This is my second report of these Triangular shapped flying objects with red flashing lights.  This second sighting compelled me to rep","7/16/06"
"4/16/06 22:35","Jackson","MI","Disk","10min","for 10 min 3 crafts hovered over our airport  with blue lights in a triangle then seperated in different directions","5/15/06"
"4/16/06 20:45","Filmore","UT","Diamond","15 minutes","Big, black, diamond shaped object seen in the distance from Filmore, Utah","5/15/06"
"4/16/06 20:05","Exeter","NE","Fireball","5 seconds that I saw","A reddish pink glow in sky, seemed to be moving towards us and then dissappeared.","5/15/06"
"4/16/06 19:40","Seattle","WA","Circle","20- 30 seconds","8 orange glowing round objects moving east to west in the same pattern, Seattle, Washington","5/15/06"
"4/16/06 19:00","Little Rock","AR","Fireball","45-60 seconds","The four of us were stargazing after closing up the bookstore. When from the west we notice a object coming towards us at first we thou","5/15/06"
"4/16/06 13:45","Lenior City","TN","Disk","2:00","UFO spotted over Oak Ridge TN.","5/15/06"
"4/16/06 09:54","Hoover","AL","Other","4 min","2 different ships 2 different days","5/15/06"
"4/16/06 02:00","Missoula","MT","Light","5 minutes","A bright white light like I've never seen before","5/13/12"
"4/15/06 23:00","Round Rock","TX","Light","20 Seconds","Bright white object that moved extremely fast and appeared out of nowhere.","10/30/06"
"4/15/06 23:00","Camp Albert Pike","AR","Unknown","2 minutes?","Strange light seen flying across sky actually 3 different lights.","5/15/06"
"4/15/06 22:10","Couburg (Canada)","ON","Formation","4 Sec.","There were 6 round craft that had an orange glow that flew from east to west at about mock 2 or 3 with no sound. They were flying in a","5/15/06"
"4/15/06 21:30","Cedarville (4 to 5 miles east of, on U. S. 42)","OH","Changing","1-2 minutes","Cigar Craft with Portholes or Lights","3/19/09"
"4/15/06 21:09","Kirtland","NM","Light","Approx 5 Mins.","Object sighted in NW NM was witnessed by 3 people, bright white and moved acrossed the sky and faded out.","5/15/06"
"4/15/06 21:00","Hutchinson","KS","Unknown","2:00min","We were going west on 11th st towards the Hutchinson Cosmosphere.  It was dusk and an object appeared that caught every one's eye in th","5/15/06"
"4/15/06 21:00","Pensacola","FL","Circle","2 Seconds","Circle of light travels through cloud, leaving a wake, in under to seconds to out of view.","5/15/06"
"4/15/06 21:00","Reading","PA","Triangle","1 minute or less","Bright triangle shaped object flies over gas station.","7/16/06"
"4/15/06 20:27","Vermilion","OH","Cylinder","5 minutes","The Video that was captured is on www.woio.com Couple see captures wierd object in the sky","5/15/06"
"4/15/06 17:15","Wilmington (suburbs)","DE","Sphere","1 minute","Brilliant sphere floats above the Wilmington Suburbs.","7/16/06"
"4/15/06 16:00","Columbus","OH","Formation","5 minutes","Formation of 6 to 7 objects in Columbus, Ohio","4/27/07"
"4/15/06 10:45","Mays Landing","NJ","Cigar","3 seconds","Silent, 1000 foot long, silvery white UFO spotted","1/5/11"
"4/15/06 07:00","Berwick","LA","Triangle","Not known","Huge Black Triangle and proof that something happened to me last night.","5/15/06"
"4/15/06 03:00","Rome","GA","Triangle","30 seconds","Triangular with lights on corners, made no sound, changed size, hovering over firetruck","11/28/07"
"4/15/06 02:04","Crystal Lake","IL","Oval","1 minute","a grey mettalic oval(s) seen high in the sky.  ((NUFORC Note:  Student report.  PD))","8/7/07"
"4/15/06 02:00","Denver","CO","Oval","3 SECONDS","GREEN BRIGHT LIGHT OVER DENVER","5/15/06"
"4/15/06 02:00","Irvine","PA","Unknown","5 Min.","object flashed lights down on river across from my house","1/21/08"
"4/15/06 01:30","San Antonio","TX","Oval","1 hr 32 min.","Invisable by the human eye but caught on infared film.","8/12/08"
"4/14/06 20:00","Shoreline (Seattle)","WA","Egg","5 sec","a large orange egg traveling at eye blinking speed thru the S.W sky, seemed to attract three smaller ogjects to it.","5/15/06"
"4/14/06 20:00","La Quinta","CA","Light","one minute or so","It was close to 8pm in the desert when a light in the eastern sky was bright and light beams shot accross the evening sky.  We were in","5/15/06"
"4/14/06 19:22","El Paso","TX","Other","less than 10 minutes","Crescent shaped objects over missle test range.","5/15/06"
"4/14/06 19:15","Naperville","IL","Sphere","60 seconds","Glowing orange sphere appearing near thunderstorm anvils","5/15/06"
"4/14/06 00:40","New York City","NY","Light","60","star like object high up in the sky making strange movements and somethings changing lights/color","5/15/06"
