"Date / Time","City","State","Shape","Duration","Summary","Posted"
"10/15/06 23:00","Mineral City","OH","Formation","1 minute","The right time and the right place,very lucky.","4/30/15"
"10/15/06 23:00","Lincoln","NE","Triangle","5 minutes","triangle craft","3/19/09"
"10/15/06 22:00","Thompson (Canada)","MB","N/A","5 days","Orions Belt    *nebula (faint) out in                      .","2/1/07"
"10/15/06 21:00","Charlotte","NC","Light","10 SECS","BRIGHT LIGHT TRAVELING IN STRAIGHT LINE FROM HORIZON TO HORIZON","10/30/06"
"10/15/06 20:00","Panacea","FL","Oval","5 seconds","Large orange orbs over Oclocknee River","12/14/06"
"10/15/06 19:00","Silver City","NC","Circle","20-30 minutes","Black Circle seen hovering in Carolina sky.","10/30/06"
"10/15/06 19:00","Las Cruces","NM","Light","seconds","Made me think of UFO.  Unsure what this was.  No camera available.  Solitary witness.","1/21/08"
"10/15/06 18:45","Beltzhoover","PA","Oval","30 min","Very LOW hovering AirCraft, Extreme Detail!","2/24/07"
"10/15/06 18:00","Howland","OH","Oval","5 minutes","Large, oval-shaped object, about 30 feet by 50 feet, passed directly over my car at about 100 feet.","1/23/16"
"10/15/06 18:00","Kalispell","MT","Teardrop","About 20 min","Mettalic, teardrop shaped object hover in the sky above house","4/27/07"
"10/15/06 17:00","Mettawa","IL","Triangle","15 seconds","Sitting in car and saw a large black triangular object hovering above the sky and then it suddenly shot up into the clouds.","2/19/16"
"10/15/06 15:30","Euharlee","GA","Circle","20 minutes","Invisable Object appears on Inhansed Pictures taken over Euharlee GA","2/1/07"
"10/15/06 13:00","Cape Cod","MA","Other","picture","one picture only on file","10/30/06"
"10/15/06 08:30","Las Vegas","NV","Circle","20 minutes","White Balls and Bright Light in the Vegas moring sky.","10/30/06"
"10/15/06 00:30","Lockport","IL","Circle","5 minutes","It was a dark circle with several exrememly bright, shiny, silver lines/beams emitting from the entire circle. It moved quickly from ea","10/30/06"
"10/15/06 00:15","Moab","UT","Fireball","1 minute","Object entering the atmosphere, 3 red, green and blue lights spinning and slowing down as if landing.","12/7/06"
"10/14/06 23:56","Beverly Hills","FL","Changing","about ten minutes.","Went outside for a late cigarette and a lighted object in the sky caught my attention and so I got my camera and took some pictures.","12/7/06"
"10/14/06 22:00","Buchanan","GA","Light","3-5 Minutes","Peculiar  flashing lights over Buchanan, Georgia!","10/30/06"
"10/14/06 21:30","Ogunquit","ME","Light","5 Minutes","Two bright lights faded over five minutes.","12/7/06"
"10/14/06 20:15","San Diego","CA","Fireball","30 sec.","I was facing south at approx. 8:15 PM sitting at a stop sign in my car, it was dark.I saw a streak of light and a contrail moving f","10/30/06"
"10/14/06 18:00","Provincetown","MA","Circle","three minutes","Bright oval light in western sky at sunset","10/30/06"
"10/14/06 02:25","New York City (Yonkers)","NY","Teardrop","2 minutes","Radiant White object viewed in sky from Bronx River Parkway in Yonkers","10/30/06"
"10/14/06 02:24","Fairfield","CT","Fireball","4 seconds","October 14.2006  2:24    Large bluegreen fireball fell acrosss the sky  in Fairfield Connecticut","10/30/06"
"10/14/06 02:00","Waterbury","CT","Fireball","5 seconds","2nd Witness: Large bluegreen fireball fell acrosss the sky in Fairfield Connecticut","2/1/07"
"10/14/06 02:00","Yuma","VA","Formation","5 minutes","((HOAX??))  two aliens appeared from a bright light to peacefully investigate the surroundings in the woods","4/27/07"
"10/14/06 01:25","Jaffrey","NH","Fireball","10sec","Brilliant white and blue fireball over Jaffrey , NH at 1:25am","10/30/06"
"10/13/06 22:00","De Soto","KS","Triangle","10 secends","Iridescent/transparant /triangle shaped UFO witnesses by 8 people on Thursday, 10/13/06 at 22:00 hours.","10/30/06"
"10/13/06 21:15","Omaha","NE","Light","25sec.","Group of  very dim lites-moving North to South   NO shape was defined!!!","10/30/06"
"10/13/06 20:50","Beaumont","TX","Triangle","10-20 sec","&quot;Black Triangle&quot; UFO with 3 White Lights on Each Point Seen in Beaumont, TX","10/30/06"
"10/13/06 20:30","Rawlins","WY","Triangle","30 sec","I was sitting in my hot tub looking at the sky when I noticed this triangular shaped object in the sky. It was so weird. I watched it c","10/30/06"
"10/13/06 19:30","Philadelphia","PA","Oval","30minutes","brilliant red oval object viewed from Port richmond Philadelphia","10/30/06"
"10/13/06 17:30","La Mesa","CA","Light","5-10 min","Streaking lights over San Diego.  ((NUFORC Note:  Possibly a laser-based advertising light???  PD))","12/7/06"
"10/13/06 13:00","Trout Lake","WA","Unknown","5 minutes","Craft landing on Mt. Adams","10/30/06"
"10/13/06 10:30","Vandenberg Village","CA","Disk","less than 1 minute","Platinum color saucer weaving through fog/mist in hills by ocean object vanished into small white spark as soon as I pointed it out","10/10/11"
"10/13/06 06:40","Gonzales","CA","Changing","Unknown","Three lights hoovering near Gonzales, CA","10/30/06"
"10/13/06 05:00","Brewer","ME","Light","4 min","fast moving aircraft aproaching a strange light.","12/7/06"
"10/13/06 04:30","Simco (20-40 km west of) (Canada)","ON","Circle","30 seconds","Hovering 300m in the air 500m off road side one bright middle light and a dimmer light circling the object no red and blue lights like","10/30/06"
"10/13/06 02:00","Tamarac","FL","Cylinder","35 sec","I was in north university st is  amayor st in fl , i couldn't believe my eyes as i was waiting for the red ligth to turn green, notice","10/30/06"
"10/12/06 22:30","Boulder","CO","Triangle","10 seconds","Object appeared for about 10 seconds triangle shape","10/30/06"
"10/12/06 20:00","Pontiac","MI","Light","hour","massive intense lights over Detroit Michigan  Thursday night, 2 objects.","10/30/06"
"10/12/06 18:30","Victoria (Canada)","BC","Unknown","N/A","Saw bright large light 2000 feet,Juan de Fuca strait,4 miles south of Victoria Dissappeared with out moving","10/30/06"
"10/12/06 17:50","Altamonte Springs","FL","Sphere","30 sec. +/-","Sphere shaped UFO Seen in Altamonte Springs, FL by a young girl 10/12/06","10/30/06"
"10/12/06 17:30","Seekonk","MA","Formation","4-5 minutes","Ufo, massachusetts, circular, discs, formation, triangle","10/30/06"
"10/12/06 01:23","Cornwall (Canada)","ON","Sphere","27 minutes","Floating red object over local baseball field.","10/8/07"
"10/11/06 23:00","Pampa","TX","Triangle","1 minute","Two triangular objects, lit up by three main lights and other lights in between, moving simotaniously to the East over Pampa Tx.","10/30/06"
"10/11/06 22:00","Enid","OK","Light","about 1 minute","Fast moving ball of light speeds across the sky.","10/30/06"
"10/11/06 21:32","La Crescenta","CA","Circle","3 seconds","White light imploded","10/30/06"
"10/11/06 21:00","Milton","FL","Light","15 MINUTES","THE LIGHTS KEPT FLASHING AND MOVING AT VERY HIGH SPEEDS SHOWING UP THEN WOULD BE GONE IN AN INSTANT THEN FLYING SIDE WAYS UNLIKE ANY PL","10/30/06"
"10/11/06 20:45","Pensacola","FL","Diamond","1 hour","Six orange glowing diamond shaped objects in two separate clusters due east of Pensacola","10/30/06"
"10/11/06 19:30","Two Harbors","MN","Light","10 minutes","Northern Lights ?? Right!","12/7/06"
"10/11/06 19:00","Monterey Park","CA","Fireball","1 -2 minutes","huge ball of fire hanging in the sky","12/7/06"
"10/11/06 11:29","Lynnwood","WA","Unknown","a few minutes","I noticed a very white tail behind an object traveling north in the southern sky. It appeared to be very high and far away. The object","10/30/06"
"10/11/06 09:00","LittleRock","AR","Oval","10 minutes","The first object was shaped like an oval and appeared coming out the southwest traveling in an eastern direction this object appeared t","10/30/06"
"10/11/06 05:40","York","ME","Disk","30 seconds","Illuminated but not shiny disc  with three large pulsing lights underside, white to red, following path along the Atlantic coastline.","10/30/06"
"10/11/06 02:00","Calumet City","IN","Circle","7 minutes","i work as a security guard at the calume t city airport. i have grave yard shift fom 11:pm to 7 am. i was doing my round checking the p","10/30/06"
"10/11/06 01:25","Nashville","TN","Disk","13 sec","Circle shaped solid white object flying through clouds.","10/30/06"
"10/10/06 23:55","Knik","AK","Triangle","5","Slow moving, no sound,  illuminated (craft) triangle over Point McKenzie, Alaska.","10/30/06"
"10/10/06 23:00","Lyndhurst","OH","Unknown","5 minutes","This is a follow up to my Feb. 16th, 1995 report.  This past Tuesday, my wife and I AGAIN heard the same loud, rumbling roar that we he","10/30/06"
"10/10/06 22:50","Wolfforth","TX","Disk","5 min","Huge aircraft with diagnally aligned white lights moving slowly and loudly through the night.","10/30/06"
"10/10/06 22:40","Waycross","GA","Light","2 minutes","Redish orange light viewed from Waycross ,Ga. Moving Northwest and suddenly just goes out.","10/30/06"
"10/10/06 20:00","Bray","OK","Other","6 mins","Glowing V Shaped Object flying Low making no sound.","12/12/09"
"10/10/06 19:00","Unsure","AR","Fireball","a few seconds","Extreme sound with trails and orange red blue hues to it.  The trails were bright bright white.","12/7/06"
"10/10/06 16:00","Savannah","TN","Light","10 minutes","weird light that moved in the sky","10/30/06"
"10/10/06 16:00","Waynesboro","VA","Triangle","8-10 minutes","Large...beautiful...and brighter than anything I've ever seen....How small I have felt since....","10/30/06"
"10/10/06 12:37","Blairsville","GA","Unknown","N/A","Intermittant streak by moon, not seen on photo taken 10 seconds earlier.","10/30/06"
"10/10/06 05:00","San Francisco","CA","Triangle","10 minutes","black triangles were seen flying across the surface of the full moon","10/30/06"
"10/10/06 01:00","Pennington","TX","Diamond","one hour","IN form of diamond with multi colored lights that acted like disco light except one.  theone light was like a brite star and would resp","2/1/07"
"10/9/06 23:00","Cathedral City","CA","Light","10 mins","object comes from behind the moon","10/30/06"
"10/9/06 23:00","Indianapolis","IN","Light","1 minute","I was casually observing stars in the clear night sky, when a somewhat brilliant white light high up in the northwestern sky caught my","4/27/07"
"10/9/06 22:30","Arbuckle","CA","Fireball","5 seconds","I was traveling North bound on I-5, with a terrific view of the horizon, flat land. I-5 runs North/South through california. When all o","10/30/06"
"10/9/06 22:00","Watkins Glen","NY","Circle","in the sky","My husband and I were out side talking, when I saw what I thought was a star at first.I told my husband it wasnt a star at all.It h","10/30/06"
"10/9/06 22:00","Roanoke","VA","Light","2 seconds","Brilliant greenish/white object drops from sky.  ((NUFORC Note:  Possible meteor??  PD))","10/30/06"
"10/9/06 21:05","Deer Park","NY","Rectangle","a few seconds","lighted rectangular object seen over Deer Park Avenue","10/30/06"
"10/9/06 20:43","Orefield","PA","Light","N/A","Possible UFO crash","10/30/06"
"10/9/06 12:43","Tampa","FL","Light","3 seconds","3 sets of two lights move fast over tampa","10/30/06"
"10/9/06 08:00","Tucson","AZ","Oval","35 sec","A fleet of white light round in shape over Mt. leamon travling at a high rate of speed speed set the apart from a nomal air craft. I wa","10/30/06"
"10/9/06 04:15","Allentown","NJ","Sphere","2 or more hours","Multicolored fiberoptic looking sphere.  ((NUFORC Note:  Possible twinkling star.  PD))","10/30/06"
"10/8/06 23:00","Massapequa","NY","Unknown","4 hours","flashing ball of colorful lights.  ((NUFORC Note:  Possible twinkling star.  PD))","10/30/06"
"10/8/06 23:00","Grosse Pointe Woods","MI","Light","30min-1hr","3 lights seen over Lake St. Claire in Michigan.","10/30/06"
"10/8/06 20:11","San Jose","CA","N/A","N/A","green laser into cockpit","10/30/06"
"10/8/06 20:00","Sebastopol","CA","Light","10-12 seconds","Extremely bright white light speeding SE, high over the Northern California coast.  ((NUFORC Note:  Possible Iridium satellite.  PD))","10/30/06"
"10/8/06 18:30","Eugene","OR","Formation","2-3 min","formation of lights 4 white 1 red with amazing sign-wave pattern over entire craft.","10/30/06"
"10/8/06 17:30","Scarborough","ME","Light","10 - 15 Minutes","Very fast moving lights &quot;chasing&quot; each other and moving very eratically.","10/30/06"
"10/8/06 17:00","San Diego","CA","Cigar","still there","Odd Object Spotted  high in the sky over San Diego","10/30/06"
"10/8/06 14:02","Anchorage","AK","Disk","1:00","black disc-shaped object rose from behind a mountain then stopped and moved quickly to the south against a heavy wind","10/30/06"
"10/8/06 14:00","Lake George","NY","Rectangle","5 minutes","Hovering object over  Lake George defies logic","10/30/06"
"10/8/06 01:00","Holden Beach","NC","Triangle","1 hour 30 minutes","3 lighted triangular aircraft.","10/30/06"
"10/7/06 23:00","Fulton","OH","Oval","3 Minutes","Bright white light, oval shape, moving quickly","10/30/06"
"10/7/06 22:15","Deer Park","NY","Unknown","10 minutes","a white flashing light east of deer park, with scatter colors (maybe blue/green/red) stays stationary for over 10 minutes now.((Star??)","10/30/06"
"10/7/06 16:02","Arlington","TX","Cylinder","96 minutes","Around 16:00 on 10.7.06, I spotted a cylinder like object NNW of Arlington, TX. I observed the object for around 10 min, it didn't appe","10/30/06"
"10/7/06 02:00","Blacksburg","VA","Light","5 min?","Ball of light at ROTC training","10/30/06"
"10/7/06 02:00","Denver","CO","Other","15 to 20 minutes","Triangle like object appears, lands then dissapears near littleton hospital","10/30/06"
"10/7/06 01:52","Surprise","AZ","Light","38- 40+ minutes","I couldn't sleep so I went outside to smoke. Noticing that the clouds appeared to be much brighter than usual,I walked into the yard to","10/30/06"
"10/6/06 22:30","Brighton","CO","Other","15 seconds","Craft with lights hovering over houses at night","10/30/06"
"10/6/06 22:00","Bakersville (Roan Mountain)","NC","Disk","8-10 seconds","I don't have a calandar handy, it was on the first Friday in October 06. I observed a round object for about 8 or 10 seconds. It had a","4/27/07"
"10/6/06 18:56","Lisbon","OH","Light","Ten seconds","Dot of light moves across the sky twice.","10/30/06"
"10/6/06 18:00","Centerville","OH","Changing","2 hours","Dayton,Oh. Very bright round objects in a group of 10, then 2 very different shapes,and 1 stationary object,","10/30/06"
"10/6/06 17:30","Grand Rapids","MI","Cigar","5 minutes","Standing in the front yard, 4 of us watched a silver cigar shaped craft move slowly across the sky and suddenly pick up speed andvanish","10/30/06"
"10/6/06 17:30","Texarkana","TX","Triangle","5 min.","Hugh triangle, larger than 2 747's put together. I observed it through 8 power binoclars. It was a very bright white color appx. 15,000","10/30/06"
"10/6/06 17:00","Phoenix","AZ","Other","1.5 hours","Amorphous black object hovering over Phoenix for 1.5 hours","10/30/06"
"10/6/06 09:00","Chester","NJ","Disk","10 seconds","I saw a disc shaped object flying across the sky.","10/30/06"
"10/6/06 02:00","Columbia","MO","Flash","3 seconds","Stephen's Park Columbia, MO.  Football shaped light in the sky takes odd turn.","10/30/06"
"10/6/06 02:00","Orchard Park","NY","Light","30 minutes","update and correction","10/30/06"
"10/5/06 23:00","St. Charles","IL","Formation","20 minutes","Strange deep red light very slowly tracing over rural St charles, IL","10/30/06"
"10/5/06 20:30","Sun City (west of Phoenix)","AZ","Light","about 30 min.","Circles of light meet and separate in a distinct pattern","10/30/06"
"10/5/06 19:45","Honolulu","HI","Sphere","1 minute","One minute sighting of massive football sized sphere about 2000 ft up","10/30/06"
"10/5/06 10:38","Johnson CIty","NY","Cylinder","2 minutes","Silver flying cylinder.","10/30/06"
"10/5/06 10:30","Lehigh Acres","FL","Other","15 SECONDS","Aliens on satilite T.V.?","6/12/07"
"10/4/06 22:45","Minneapolis","MN","Other","5 Seconds","Glowing green object crosses Twin Cities at low altitude","10/30/06"
"10/4/06 22:36","Plymouth","MN","Flash","3 seconds","Very bright, streaking object blueish green in color traveling west over the western suburbs of Minneapolis.","10/30/06"
"10/4/06 22:00","Sacramento","CA","Light","one click","10/04/06 22:00 Sacramento CA white light one minute object in a picture 02/04/07","2/24/07"
"10/4/06 21:10","Salem","IN","Light","20 mins","stationary -bright- sparkling/twinkling object in mid northwestern sky. 9:05 - 9:25pm est","10/30/06"
"10/4/06 20:00","Water Valley","MS","Fireball","6 secpnds","Fireball observed in N. Mississippi","10/30/06"
"10/4/06 19:30","San Diego","CA","Sphere","30 seconds","more ufos in san diego california","10/30/06"
"10/4/06 19:00","Raven","KY","Oval","30-60 seconds","Saw a dark object with greenish glow fly across the hills of kentucky.  ((NUFORC Note:  Student report.  PD))","4/27/07"
"10/4/06 14:30","Lancaster","CA","Disk","3-5 minutes","While taking pictures of clouds, observed dics shaped object hovering in front of the clouds.","10/30/06"
"10/4/06 10:50","New Richmond","WI","Fireball","10-25 seconds","I saw a strange site tonight so I went to my computer to google to see if there was a &quot;star shower&quot; or something going on tonight.  I c","10/30/06"
"10/4/06 10:20","Sacramento","CA","Unknown","N/A","Very white object capture by a digital camera","11/28/07"
"10/4/06 03:30","Lake Ridge","VA","Changing","2 minutes","A double tiered object seen in the sky from Lake Ridge, Virginia.","10/30/06"
"10/4/06 02:00","La Porte","IN","Light","at leat 1 hour","Bright nocturnal lights","10/30/06"
"10/4/06 01:00","Omaha","NE","Flash","ongoing","white flashes and red laser beams","12/7/06"
"10/3/06 23:45","Portland","OR","Circle","45 minutes","Two nights after my first encounter I spotted another last night! I was out on my porch watching the stars when one of them moved. The","10/30/06"
"10/3/06 23:25","Orange","CA","Other","10 minutes","Oddly shaped object hovering above Orange County, California, then flying off under power.","10/30/06"
"10/3/06 23:15","Santa Fe","NM","Cone","approx 1 minute","Fiery object moving south to north which separated into approx 5 small objects which trailed it in a straight line","10/30/06"
"10/3/06 22:00","Lakewood","CA","Fireball","4min","Dripping ball of light","10/30/06"
"10/3/06 21:43","Ravenna","OH","Other","30 seconds","Shooting Object Across Ravenna Sky","10/30/06"
"10/3/06 21:00","Canton","GA","Unknown","a few seconds at a time f","Black spec passing in front of the moon several times.","10/30/06"
"10/3/06 21:00","Dufur","OR","Disk","2 minutes","3 flashing lights at exact distances crossed entire sky over a field and ducked behind a hill in less than 2 minutes.","10/30/06"
"10/3/06 20:15","Garfield","AR","Unknown","about 45 sec.","2 LIIGHTS OVER BEAVER LAKE.","10/30/06"
"10/3/06 20:00","Miles City","MT","Oval","10MIN, TO 15, MIN","was sitting at my porch watching the evening sky,as i was watching i saw what i first thought was a plane comeing from the south ,we ge","12/7/06"
"10/3/06 19:30","Shreveport","LA","Unknown","6-8 minutes","2 different objects seen in Louisiana","10/30/06"
"10/3/06 19:00","Bailey","CO","Sphere","10-15 minutes","Colorado 10/03/06","10/30/06"
"10/3/06 17:25","Oceanside","CA","Unknown","1 or 2 minutes","Silver metallic object seen hovering high above suburban intersection in late afternoon sky, might be two objects.","10/30/06"
"10/3/06 03:40","Utica","NY","Cigar","10 MIN","I was looking at the stars,as I stopped on a rest area. At one point i seen these 2 stars moving, at first i thought it was a cloud pas","10/30/06"
"10/3/06 03:30","Braintree","MA","Light","45 minutes","We witnessed blinking lights that moved rapidly in all directs and that, once &quot;still&quot;, emitted sparks.","10/30/06"
"10/3/06 03:30","Milwaukee","WI","Sphere","1 hour","Reaccuring semi-stationary, color alternation spheres","10/30/06"
"10/3/06 00:15","Newburgh","IN","Sphere","2 minutes","Large orange ball of light hovering 200-300 feet from our home.","10/30/06"
"10/2/06 23:15","New York City (Manhattan)","NY","Unknown","1 minute","&quot;U&quot; shaped formation of 15-20 yellow lights flew from southward above new york city at approximately 11pm on Monday October 2, 2006","10/30/06"
"10/2/06 22:50","Huntington Beach","CA","Changing","7 min","UFO over hUntington beach CA with helicopter circling it","10/30/06"
"10/2/06 22:45","Huntington Beach","CA","Light","10 minutes","Large craft with two red lights hovering in sky tracked by a police helicopter for several minutes.","10/30/06"
"10/2/06 20:02","Joplin","MO","Light","7 min","Two bright lights turn into 20 to 30 planes!","10/30/06"
"10/2/06 19:53","WIckenburg","AZ","Formation","4 minutes","4 yellow lights, aligned in a crescent shape appeared, then disappeared.","10/30/06"
"10/2/06 17:00","Denver","CO","Chevron","30 secs","My sister and I grew up in a model aviation building/flying family and we both have a keen knowledge of the state of aviation art in fl","10/30/06"
"10/2/06 17:00","New York City (Brooklyn)","NY","Changing","10 minutes","Photos of a UFO above Manhattan.","10/30/06"
"10/2/06 07:45","Crozet","VA","Other","1.5 seconds","squiggle of light right over the car in the fog","10/30/06"
"10/2/06 03:00","Santa Fe/Los Alamos","NM","Light","1hr","Possible UFO over Santa Fe/Los Alamos","10/30/06"
"10/2/06 02:00","McKinney","TX","Fireball","Several Seconds","While driving along intersate 380 toward the west in McKinney, Texas, on my left out of my peripheral vision, I could see what appeared","10/30/06"
"10/2/06 00:45","Portland","OR","Circle","1.5 hours","I was sitting outside on my porch after midnight. As I sat there I looked out above my neighbors house to see two stars about an inch a","10/30/06"
"10/2/06 00:16","Amelia","OH","Unknown","Seconds","Frisby-like sound outside of window around midnight.","10/30/06"
"10/1/06 23:40","San Antonio","NM","Circle","20 SECONDS","ON SUNDAY 10 01 06 MY WIFE AND I WERE DRIVING HOME FROM WHITE RUIDOSO NEW MEXICO. APPROXIMATLEY AT 11:20 PM I NOTICED OFF TO MY LEFT BO","10/30/06"
"10/1/06 23:32","Farmington","NM","Light","10 -14 sec","a bright lights traveling very fast with a green tail that exploded into four lights!","10/30/06"
"10/1/06 23:30","Pueblo West","CO","Light","5 minutes","4-5 bright whitish-orange lights in Pueblo West, Colorado on 10/1/06 at 11:30 p.m.","12/7/06"
"10/1/06 23:27","Monument","CO","Other","N/A","Four bright star-like objects, observed from Monument, CO, 2317 hrs, 10/1/06, traveling SW-NE at high rate of speed, no sound, ","10/30/06"
"10/1/06 23:20","Sedalia","CO","Formation","30 seconds","5 bright, totally silent, fast moving lights  viewed in night sky near Deckers, CO on 10/01.","10/30/06"
"10/1/06 23:20","Boulder (foothills of)","CO","Sphere","6 seconds","4 very large bright spherical objects -- one green, the others red or orange -- moving at high speeds upward in linear series","10/30/06"
"10/1/06 23:20","Raton","NM","Formation","30secs","7 bright lights over northeast new mexico","10/30/06"
"10/1/06 23:20","Grand Junction (15-20 miles","CO","Light","1 minute","6 LIGHTS FLOATING OVER DEBEQUE CANYON","10/30/06"
"10/1/06 23:20","Raton","NM","Formation","less than a minute","Seven Bright Lights in New Mexico Skies","10/30/06"
"10/1/06 23:20","Silverthorne","CO","Light","10 seconds","I saw about six lights coming toward our house in a straight line, and one at a time from the furthest away, they went out.","10/30/06"
"10/1/06 23:20","Cripple Creek","CO","Fireball","15 + seconds","Fireball object in Western Sky","10/30/06"
"10/1/06 23:17","Cascade","CO","Circle","15 seconds","I was standing on my deck facing east when I saw orange objects fly from north to south. They appeared to maybe be comets but I cannot","10/30/06"
"10/1/06 23:15","Boulder","CO","Oval","30 sec","October 1, 2006 meteor reported across skies of Arizona, New Mexico, and Colorado","10/30/06"
"10/1/06 23:15","Fairplay","CO","Unknown","30 seconds","Six orange lights observed in the sky by three people, moving at constant speed and altitude from south to north.","10/30/06"
"10/1/06 23:15","Pueblo West","CO","Sphere","10 seconds","Strange Lights in the Sky  Over Colorado   October 1, 2006","10/30/06"
"10/1/06 23:15","Denver","CO","Circle","30 sec","Large bright white light with evenly spaced smaller lights in trail east of Denver moving northeast, as seen by airline pilot at FL380","10/30/06"
"10/1/06 23:15","McCoy","CO","Light","1.25 minutes","Four silent lights flew over our home.","10/30/06"
"10/1/06 23:15","Cerrillos","TN","Changing","45 seconds","White fireball on huge object flying horizonally before changing colors, emitting orange balls of light and evaporating","10/30/06"
"10/1/06 23:15","Edwards/Vail (between)","CO","Formation","2-3 min.","Globular formation of 5-7 bright ball lights seen first and last as &quot;shooting stars&quot; by driver on I-70 near Vail, Co.","2/24/07"
"10/1/06 23:15","Santa Fe","NM","Light","30-45 seconds","about 23:15   sunday, 10/1/06--a slow-moving horizontal strip of white light that shown into my room and then truned blue and moved off","10/30/06"
"10/1/06 23:15","Canon City","CO","Light","1 1/4 minutes","Large bright light with aura, &quot;fireworks&quot; features, then several distinct white lights","10/30/06"
"10/1/06 23:15","Hartsel","CO","Fireball","1 minute","Several glowing objects gracefully and silently following each other moving south to north in eastern sky 500 to 1000ft  high","10/30/06"
"10/1/06 23:15","Taos","NM","Formation","2.5mins","segmented flashing formation w/ &quot;v&quot; formation of glowing lights leading S. to N.E., Taos NM (Northern NM)","2/1/07"
