"Date / Time","City","State","Shape","Duration","Summary","Posted"
"5/27/10 22:00","Chicago","IL","Fireball","15 seconds","((HOAX??))  Glowing Fireball witnessed by 6 sober people in front of a chicago bar.","6/3/10"
"5/27/10 21:00","Apple Valley","CA","Light","45 min","High Altitude Bright Objects appearing in the sky accompanied  by smaller, faster objects.","6/3/10"
"5/27/10 20:00","Summer Lake","OR","Other","3+ hours","multiple light emitting/color changing objects, much of the time moving at a high speed.. .((NUFORC Note:  Twinkling stars?  PD))","7/6/10"
"5/27/10 17:58","Palmdale","CA","Circle","2 minutes","round black orb about 10 feet wide was spotted. Reflect a white color as the Sun light hit object. Slow moving.","6/3/10"
"5/27/10 01:00","Tucson","AZ","Disk","1O MINUTES","((HOAX??))  Tucson, AZ Saucer caught on Video!!","6/3/10"
"5/27/10 00:00","Grand Junction","CO","Unknown","one hour","UFO Over Western Colorado May 27, 2010?","6/3/10"
"5/26/10 23:45","Arlington","TX","Light","3 seconds","A star like object moving up and down rapidly and disappeared in the sky","6/3/10"
"5/26/10 23:25","Norwalk","CA","Light","5 seconds","about 8 different shaped, circular lights. moving slow across norwalk, ca","6/3/10"
"5/26/10 23:15","Morristown","TN","Triangle","2 hours","triangular shaped craft in sky over east tennessee","6/3/10"
"5/26/10 22:00","West Memphis","AR","Light","Two hours","I small star like object moved and changed directions several time for a total of two hours","6/3/10"
"5/26/10 22:00","Claremont","CA","Fireball","30 seconds","Around May 25th at 10:00,  a huge, very slow moving fireball-like object could be seen from Claremont for 30 seconds.","7/19/10"
"5/26/10 22:00","Johnstown","PA","Light","30 minutes","Bright Orange (oval shaped) object over Johnstown PA flys for short period then remains stationary in sky for over 30+min","6/3/10"
"5/26/10 20:30","Santa Ana","CA","N/A",">20 min","Rectangular slinky which had the appearance of being made of flat black ribbon dangling from clouds for 10 miles definitely not smoke,","1/5/11"
"5/26/10 09:30","Santa Fe","NM","Formation","1:00","Two gold &quot;star like&quot; objects moving silently in formation.","6/3/10"
"5/26/10 03:30","Miami","FL","Disk","10 mins","((HOAX??  Date discrepancy.)  my girlfriend and i were laying outside on a hammock around 3:30 we were both awaken by a humming noise","6/3/10"
"5/26/10 00:20","Louisville","KY","Changing","its still in the sky","Two crafts Hover over Neighborhoods","6/3/10"
"5/25/10 23:00","Mount Washington","KY","Triangle","45 minutes","Flashing multi-colored lights appear to be in triangle shape form hovered for 45 mins then disappeared.","6/3/10"
"5/25/10 22:00","Albuquerque","NM","Flash","10min","a bright light over Albuquerque NM","6/3/10"
"5/25/10 21:48","La Mesa","CA","Teardrop","Few Seconds","Tear drop comet looking objects in the sky","6/3/10"
"5/25/10 21:35","St. Louis (Creve Couer)","MO","Light","30 seconds","White Light, circular, N to S flight path, dim at first then bright whight back to dim, 30 seconds","6/3/10"
"5/25/10 21:30","Los Angeles","CA","Light","30 seconds","Single bright light appeared to approach and then move off to the south in the sky over Los Angeles. ((NUFORC Note:  Reflection?  PD))","6/3/10"
"5/25/10 21:30","Fort Leonard Wood","MO","Unknown","5 Seconds","Circular lights in sky over Fort Leonard Wood, MO","6/3/10"
"5/25/10 21:30","New York City (Bronx)","NY","Unknown","20","a few red light many white illumining lights,  in the Bronx, observed from my bedroom window and the other individual was in the street","6/3/10"
"5/25/10 18:00","Quakertown","PA","Cigar","30 sec","White cigarette shaped object traveling northbound Quakertown Rt. 309","6/3/10"
"5/25/10 14:00","Las Vegas","NV","Oval","5 minutes","Las Vegas Nevada. White orb in the sky spotted at 2:00PM, Orb then disappeared and re-appeared several times over a period of about 5 m","6/3/10"
"5/25/10 13:30","Las Vegas","NV","Changing","ONE MINUTE","25/5/10 OVER NEVADA WHITE IN COLOUR TURNED VERY QUICK BRIGHT SUNNY AFTERNOON","6/23/10"
"5/25/10 04:07","Circleville","OH","Other","90 seconds","I went outside to look at the stars, bored out of my mind and that is what I do when I get bored.  I have been seeing an unusual amount","6/3/10"
"5/24/10 21:30","Fort Leonard Wood","MO","Fireball","20 seconds","a dog fight between two foes","6/3/10"
"5/24/10 21:00","St. Catharines (Canada)","ON","Fireball","5 minutes","Dazzling fireball drifts over St. Catharines","8/7/11"
"5/24/10 20:00","Westbrook","ME","Oval","30 minutes","bright light in the sky in westbrook maine  ((NUFORC Note:  Either Venus, or a twinkling star??  PD))","6/3/10"
"5/24/10 14:30","Charlestown","RI","Other","1 hour","Strange aircraft again over southern Rhode Island","6/3/10"
"5/24/10 09:15","Green Lake","WI","N/A","Still going on, 30 min an","At present, there has been a light in the southwest sky, about half way between the moon and Venus, it has been moving in all patterns,","6/3/10"
"5/24/10 07:45","Honolulu","HI","Sphere","60 sec","I was on the Sandy beach at 0745 and had noticed something flying over me and as I looked I saw that there were 7 sliver spheres half s","6/3/10"
"5/24/10 03:30","Holiday Hills","IL","Triangle","1 hour","object in sky falls from sky stops for 30 - 40 seconds , illuminates then flies back up to stars","6/23/10"
"5/23/10 23:45","Rolling Meadows","IL","Circle","5 minutes","We saw a circular object flying low in sky with 3 bright blue rotating lights, and it was silent.","6/3/10"
"5/23/10 21:00","Mt. Pocono","PA","Cross","30 minutes","80-W and 380-N Intersection Sighting of Cross-Shaped UFO","6/3/10"
"5/23/10 20:55","Brooksville","FL","Light","2 min","Red light seen towards the east coast of central florida","6/3/10"
"5/23/10 02:15","Dallas","TX","Disk","10 seconds","UFO","6/3/10"
"5/23/10 02:00","Los Gatos","CA","Oval","5 minutes","I saw a large, dark, slow, loud, UFO that was 60 ft from the ground.","6/3/10"
"5/23/10 01:16","Algonac","MI","Fireball","5 -7 minutes","Fireball over canal, changed directions and eventually split into 3 lights forming triangle.","6/3/10"
"5/22/10 23:45","Galveston","TX","Fireball","2min","Orange Craft Seen Over Galveston Bay","6/3/10"
"5/22/10 22:30","Brook Park","OH","Light","15 minutes","4 lights, moving across the night sky, changing directions and speeds.","6/3/10"
"5/22/10 22:05","Portland","OR","Light","30 mins","The object had a slight amber tint to it.  It looked like a satellite, or star, but then it started to change directions. Almost like a","6/3/10"
"5/22/10 22:00","Little Chute","WI","Light","40 seconds","Bright white light moving from north west to south east. Near the Big Dipper constellation. The Light disappeared after it went past th","6/3/10"
"5/22/10 22:00","Orlando","FL","Light","10 min","((HOAX??))  It was bright orange like a street light then went dim","5/29/11"
"5/22/10 22:00","Ottawa (Canada)","ON","Light","2 mins","Orange cluster of lights followed by six points of white light - moving in night sky and changing direction.","6/3/10"
"5/22/10 21:24","Lee's Summit","MO","Triangle","10 minutes","Black triangle in Lee's Summit, MO near Lake Jacomo","6/3/10"
"5/22/10 21:00","Fairless Hills","PA","Fireball","4 minutes","Flame flying across sky","6/3/10"
"5/22/10 20:27","Rockford","IL","Triangle","2 minutes","Transparent ship with triangular positioned lights in Rockford, Illinois","6/3/10"
"5/22/10 20:15","San Francisco","CA","Oval","1min","oval gray flying saucer","6/3/10"
"5/22/10 20:00","Raleigh","NC","Fireball","3 minutes","25 slow moving, interactive fireballs seen in downtown Raleigh on Saturday night.","8/5/12"
"5/22/10 11:58","Howard Beach","NY","Circle","30 minutes and counting","A bunch of circlular moving into each other below the clouds","6/3/10"
"5/22/10 04:00","Nantucket","MA","Cylinder","30 seconds","((HOAX??))  We saw a red tube in the sky.","6/3/10"
"5/22/10 04:00","Marthas Vineyard","MA","Cylinder","35 seconds","((HOAX??))  Red Tube In sky.","6/3/10"
"5/21/10 23:45","Edina","MN","Unknown","ongoing","I came home from dinner with my two sisters in Minneapolis, and there were 3 lights moving in their own circular directions, converging","6/3/10"
"5/21/10 23:34","Riverside","CA","Cigar","20-30 seconds","Large twinkling/flashing light with smaller one across from it, spinning like a baton","6/3/10"
"5/21/10 22:35","Gilman City","MO","Formation","10 minutes","Wide line of red flashing/pulsing lights which appeared to be at tree top level and about a mile across.","3/13/12"
"5/21/10 22:30","McComb","OH","Triangle","20 minutes","Triangle shaped object with red pulsating lights with instant change of direction and speed.","6/3/10"
"5/21/10 21:55","St. Louis","MO","Unknown","12 minutes","Very bright amber, green and red lights in the night sky moving slowly to the west northwest.","6/3/10"
"5/21/10 21:30","Raleigh","NC","Light","a few seconds","sudden white light moving vertcal disappeared then reappeared moving horizontal before disappearing again","6/3/10"
"5/21/10 15:30","Euless","TX","Changing","1 minute","changing dark silver cilinder object hovering in sky in daylight appeared for 1 minute","6/3/10"
"5/21/10 00:26","Palmer","AK","Sphere","10 minutes","At about 12:27am on the 21st of May, while getting ready for bed and all was quiet, I heard the same sound I heard in mid-March when I","6/3/10"
"5/21/10 00:05","San Jose","CA","Light","5 min","Light very irregular movement in sky.","6/3/10"
"5/20/10 23:40","Port Hawkesbury (Canada)","NS","Light","15 Mins","Five UFO's one very Close and Zipped away very fast","6/3/10"
"5/20/10 22:10","Boonsboro","MD","Oval","20 min","A large ball of pulsating light with 2 smaller flashes of light shooting out from the sides then disappearing.","6/3/10"
"5/20/10 21:40","Springfield","NJ","Triangle","10 minutes","Two of us saw a very large UFO for 10 minutes,not moving and silent.","6/3/10"
"5/20/10 21:30","Ashton","ID","Other","1 second","Bright flash lit up entire horizon to the northward","7/3/13"
"5/20/10 21:30","Tolland","CT","Light","10 sec","2 red blinking orbs.","6/3/10"
"5/20/10 21:00","Aransas Pass","TX","Light","2.5 hours","I saw floating lights dissapear and reappear many times over widespread areas going slowly west.","6/3/10"
"5/20/10 19:15","Beverly Hills","MI","Cigar","5 seconds","Fast moving, low flying, very large and long metallic object seen in daylight.","6/3/10"
"5/20/10 13:46","Assateague Island","MD","Cylinder","30 minutes","Long Dark Gray Crayon Shaped Object","6/10/10"
"5/20/10 11:00","South Kingstown","RI","Chevron","5 minutes","Odd chemtrail and jet formation over souther Rhode Island","6/3/10"
"5/20/10 01:40","Mesa","AZ","Light","5-15 seconds","Two orange/amber lights moving across the sky in a SE to NW direction seen from backyard in Mesa, Arizona at 1:40 a.m on May 20, 2010.","6/3/10"
"5/20/10 01:00","Chino","CA","Unknown","20 sec","sound - my wife and i were awaken by a sound that i have never heard before in my life it was very quick and very close to our house, i","6/3/10"
"5/19/10 22:43","Canton","IL","Circle","15 seconds","two sets of five/six bright yellow lights too high to be an animal, too low/big to be aircraft /star appear out of nowhere in rural IL","6/3/10"
"5/19/10 22:10","Sarasota","FL","Changing","6 minutes","Red and Blue lights jerking across the sky and multiple helicopters circling the event during and after.","6/3/10"
"5/19/10 21:15","Waynesboro","PA","Light","45 minutes","Very large and bright low hanging light in the sky, lasted for about 45 minutes before it dissapeared.","6/3/10"
"5/19/10 21:00","Lawrenceville/Grayson area","GA","Other","15 - 20 minutes","9 UFOs seen over Lawrenceville/Grayson area May 19th 2012","5/29/12"
"5/19/10 19:00","Mt. Clemens","MI","Cigar","3-4 min.","Best I Can Describe Is A Flying Submarine.","6/3/10"
"5/19/10 14:00","Winnipeg (Canada)","MB","Unknown","10 minutes","I took pictures of a solid silver object in the sky!","6/3/10"
"5/19/10 12:00","New York City (Staten Island)","NY","Disk","3 minutes","Flying saucer making possible telepathic contact and the sacer made a noise.  ((NUFORC Note:  Student report.  Hoax??  PD))","6/3/10"
"5/19/10 03:00","EL Cerrito","CA","Triangle","30 seconds","An odd black triangle shaped craft with other unknown crafts slowly difted pass our house","6/3/10"
"5/19/10 01:00","Congress (near)","AZ","Sphere","15 minutes","I can describe it, but I still don't know what it was:  alien probe, military, possible living organism.","2/8/11"
"5/18/10 23:40","Acton (Canada)","ON","Light","60 sec","Moving star vanishes","6/3/10"
"5/18/10 22:00","Helena","MT","Disk","two mins.","disk shaped object/ military choppers all around the object","6/3/10"
"5/18/10 21:55","St. Louis","MO","Light","6 seconds","Bright white ball, flash and and then dimmed straight path, out of nowhere","6/3/10"
"5/18/10 21:30","Portland","OR","Diamond","7 minutes","saw &amp; filmed a pulsating diamond shaped object which changed shape several times over Portland, Oregon about 9:30 PM","6/3/10"
"5/18/10 21:30","Buffalo","MO","Unknown","5-10 seconds","Red Glowing Ball","6/3/10"
"5/18/10 21:15","Ocala","FL","Light","10 min","Round globe light with a wobble paases by the sky night","6/3/10"
"5/18/10 16:20","Saskatoon (Canada)","SK","Other","30 seconds","Bulbous looking object seen moving through the sky","6/3/10"
"5/18/10 12:30","Hephzibah","GA","Rectangle","N/A","Huge Rectangular Craft  With LightsTraveling at a High Rate of Speed","6/3/10"
"5/17/10 23:00","Jessup","GA","Unknown","About 7 minutes","Strange noise in my ear and strange light in the sky  that moved extremely fast.","6/3/10"
"5/17/10 22:20","Grant","AL","Teardrop","10-15 mins","2 Teardrop shaped crafts sighted, one followed us down the mountain","6/3/10"
"5/17/10 22:00","Cherry Creek State Park","CO","Unknown","10 Minutes","On Monday, May 17 2010 at 22:00 my friend and I were in cherry creek state park when we noticed 3 lights travelling from north to south","6/3/10"
"5/16/10 23:55","La Center","WA","Flash","5 sec.","bright blue/white light","6/3/10"
"5/16/10 23:00","Rockford","IL","Diamond","18 Minutes","((HOAX?))  At 11 O Clock Pm Me And My Friend Saw A Dimond Shped Object That Shot A Bliding Light At Us But No Damage","6/3/10"
"5/16/10 21:30","Hugo","MN","Other","3 minutes","Two bright lights, pentagonal in shape an red in color, moved across the northern sky, hovered, then flew off quickly.","6/3/10"
"5/16/10 21:00","Philadelphia","PA","Disk","5 minutes","3 disk shaped object's hovering over my house on may 16th 2010","6/3/10"
"5/16/10 19:00","Cherry Creek","CO","Unknown","10 Minutes","On May 16, 2010 I witnessed a number of strange objects in the day time sky.","6/3/10"
"5/16/10 19:00","Jeffersonville","IN","Circle","1 minute","small white circlular craft, saw bright big colors, then in an instance gone","10/10/11"
"5/16/10 16:00","Denver","CO","Unknown","45 Minutes","On May 16, 2010 I witnessed a number of strange objects in the day time sky.","6/3/10"
"5/16/10 09:40","South Kingstown","RI","Cylinder","30 seconds","Stationary gray cylinder slowly accelerates, turns white, then opaque, and disappears.","6/3/10"
"5/16/10 00:14","Norton","MA","Circle","less than a min.","Ufo flyover on a partly cloudy night","6/3/10"
"5/16/10 00:01","Bloomington","CA","Formation","10 minutes","Sighting by about 10 persons aged 6-50, orange redish pulsating globes, southern california","6/3/10"
"5/15/10 22:30","Las Vegas","NV","Cross","30 sec.","Radially flashing lights on cross shaped object in Eastern sky.","6/3/10"
"5/15/10 22:30","Preston (UK/England)","SK","Fireball","1 minute","looked like a plane but was lit up red and then it slowed down and stopped then changed direction but going much slower and then just d","6/3/10"
"5/15/10 22:00","Buel","NY","Triangle","1 minute","Gigantic translucent triangle in the night sky.","8/27/15"
"5/15/10 21:30","Somers Point","NJ","Light","45 seconds","I went outside to look at Venus and the Crescent Moon and caught a look at a light that appeared to be an airplane.  I followed the lig","6/3/10"
"5/15/10 21:00","Gettysburg","PA","Other","30 seconds","Loud noise with line of changing colors and disappearing!","5/13/12"
"5/15/10 20:45","Gila Bend","AZ","Fireball","10 min","Driving West on the I-10 Freeway moments from entering I-8, as the sun set, I gained sight of the crescent Moon and slightly North West","6/3/10"
"5/15/10 20:30","Meldrim (closest municipality)","GA","Unknown","15 min","Saw triangular object with red and white lights hovering over the interstate.","8/24/10"
"5/15/10 20:30","West Trenton","NJ","Light","1 hour","Static bright light witnessed on two separate nights.  ((NUFORC Note:  If in the NW sky, probably Venus.  PD))","7/19/10"
"5/15/10 20:00","Denver","CO","Light","3 hours","On May 15, 2010 I witnessed four ufo's that looked like bright stars or satellites. ((NUFORC Note:  Satellites??  PD))","6/3/10"
"5/15/10 20:00","Bloomfield--Hillside","NJ","Triangle","35 minutes","A UFO Sighting over Hillside/Union, NJ, May, 2010.","7/10/15"
"5/15/10 19:45","Bayonne","NJ","Light","15 seconds","A strange light/object that accelerated and changed altitude suddenly.","6/3/10"
"5/15/10 19:30","Phoenix","AZ","Unknown","45 min","Very Large Object.","6/3/10"
"5/15/10 18:45","Chicago","IL","Sphere","4-6 Minutes","A Pitch black sphere slowly hovered, moving in a south-eastern direction.","6/3/10"
"5/15/10 16:00","Chandler","AZ","Light","N/A","smoke like cloud appeared then four lights moving diffrent directions fast disappearing in to cloud for about 10 minutes","6/3/10"
"5/15/10 04:30","Puyallyp","WA","Circle","1 minute","Green circular object moving from behine MT. Ranier","6/3/10"
"5/15/10 01:20","Broken Arrow","OK","Light","3-5 minutes","Two orange lights moving across the sky in formation and then each one dimmed and disappeared.","7/3/13"
"5/15/10 00:30","Chesapeake","VA","Unknown",">5 minutes","Bright, strange light.","8/24/10"
"5/14/10 23:30","Manchester-by-the-sea","MA","Sphere","About 2 minutes.","I witnessed a bright orange glowing object in the sky on a starless night, and disappear as a plane flew near.","6/3/10"
"5/14/10 23:30","Fond du Lac","WI","Fireball","15 minutes","&quot;Fireball-like&quot; objects seen over Fond du Lac, Wi.","6/3/10"
"5/14/10 22:00","Brazil","IN","Triangle","3 hours","3 FRIENDS SPOT GIANT LIGHT UFO THAT LINGERED FOR 4 HOURS  ((NUFORC Note:  Student report.  PD))","6/3/10"
"5/14/10 21:45","Salem","OR","Sphere","30 minutes","various objects in the sky near Salem, OR","6/3/10"
"5/14/10 21:35","Cedar City","UT","Light","2min","stead single white dot heading southeast then rose straight up and vanished","6/3/10"
"5/14/10 21:12","Saugerties","NY","Light","3 minutes","White flying light, that flew horizontal then dissapeared over Saugerties, New York.","6/3/10"
"5/14/10 04:30","Providence","RI","Other","2 seconds","Star slides to left in sky, then Disappears","11/21/10"
"5/14/10 00:48","Temecula","CA","Changing","10- 15 MINS.","Big, Bright Hovering Light","6/23/10"
"5/14/10 00:00","Sedro Wooley","WA","Fireball","5 minutes","bright wierd fast motions","6/3/10"
"5/13/10 22:30","Burlington","IA","Light","2:00","An object flew over my house  it looked like a regular star but it was moving very fast no flashing lights","6/3/10"
"5/13/10 21:27","Tujunga","CA","Sphere","5 seconds","object disappeared and reappeared in afraction of a second, and descending 90 degrees westward.","6/3/10"
"5/13/10 19:30","Weston","MO","Unknown","5 minutes","Shiny Silver object in sky that seemed to hover in one spot then all of a sudden was gone,","6/3/10"
"5/13/10 18:00","North Myrtle Beach","SC","Oval","1 min","over the ocean objects","1/31/11"
"5/13/10 16:00","Eugene","OR","Circle","8-10 min","Circular object that looked like star in blue sky moved slowly south, stopped, changed directions and went north.","6/3/10"
"5/12/10 23:30","Amherst","VA","Unknown","2 min.","Mother and daughter see strange lights of ufo for the third time in same location.","6/3/10"
"5/12/10 23:18","Riverview (Canada)","NB","Diamond","5 minutes","It stopped and changed directions frequently, and eventually disappeared.","6/3/10"
"5/12/10 22:30","Ballinger","TX","Diamond","30 minutes","Bright, oscillating, multicolored diamond shaped object in the western sky, disappeared rapidly to the west.","6/3/10"
"5/12/10 22:14","Hood River","OR","Light","40 sec","Bright white light acending.","6/3/10"
"5/12/10 22:04","Walpole Island (Canada)","ON","Light","at least a minute","Large white light below clouds is not there later on","6/3/10"
"5/12/10 21:55","Calgary (Canada)","AB","Light","1 second","Two bright green lights traveling west over our home, one bigger than the other, appeared to be descending. They could have been firewo","6/3/10"
"5/12/10 21:47","Bremerton","WA","Light","3 minutes","bright star-like object traveling in a northeasterly direction implodes and dissapears, multi-witnessed numerous times in bremerton, wa","6/3/10"
"5/12/10 21:00","Keokuk","IA","Light","10 sec","We were just sitting there at my brothers right after dark. When we saw what look like a light larger then any star in the sky. It appe","5/12/11"
"5/12/10 19:45","Chesapeake","VA","Fireball","8 seconds","The bright fireball dimmeded in appearance, then changed its trajectory, before disapearing.","6/3/10"
"5/12/10 12:30","Livermore","CA","Light","10 min","Bright star-like object, roaming back and forth over Livermore, CA, hills at 12:00 hrs..  ((NUFORC Note:  Good witness.  PD))","5/12/10"
"5/12/10 11:25","Palo Cedro","CA","Unknown","5 minutes or less","Green streak in star trails image","6/3/10"
"5/12/10 10:07","St. Joseph","MO","Triangle","20-30 sec","Triangular craft with white light and blinking red lights hovering over field in thunderstorm.","6/3/10"
"5/12/10 03:43","Wenatchee","WA","Other","one hour","Flashing and red lights &quot;dancing&quot; and &quot;looping&quot; in the night sky.  ((NUFORC Note:  Probably a twinkling star??  PD))","6/3/10"
"5/12/10 00:30","Napavine (outside of)","WA","Unknown","About 1 Minute","I was just driving home on North bound I5 near exit 71. There were a few people ahead of me and a few behind me, i wish i could know if","6/3/10"
"5/11/10 22:37","Boise","ID","Light","minute","sporadically fast moving bright light too low to be a satellite and to high to be a plane fades into the stars after a minute","5/12/10"
"5/11/10 22:00","Bloomington","IL","Circle","1 hour","My cousin and I have been going up on the roof of my 3-story building every clear night for the past week.  ((NUFORC Note:  Venus? PD))","5/12/10"
"5/11/10 22:00","Chandler","AZ","Formation","30 minutes / intermittant","Huge amber lights, intermittant, zooming and stationary, South of Chandler, AZ - 2200 &amp; 2203 hours; 11MAY2010.","5/12/10"
"5/11/10 17:10","Big Sur","CA","N/A","1 second","Sonic boom event over Northwestern Pacific. No craft seen.","5/12/10"
"5/11/10 13:00","Ottawa (Canada)","ON","Light","Approx. 4 mins","Sighted 5 circular lights","5/12/10"
"5/11/10 04:00","Fountain Hills","AZ","Triangle","1/2 minute","White lights flashing in my window","6/3/10"
"5/10/10 23:45","Orlando","FL","Light","15 minutes","Orange Lights/Fireballs above the Lake","9/24/12"
"5/10/10 22:55","Havre","MT","Light","5 minutes","Saw Three Bright Lights","5/12/10"
"5/10/10 22:55","Havre","MT","Light","5 minutes","Sonic Boom followed by 3 UFOs","5/12/10"
"5/10/10 21:40","Trinidad","CA","Light","3 to 4 minutes","The flight pattern of the five reddish orange lights were west or northwest at about a 20 to 30 degree angle.","5/12/10"
"5/10/10 21:00","Knowlton","NJ","Light","40 minutes","~A close friend and I were outside; observed a bright object in the sky.  ((NUFORC Note:  Venus?  PD)","5/12/10"
"5/10/10 20:00","Chichester","PA","Light","on going","On-going V-shaped white strings of light seen near refinery at night, sort of looked like smoke","5/13/12"
"5/10/10 19:00","Oak Lawn","IL","Circle","1/2 Hr.","Multiple mysterious fleets of UFOs in the night.","11/21/10"
"5/10/10 13:00","Walterborow","SC","Diamond","N/A","The pic. i have of the ufo is 4 circles in the shape of a dimond.","6/3/10"
"5/10/10 05:30","Wittmann","AZ","Formation","10 minutes","A formation traveling north.","5/12/10"
"5/10/10 03:00","Williamsburg","VA","Light","40 minutes","zig zagging white light in sky.  ((NUFORC Note:  Probably a sighting of a &quot;twinkling&quot; star, we suspect.  PD))","6/3/10"
"5/10/10 00:15","Lawrence","MA","Oval","30 sec.","Oval light flying erratically in the midnight cloudy skys of Lawrence MA.","5/12/10"
"5/9/10 23:00","Fayetteville","GA","Other","3 minutes","Two lights seen traveling from southwest to northeast over my location in Georgia at extreme altitude.","5/12/10"
"5/9/10 22:07","Swansea","SC","Light","15 mins","Bright white light that went below treeline close to Swansea S.C.","5/12/10"
"5/9/10 22:01","Escondido","CA","Diamond","2 minutes","an orange diamond shape hovering in made air for a while swaying from side to side. then it just fades away without making a sound.","5/12/10"
"5/9/10 22:00","Fairfield","CA","Triangle","35 s","Boomerang UFO","6/3/10"
"5/9/10 21:00","State College","PA","Flash","over an hour","Stationary blinking light","5/12/10"
"5/9/10 20:30","Pleasantville","NJ","Light","15 Minutes","Lights in the Sky","5/12/10"
"5/9/10 20:30","Pleasantville","NJ","Light","15 minutes","Star-like object in the sky.","5/12/10"
"5/9/10 12:00","Winston-Salem","NC","Other","5 minutes","Motionless winged black aircraft","2/4/13"
"5/9/10 05:56","Attleboro","MA","Disk","2 minutes","UFO formation over Attleboro plaza","5/12/10"
"5/9/10 05:10","Pens and Panama (between)","FL","Cigar","10:00","We left from my husbands parents house back to ours. Clear as day very high in the sky on the way home was a shiny cigar shaped object","6/3/10"
