"Date / Time","City","State","Shape","Duration","Summary","Posted"
"9/30/10 23:00","Buena Park","CA","Unknown","30 mins","i really dnt want to waste my time on perfecting this letter but me and my sister and two other friends saw a ufo, no lie it was close","11/21/10"
"9/30/10 22:30","Monticello","GA","Light","approx. 30 sec.","singular light running across the sky too fast for satelight and too slow for shooting star with no blinking lights.","11/21/10"
"9/30/10 22:30","Terrebonne (rural area)","MN","Light","at least an hour","Bright white round light,doesn't move, gets very bright then almost fades out then repeats this for a long time.((NUFORC Note:  Star?))","11/21/10"
"9/30/10 22:00","Colorado City","CO","Triangle","3 seconds","3 of us saw a bright white light triangle inside of a lighted rectangle directly overhead then it travelled directly south and disappea","11/21/10"
"9/30/10 21:55","Grafton","WI","Triangle","7 seconds","Delta shaped body glowing in a misty or foggy golden white light  flying above at a high rate of speed","11/21/10"
"9/30/10 21:30","Chicago","IL","Light","10 min.","10-12 lights floating in a Y formation then separating in groups of 3, all while silent, no noise was made.","11/21/10"
"9/30/10 21:00","League City","TN","Disk","15 Seconds","U.F.O caught on Camera - Alien or man made..this thing was incredible.","11/21/10"
"9/30/10 20:23","Hesperia","CA","Light","about 8 min.","Strange lights not visible to the naked eye but not to the camara.","10/19/11"
"9/30/10 20:00","Algonac","MI","Sphere","10 min","&quot;V&quot; formation of orange spheres","11/21/10"
"9/30/10 19:19","Woods Cross","UT","Light","20 minutes","Orange Cigar Shape bright light after sunset west of Woods Cross Utah Light","11/21/10"
"9/30/10 19:00","Burlington","WI","Diamond","1 hour","Flashing Lights Moving and Stationary In the South to Northwest Sky","11/21/10"
"9/30/10 13:05","Cedar Rapids","IA","Triangle","about half a second","Flying object in the background of our video in video class flies 100 yards in less than 1/2 a second","11/21/10"
"9/30/10 10:37","Plano","TX","Disk","3-5 minutes","Collin County Sighting Plano, TX &amp; Allen, TX","11/21/10"
"9/30/10 10:30","Saluda","SC","Changing","30 minutes","UFO SEEN IN SALUDA SOUTH CAROLINA HOME","11/21/10"
"9/30/10 07:00","Pontiac","MI","Sphere","8 minutes","..it seemed the show was over-then 20 seconds later another orb slowly fades in.","11/21/10"
"9/30/10 05:30","Spokane Valley","WA","Triangle","10 minutes","In a look out called the saltese hills, star gazing because there had already been quite a few weird things in the sky.","2/18/11"
"9/30/10 02:50","Fort Worth","TX","Triangle","about 30 seconds","At around  midnight I saw a UFO flying across the sky.  Two triangles Flying one in front of the other with a blinking light on the end","11/21/10"
"9/30/10 02:25","Frankfort","IN","Flash","35 seconds","Large blue flashes of light in the sky.","11/21/10"
"9/29/10 23:27","Pomona","CA","Formation","5 minutes","Spotted over the freeway - Flying Squid Like object","11/21/10"
"9/29/10 23:00","Sioux City","IA","Other","8 seconds","9-12 white lights glide from north to south across morningside sky","11/21/10"
"9/29/10 22:00","Cape Coral","FL","Triangle","2-3 min","huge vehicle trying to be invisible and doing a good job.....we dont have this...do we..no sound","11/21/10"
"9/29/10 22:00","Krum","TX","Light","5-6 hrs","one giant bright light and numerous small white lights the size of stars in Krum, Texas.  ((NUFORC Note:  Stars??  PD))","11/21/10"
"9/29/10 21:00","San Mateo","CA","Light","1 min.","UFO sighting and Flashing lights over San Mateo California","11/21/10"
"9/29/10 20:45","Edmonds","WA","Formation","5 minutes","2 objects flying South at high speed over the Seattle area","11/21/10"
"9/29/10 20:40","Cape Coral","FL","Triangle","1 to 1.5 min","large triangle shaped almost transparent craft traveling low and slow with no lights or sound.","11/21/10"
"9/29/10 20:32","Shingle Springs","CA","Cone","2-3 sec.","Silver shape travelling at great speed","11/21/10"
"9/29/10 20:25","Brookfield","WI","Circle","3 minutes","Strange round flaming orange/gold craft flying in the sky","11/21/10"
"9/29/10 19:00","Kennesaw","GA","Other","3 minutes","saw black bell-shaped object hovering over I-575","11/21/10"
"9/29/10 05:30","Seattle","WA","Unknown","5 minutes","peculiar moving bright lights over seattle sound headed sw","11/21/10"
"9/29/10 03:00","Westminster","CO","Flash","N/A","The usual flashing lights in the sky that don't really move but hover in one spot low in the atmosphere.  ((NUFORC Note:  Star?  PD))","11/21/10"
"9/28/10 22:20","Redding","CT","Light","30 minutes","I saw a bright light that slowly moved through the sky and seemed to have striations that looked like lightning bolts eminating from it","11/21/10"
"9/28/10 22:00","Atikokan (Canada)","ON","Changing","90 min.","Very unusal, scary, craft stays at my cabin most nights seen, if sky is clear.","11/21/10"
"9/28/10 22:00","Yakima","WA","Chevron","5 seconds","Chevron shape of pale white/yellow lights flying overhead with no sound.","11/21/10"
"9/28/10 21:30","Little Rock","AR","Circle","about 5 seconds","A ball of light moving very quickly.","11/21/10"
"9/28/10 21:00","San Francisco","CA","Light","hour/hour half","Abnormal Movement of Unknown Object","11/21/10"
"9/28/10 21:00","Safford","AZ","Unknown","5 minutes","White solid light making a very loud thumping sound","11/21/10"
"9/28/10 20:30","Greensboro","GA","Light","30 seconds","Small White light moving extremely fast across the sky...............took only 30 seconds to cross the entire night sky in our vision.","11/21/10"
"9/28/10 20:10","Edgewater","FL","Light","15 Minutes","Flashes of light hovering without sound making right angle extreme turns in sky","11/21/10"
"9/28/10 19:30","((Unspecified location))","IL","Chevron","1 second","Strobing Chevron","11/21/10"
"9/28/10 14:47","Salem","OR","Light","12 Minutes","Sept. 28th 2010 13-15 or more bright objects seen in NE Salem Oregon, at 2:27 PM PDT","11/21/10"
"9/28/10 13:00","Galesburg","IL","Oval","3-4 min.","Three people saw two objects,one was a jet the other unknown oval gray object. The jet was following the oval object at great speed but","11/21/10"
"9/28/10 11:00","Omaha","NE","Sphere","34 seconds","Weird boomerang releases spheres, lights.  ((NUFORC Note:  We do not know if this is intended as a serious-minded report.  PD))","11/21/10"
"9/28/10 10:20","Knifley","KY","Light","30 min. ?","I looked up and saw a pulsing, strobe-like light in the sky.  ((NUFORC Note:  Twinkling star??  PD))","11/21/10"
"9/28/10 10:02","Santa Monica","CA","Oval","30min","object  made  by many rings","11/21/10"
"9/28/10 06:43","Columbus","GA","Light","5 SECONDS","A white light appeared in the morning sky.  It was larger than the stars out at that time.  It was first seen going to the left and the","11/21/10"
"9/28/10 05:00","Breaux Bridge","LA","Circle","3 hrs","i saw around lighted object in the sky only seen at night.","11/21/10"
"9/28/10 03:45","Canton","MA","Unknown","3 seconds","Very bright objects moving very fast","11/21/10"
"9/28/10 03:00","Amarillo","TX","Other","?","Bright multi colored spinning object in Amarillo Texas about 3 AM duration at least ten minutes.  ((NUFORC Note:  Star??  PD))","11/21/10"
"9/27/10 23:00","Tiburon","CA","Cylinder","continuing","A flashing beacon fell from the sky into my back yard.  ((NUFORC Note:  Possible star??  PD))","11/21/10"
"9/27/10 22:15","Kyle","TX","Chevron","4 seconds","Huge bommerange shaped UFO with faint red lights flying stealth northwest to southeast","11/21/10"
"9/27/10 20:38","Simpsonville","KY","Unknown","45 MINS","9/27/10  SIMPSONVILLE,KY  VARIOUS COLORED LIGHTS  45 MINS  HOOVERING IN SKY  9/28/10","11/21/10"
"9/27/10 18:00","Canon City","CO","Cigar","30 seconds","cigar shape object reflecting the sun's light","11/21/10"
"9/26/10 00:00","Chico","CA","Disk","N/A","Flashing Lights Moving In A Circular Motion.  ((NUFORC Note:  Star??  PD))","11/21/10"
"9/26/10 22:45","Palo Alto","CA","Other","20 sec","four lights,wierd hovering sound flying over silicon","11/21/10"
"9/26/10 22:12","Chino","CA","Disk","2 minutes","Round UFO with yellow-orange moving lights traveling east to west and disappeared.","11/21/10"
"9/26/10 22:00","Mascotte","FL","Unknown","20 sec","Fast moving Bright Light.","11/21/10"
"9/26/10 22:00","Springfield","MA","Light","2 seconds","Green light appears out of nowhere in night sky","12/12/11"
"9/26/10 20:25","Gatineau (Canada)","QC","Oval","2-3 minutes","Object with three red lights coming down","11/21/10"
"9/26/10 19:00","Audubon","IA","Oval","3 hours","Three different bright lights that did not move, yet when seen with binoculars had red blinking lights.  ((NUFORC Note:  Stars??  PD))","11/21/10"
"9/26/10 14:00","Seal Beach","CA","Light","3-5 minutes","I saw, in broad daylight, up to 18 white, round dots that disappeard, reappeared, and multiplied several times.","11/21/10"
"9/26/10 12:00","Eatontown","NJ","Disk","3 seconds","ufo","11/21/10"
"9/26/10 04:30","Sayville","NY","Other","20 seconds","Looking to the sky on a very clear night we saw a glowing object that was reasonably close maybe 1-2 miles in the sky east of us. The a","11/21/10"
"9/25/10 00:00","Salinas","CA","Light","1 hour","multi strobing stationary lights in the night sky.  ((NUFORC Note:  Star?  PD))","11/21/10"
"9/25/10 22:23","Bourne","MA","Fireball","2 min","Two flame like objects flying over cape cod canal.","11/21/10"
"9/25/10 22:15","Levelland","TX","Unknown","30-45 mins","Lights appearing and disappearing in a set patteren","8/21/11"
"9/25/10 22:05","New Castle","PA","Fireball","3 minutes","There were 10 orb shaped balls, the color of fire.","11/21/10"
"9/25/10 22:00","New Castle","PA","Formation","1 minute","formation of bright orange lights seen moving across the night sky from north to south and then disappears","11/21/10"
"9/25/10 21:50","Manhattan Beach","CA","Fireball","90 sec","At around 950pm (PDT) , my wife and I were walking our dogs around the block when we observed a shining light in the sky.  Our fi","11/21/10"
"9/25/10 21:45","Los Angeles","CA","Light","20 seconds","Strange Light Observed over Santa Monica Bay","11/21/10"
"9/25/10 21:43","Vandenberg AFB","CA","Light","2 minutes","White light on the gold coast.","11/21/10"
"9/25/10 21:43","San Clemente","CA","Fireball","2-3mins","Ufo sighting off of south orange county coast","11/21/10"
"9/25/10 21:30","Thousand Oaks","CA","Circle","2 minutes","a light apeared in the Northern sky thrust across the sky and dissappeared then reappeared leaving con trails.","11/21/10"
"9/25/10 21:15","Grayslake","IL","Rectangle","5 minutes","Large black rectangular object moving silently towards the east horizon; no sound; no lights, but entered the atmosphere with a bright","7/5/13"
"9/25/10 21:00","Oceanside","CA","Light","20 seconds","We saw a solid yellowish light with a vapor trail silently pass fade then re-appear.","11/21/10"
"9/25/10 20:30","Deer Park","WA","Oval","3 minutes","A brilliant orb emitting red white and blue flashes hovered briefly in the sky south of Deer Park Washington.","11/21/10"
"9/25/10 19:45","Chatham","NJ","Circle","50 seconds","Orange light glowing in the sky, it was twice the size of Jupiter","11/21/10"
"9/25/10 19:15","Brookfield","CT","Other","15 seconds","Bright orange/yellow object moving at high speed making no sound","11/21/10"
"9/25/10 15:30","Tampa","FL","Rectangle","30 seconds","Apparently one dimensional grey rectangle floating low in sky in broad daylight, busy traffic, somewhat fluid looking. 500 Lights O","11/21/10"
"9/25/10 11:15","Raleigh","NC","Cylinder","2-3 seconds","Cylindrical Object Over Raleigh NC","11/21/10"
"9/25/10 10:10","New Castle","PA","Fireball","90 seconds?","Witnessed 12-15 larger-than-stars orbs hover over New Castle, Pa, then slowly dim a few at a time.","11/21/10"
"9/25/10 10:00","Tehachapi","CA","Flash","5 minutes","While driving from Anteloe Valley to Tehachapi California, at approx. 10pm, I observed what appeared to be a bright orange light leavin","11/21/10"
"9/25/10 09:45","Fontana","CA","Disk","4 min","disc shape but molded its shape like a jelly fish,it glowed orange reddish lights it flow up and down hovering for about 6 sec then wen","11/21/10"
"9/25/10 08:00","North Attleboro","MA","Oval","8:12","Red-orange large lights flew fast across the sky, 16 of them.","11/21/10"
"9/25/10 03:00","Cedar Rapids","IA","Circle","2-3 minutes","UFO over Cedar Rapids","11/21/10"
"9/25/10 01:00","Houston","TX","Changing","30 MIN","object changing shapes and colors over houston.  ((NUFORC Note:  We suspect that the object was a twinkling star.  PD))","11/21/10"
"9/24/10 23:30","Victoria","TX","Sphere","N/A","I live in victoria,texas I don't believe in this kind of stuff but what I saw tonight scared the living day lights out of me.Around 11:","11/21/10"
"9/24/10 22:00","Loma Linda","CA","N/A","1 minute","sighting of an extraterrestrial being","11/21/10"
"9/24/10 21:30","Santa Monica","CA","Circle","10 minutes","Large UFO, comes from over the ocean and then to over the santa monica pier.","11/21/10"
"9/24/10 21:20","Palmdale","CA","Light","40sec","4 white dim lights cruising together and thought it was a plane when I noticed there was no beacon light.","11/21/10"
"9/24/10 20:00","Nevada","NV","Rectangle","15 minutes","Highway 95 Lights No Sound Craft","11/21/10"
"9/24/10 19:45","Kennebunkport","ME","Other","15 minutes","I own a retail store in Kennebunkport, a summer resort town on the southern coast of Maine.  Yesterday, September 24, 2010, I went to m","11/21/10"
"9/24/10 19:45","Kennebunkport","ME","Other","15 to 20 minutes","Thirty craft with orange lights pass overhead in Kennebunkport, Maine.","11/21/10"
"9/24/10 19:30","Henderson","NV","Fireball",".5 second","Bright Green Fireball in night sky travelling west-east over Henderson NV  Food for Less parking lot 9-24-10","11/21/10"
"9/24/10 17:30","El Paso","TX","Other","8-10 sec","Several different shape ufo sightings in the past few months.","11/21/10"
"9/24/10 02:23","Kennedale","TX","Disk","33 minutes","Saucer-shaped obj. w/ rotating red, white and sometimes red lights, moving and hovering for 33 min.((NUFORC Note:  Possible star?PD))","11/21/10"
"9/24/10 01:15","Roy","UT","Unknown","5 Minutes","Repetitive meteor style lights in a group flying over Utah's Hill Air Force Base then disappearing.","11/21/10"
"9/23/10 23:41","Dartmouth (Canada)","NS","Light","5 mins","bright lights circle dartmouth night sky","11/21/10"
"9/23/10 19:30","Tumacacori","AZ","Chevron","1 hr 30 minutes","Phoenix Lights Over the Tumacacoris, Southern AZ, Sept. 23, 2010:  Both Amber Light Lines and a Chevron.","11/21/10"
"9/23/10 07:00","Seward","AK","Cone","unknown","Photograph of unidentified object","7/4/11"
"9/23/10 03:00","Fannett","TX","Disk","20 min.","light going around in a big circle","3/10/11"
"9/22/10 23:00","Los Angeles","CA","Disk","2 Minutes","UFO seen hovering and speeding off.","11/21/10"
"9/22/10 23:00","Eure","NC","Light","2-3 minutes","A bright orange light hauling ass across the sky.","11/21/10"
"9/22/10 22:55","Cornelius","OR","Sphere","1 minute","Spherical, white light shoots left and right in Oregon sky.","11/21/10"
"9/22/10 22:30","Orange","CA","Formation","W TO E","SIX FLYING IN FORMATION TRAVEL FROM WEST TO EAST","11/21/10"
"9/22/10 22:10","Depoe Bay","OR","Fireball","10 minutes","three fast moving orange lights moving south to north along the Oregon Coast, then faded away.","11/21/10"
"9/22/10 21:30","Los Angeles","CA","Other","30seconds","it was shaped liked an octopus and it was dark in color and the arms were rotating around the center they were moveing to independently","11/21/10"
"9/22/10 21:00","Santa Monica","CA","Fireball","2 minutes","Two fireballs seen south of Santa Monica.","11/21/10"
"9/22/10 20:45","Thompson (Canada)","MB","Fireball","5-8 min","One Fire ball floating, making abrupt changes in direction over Thompson Manitoba","11/21/10"
"9/22/10 20:30","Warren","MI","Triangle","10 mins","Bright 'stars' turn into UFOs and then disappear.","11/21/10"
"9/22/10 19:45","Olive Branch","MS","Light","30 minutes","unexplanable light over rural olive branch, ms","11/21/10"
"9/22/10 19:00","Hamilton (Canada)","ON","Circle","N/A","sitting on a bench,looked North into the sky and saw flashing lights In the sky,UFO started to move north and faded away.","11/21/10"
"9/22/10 09:01","Wilmington","NC","Oval","10 to 20 seconds","Round black object moved across infront of moon no sound.","11/21/10"
"9/22/10 00:30","Lakewood","IL","Oval","4 MIN.","EXTREMLY BRIGHT OBEJCT OF CONTINUOUS LUMINOSITY.","11/21/10"
"9/22/10 00:20","Eddyville","KY","Sphere","2 minutes","Slow moving amber orb over Southeast Lyon Co., KY.","11/21/10"
"9/21/10 23:00","Marco Island","FL","Other","7 seconds","Boomerang shaped craft totally silent and at a high rate of speed.  ((NUFORC Note:  Report from ex-military pilot.  PD))","1/5/11"
"9/21/10 22:21","Haddam","CT","Light","20 minutes","Few Combined Bright  lights hovering area between 20-25 minutes than dissapeared","11/21/10"
"9/21/10 21:30","Palm Bay","FL","Oval","seconds","I glanced west from my screen room and observed a large bright object for a few seconds before it disappeared behind some trees. The ob","11/21/10"
"9/21/10 21:30","Palm Bay","FL","Oval","seconds","Bright yellow and red object over USAF tracking station","11/21/10"
"9/21/10 21:30","Palm Bay","FL","Oval","5 seconds","LARGE YELLOW AND RED OBJECT OVER USAF TRACKING STATION","11/21/10"
"9/21/10 19:50","Geneva","OH","Circle","ufo","a sighting","11/21/10"
"9/21/10 19:00","Reno","NV","Other","1 minute","Small plane size rectangular shape with triangular nose, looked to be investigating a small cloud while walking along Offenhauser Dr.","7/4/12"
"9/21/10 18:00","Fountain","CO","Oval","10 min","Large Grey Metallic Object Over Cheyenne Mountain (NORAD) Area.","11/21/10"
"9/21/10 09:35","Virginia Beach","VA","Sphere","2 Min.","Ufo In Virginia Beach","11/21/10"
"9/21/10 08:59","Apollo","PA","Light","1 hour","a LIGHT that moves around like a &quot;firefly&quot;. Then changes color.","11/21/10"
"9/21/10 08:32","Cicero","NY","Circle","1 Second- less","Pulling into my devolpment, i see a strange white-glowing light fly from about the middle of the sky to vanishing in 1 second.","11/21/10"
"9/21/10 07:08","Yorba Linda","CA","Light","10 minutes","Bright star-like white light visible under dense white marine layer, stationary for ten minutes, then gone.","11/21/10"
"9/21/10 05:30","East Petersburg","PA","Chevron","10 seconds","Two identical white lights, one following the other,  speeding across a very early morning clear sky","11/21/10"
"9/21/10 02:00","Butler","MO","Unknown","5 minute","Alien like figures seen near and on buildings of our town square along with many yellow lights overhead.","11/21/10"
"9/20/10 00:00","Kiluea","HI","Changing","2hours","Bright changing light shape change size change position change from left sky to right sky it twinkiled like a star but it's really brig","11/21/10"
"9/20/10 23:20","Land O'Lakes","FL","Triangle","over 20 min","a large bright light in the south east sky. a redish light in the middle. Did not look or act like plane. Moved twice","11/21/10"
"9/20/10 22:30","Durham","CA","Other","2 Min","White fuzzy cloud like object in Sky","11/21/10"
"9/20/10 21:20","San Jose","CA","Fireball","4 min","redish orange fireball in the sky south of san jose","11/21/10"
"9/20/10 21:15","Ventura","CA","Changing","5 minutes","huge comet like object with fireball trail, turned white, stopped, became incircled by swirling white tails, then disappeared.","11/21/10"
"9/20/10 21:08","Ojai","CA","Sphere","4 minutes","Red meteor like object streaking, stopping completely, looking like a satellite, then extinguishing altogether.","11/21/10"
"9/20/10 21:02","Oxnard","CA","Fireball","6 minites","A moving fire ball over oxnard, ca morphing into a comet shape with tail.","11/21/10"
"9/20/10 20:15","Ottawa (Canada)","ON","Oval","3min","The orange light turned off and I could see a random set of lights(always changing patterns) moving off behind me at speeds that I have","11/21/10"
"9/20/10 18:00","Riverside","CA","Oval","N/A","6 oval objects flying over Riverside California","11/21/10"
"9/20/10 07:00","Nashville","TN","Cigar","N/A","Red and white with big window","5/2/11"
"9/20/10 00:00","Westerly","RI","Unknown","40 minutes","Low flying jet like sound followed by a long sighting of three color lighted object hovering.","11/21/10"
"9/19/10 21:00","Omaha","NE","Fireball","3 minutes","Red light over NW Omaha moving south to north before fading away completely.","11/21/10"
"9/19/10 20:40","Indianapolis","IN","Unknown","1 sec","Ligt streak during a video on Sunday night football.","11/21/10"
"9/19/10 14:38","Albuquerque","NM","Cylinder","2 minutes","I was driving home on North bound I-25, approximately 1 mile north of the I-25/I-40 interchange.  I look up at the NNE sky and noticed","9/24/12"
"9/19/10 10:02","Fort Mohave","AZ","Changing","3-4 min","Changing size and color object, over Fort Mohave AZ","11/21/10"
"9/19/10 01:00","Red Pheasant First Nation (Canada)","SK","Light","1 hour","Strange lights hovering in field just above a bush line.","11/21/10"
"9/19/10 00:05","Vero Beach","FL","Circle","00:40","Erratic object, looked similar to a star, never moved more than 10 - 20 degrees during my entire 35 minute viewing period.","11/21/10"
"9/18/10 23:45","Easton","PA","Sphere","5 mins","Raubesville Pa, Bright orange star shaped light fast moving, hovered and the shot back into the sky again.","11/21/10"
"9/18/10 23:00","North East","PA","Fireball","20 seconds","Fireball over North East Pennsylvania moves across Lake Erie towards Canada","11/21/10"
"9/18/10 22:00","Pikeville","KY","N/A","Less Than 5 Seconds","Large bright white non-flashing light moved 45-degrees in the sky in approximately a second. NOT A METEOR","11/21/10"
"9/18/10 21:44","Merrillville","IN","Teardrop","2-3 seconds","One, elongated teardrop shaped flying object about 13 feet high in the sky and maybe 500 ft away.","11/21/10"
"9/18/10 21:30","Louisville","KY","Triangle","1 hour","I seen about 12 objects that were in the shape of a triangle, that had lights on them. Some looked as if they were burning. There was n","11/21/10"
"9/18/10 21:00","Kapolei (Oahu)","HI","Light","slower than a comet","kapolei, hi slower than comet glowing colourful crashes out of sky all the way to water 5-30miles offcoast","10/10/11"
"9/18/10 20:30","Westbury","NY","Fireball","10 minutes","Three orange lights in the shape of the big dipper, then 2 more came into view.","11/21/10"
"9/18/10 20:00","Norwalk","CA","Sphere","N/A","Neon blue sphere in Norwalk,Ca. hovering, then moved south across the sky then disappeared. Just gone.","1/31/11"
"9/18/10 19:30","Chesapeake Beach","MD","Circle","5 minutes","9-18-10.  Six round orange lights evenly spaced, moving in syncronized formation curving upward until disappearing one by one.","11/21/10"
"9/18/10 18:00","Woodbury","NY","Light","10 min","3 lights obsereved over nys thruway while helicopters persued.","10/10/11"
"9/18/10 15:45","Brampton (Canada)","ON","Cylinder","3-4 mins","An unidentified floating object was seen today by myself and two other people around 3:45pm Sept 18,2010 here in Brampton. I was at a l","11/21/10"
"9/18/10 14:42","Rochester","NY","Egg","2min","Semi-egg shaped object floating above local highway 20-25 feet in the air.","11/21/10"
"9/18/10 11:00","Dieppe (Canada)","NB","Light","2 minutes","Bright light grew larger and brighter.","11/21/10"
"9/18/10 05:00","Antioch","CA","Diamond","45 minutes","Large bright white lights flashing with blue lights on two sides hovering in western sky which was dark at the time and slightly cloudy","11/21/10"
"9/18/10 03:50","Eagle Rock","CA","Sphere","10 seconds","Glowing Sphere over Eagle Rock, CA","5/12/11"
"9/18/10 03:00","Butler","MO","Sphere","one hour","brass colored sphere  moving around power pole and transformer,  next to Convenience Store at corner of  our block","11/21/10"
"9/17/10 22:30","Lake Charles","LA","Light","15 minutes","The following description was provided to me from a work associate.  He describes that he was awakened one night, around 10:30 pm by hi","11/21/10"
"9/17/10 22:00","Lindale","TX","Triangle","15 seconds","We were laying outside in the hammock and looking at the moon and stars when the sky completely blacked out.  All we could see was a tr","11/21/10"
"9/17/10 21:56","Tinley Park","IL","Triangle","15mins","Tinley Park Lights  3 Red Lights form a Triangle","11/21/10"
"9/17/10 20:45","Louisville","KY","Flash","1 sec","A smear of bright multi-colored lights in the sky, lasting for only an instant.","11/21/10"
"9/17/10 20:30","St. Thomas (Canada)","ON","Unknown","5 min","Looked like an aircraft landing lights, But too bright flickering too fast. Then changed direction speed maintianed.","11/21/10"
"9/17/10 20:20","Meadville","PA","Triangle","FIVE","i have tryed filling this out three time and it keeps disappear and wont let me do a complete report. the recented sighting tonight at","11/21/10"
"9/17/10 19:50","Escondido","CA","Light","5 minutes","The object if you can picture it was the color of one of those yellow or streetlights lights in the sky. Also the flight pattern was ex","11/21/10"
"9/17/10 19:40","Galloway","OH","Other","7-10 min","5 objects with comet tails some still some moving over Galloway OH","11/21/10"
"9/17/10 19:00","Arlington","VA","Light","5 mintues","Several people observed slow moving light in sky for about five minutes.","11/21/10"
"9/17/10 16:30","Kettering","OH","Disk","1 minute","aluminum-type disk with hump.","3/10/11"
"9/17/10 13:00","Grand Junction","CO","Chevron","20 seconds","U.F.O. zips across sky at incredible rate of speed, HUGE and very high in the sky Western Colorado.","11/21/10"
