"Date / Time","City","State","Shape","Duration","Summary","Posted"
"7/24/10 00:00","Oklahoma City","OK","Circle","3 hours","Circular craft blinking red, yellow, orange, green,  blue.  ((NUFORC Note:  Possible twinkling star, or celestial body, perhaps?  PD))","7/28/10"
"7/23/10 23:00","Louisville","KY","Triangle","1 minute","Blk Triangle craft mimics aircraft in Metro louisville.","1/5/11"
"7/23/10 22:00","Kure Beach","NC","Light","20 minutes","Group of UFO lights over horizon at Kure Beach, NC","8/24/10"
"7/23/10 21:30","Huntington Beach","CA","Light","5:00","Zig-zagging point of light.","7/28/10"
"7/23/10 21:15","Seattle","WA","Other","15-25min","Visually observed and photographed pentagon-shaped/faceted object; light colored/no lights.  ((NUFORC Note:  Probably not a UFO.  PD))","7/28/10"
"7/23/10 20:00","Independence","OR","Unknown","5 minutes","Rocket-like craft with centered- tail- trail over Willamette Valley, Oregon","8/24/10"
"7/23/10 20:00","Plymouth","MN","Sphere","photo","Reflective orb revealed in digital photo of clouds.","8/24/10"
"7/23/10 19:30","Westboro","MA","Oval","20 minutes","bright flashing object at dusk northeast sky","7/28/10"
"7/23/10 18:00","Midland","MI","Other","5 minutes","what looked like jet lights flew over in formation, then scattered","2/8/11"
"7/23/10 14:24","Gatlinburg","TN","Unknown","1sec","I was taking photos in the smoky mountains while on vacation.  ((NUFORC Note:  Possible bird.  PD))","7/28/10"
"7/23/10 12:30","Polson","MT","Cigar","10 seconds","Unusual looking metallic craft over the National Bison Range in Montana.","8/21/11"
"7/23/10 09:45","Orlando","FL","Formation","ongoing","07/23/10 dual lights (no strobes)above the Orlando area ,multiple helicopters around object(s)","7/28/10"
"7/23/10 01:00","Jamestown","NC","Circle","N/A","Very bright  colorful lights.","7/29/10"
"7/23/10 00:30","Rohnert Park","CA","Fireball","60 seconds","Flickering gold light, inaudible, slowly moving  along a low cloud ceiling","7/28/10"
"7/22/10 23:30","Lincoln","NC","Light","ten minutes not sure","unexplainable bright light hovering at treetop level off highway","7/28/10"
"7/22/10 22:30","Herculaneum","MO","Fireball","10 min","flaming orange object flying in sky","7/28/10"
"7/22/10 22:00","Indian Beach","NC","Disk","5 - 8 seconds","Brilliant orange saucer shaped object high over ocean near Indian Beach,  NC was observed and then reappeared appox. 15 minutes later.","7/28/10"
"7/22/10 22:00","Emerald Isle","NC","Triangle","5 min.","UFO over Emerald Isle, NC  7/22/2010","7/28/10"
"7/22/10 22:00","Atlantic Beach","NC","Changing","seconds","3 separate incidents of large saucer shaped object(s) and small round lights, reddish orange-ish, witnessed by 2 or 3 people.","8/24/10"
"7/22/10 21:48","Pine Knoll Shores","NC","Circle","Ten seconds","yellow-orange circular lights sighted above beach in nc","7/28/10"
"7/22/10 21:30","Emerald Isle","NC","Circle","45 minutes","4 red/amber lights seen 4 times in 45 minutes- no sound, circular shape- clear night.","7/28/10"
"7/22/10 21:30","Rutland","VT","Fireball","10min","WOW","7/28/10"
"7/22/10 21:30","Harkers Island","NC","Light","4-6sec.","5 TO 6 RED LIGHTS IN A ROW , NOT MOVING,THEN THEY ALL WENT OUT AT SAME TIME.","7/28/10"
"7/22/10 20:45","Scott Township","PA","Circle","3 min","3 circular lights moving in a series of formations","7/28/10"
"7/22/10 17:00","Spring lake","NJ","Other","10 minutes","Object in sky no sound, red lights. Slow moving.","6/4/14"
"7/22/10 16:00","Philomath","OR","Unknown","2 minutes or so","UFO follows plane","7/28/10"
"7/22/10 13:00","Lodi","CA","Cross","30 sec","Low flyng glowing  goldish UFO","7/28/10"
"7/22/10 10:45","Oak Park","MI","Circle","1 minute","Orange light zigzagging in the sky","7/28/10"
"7/22/10 02:00","Alloway","NJ","Other","3-6 hours","Unexplained lights and movement were spotted in the sky above my friends house.","7/28/10"
"7/22/10 02:00","Sedro Woolley","WA","Fireball","20 minutes","fireballs very bright,like welding torch,hurt eyes to see them.","7/28/10"
"7/22/10 01:00","Spokane","WA","Light","30 seconds","Large bright light that was still but then quickly moved across the sky faster than an airplane could have and it was very big.","7/28/10"
"7/22/10 00:30","Cheshire","CT","Cigar","1 min","Grey cigar shaped object over Cheshire, CT, around midnight.","7/28/10"
"7/22/10 00:00","Camp Verde","AZ","Circle","1 hour longer","I went out on my porch to smoke a cigarette and noticed to my left lighting.  We just had a storm and there is a great deal of cloud co","7/28/10"
"7/21/10 23:37","Salt Lake City","UT","Unknown","4 seconds","Faint glowing large object streaks the night sky over Salt Lake City only leaving a trail","7/28/10"
"7/21/10 23:00","Avon Lake","OH","Fireball","15 minutes","Two fireballs spotted around 1115pm from the shores of Lake Erie.  ((NUFORC Note:  Venus??  PD))","7/28/10"
"7/21/10 23:00","Hammond (near; on hwy.)","LA","Fireball","5 sec","Whitish/ blue fire ball in sky ver, very close to earth.  ((NUFORC Note:  Possible meteor?  PD))","7/28/10"
"7/21/10 21:30","Myrtle Beach","SC","Light","5 seconds","Three red/orange disk shaped lights appeared  over the ocean fading in and out one at a time forming a triangular pattern.","8/24/10"
"7/21/10 21:00","Hooversville","PA","Circle","15 min","Fuzzy disc with &quot;satelltes&quot; which exploded and emitted sparks","7/28/10"
"7/21/10 19:00","Corpus Christi","TX","Circle","1 minuet","Three UFO's were spotted by six people in the middle of Corpus Christi, Texas.","7/28/10"
"7/21/10 15:00","Bishop","CA","Triangle","unkown","i was taking a picture of a thunder head cloud  in bishop california when i noticed a black object  triangluar object in the phot","7/28/10"
"7/21/10 10:46","Brantley","AL","Triangle","2 minutes","Large triangle shaped craft chased by a helicopter","7/28/10"
"7/20/10 22:30","Orrville","OH","Light","45 minutes","Immensely bright object appears in the W sky by my house. Occurs regularly, nearly every night.  ((NUFORC Note:  Venus.  PD))","7/28/10"
"7/20/10 22:00","Ida","MI","Fireball","10 minutes","Fireball over Monroe Co, MI","7/28/10"
"7/20/10 21:42","Arlington Heights","IL","Light","35-45 seconds","Extra Star (What it looked like.) on the handle portion of the Big Dipper - Stationary then moved in a northerly direction.","7/28/10"
"7/20/10 21:30","Portal","GA","Light","10 minutes","Red/Orangeish, or Golden Colored Lights, many appearing then Fading out Together, and being in one place then another instantly,,,","8/24/10"
"7/20/10 21:15","Burley","ID","Disk","5 seconds","Disc shaped UFO sighted over Idaho","8/24/10"
"7/20/10 21:05","Surfside Beach","SC","Formation","30 seconds","Formation of 8 lights over ocean in Surfside Beach S.C.","7/28/10"
"7/20/10 21:00","Arlington Heights","IL","Circle","2 hours(?)","UFO sighting over my health with pictures.","7/4/12"
"7/20/10 20:15","Maynard","MA","Cylinder","2 minutes","Three rectangular shaped very bright objects, within 15 to 20 sedonds of each other that just dissapeard into the sky.","7/28/10"
"7/20/10 12:35","Appleton","NY","Light","3/4 second","mysterious green light in sky cited in Appleton NY","7/28/10"
"7/20/10 09:03","Rocklin","CA","Rectangle","20-30 seconds","Rotating, dark gray, rectangles I saw during the DAY!","7/28/10"
"7/20/10 09:00","Wichita","KS","Sphere","20 minutes","10 sphere objects over wichita ks municiple airport","1/31/11"
"7/20/10 04:00","Friendship","TN","Circle","about 3 minutes","Bright light over small town.","7/28/10"
"7/20/10 03:18","Washington, D.C.","DC","Sphere","3 seconds","At 03:18 AM I was called to take a look at a bright object, by a friend. I went outside with my camera and camera platform (tripod) and","7/28/10"
"7/20/10 03:10","Washington, D.C.","DC","Sphere","5 minutes","Moving star with beam of light","8/24/10"
"7/20/10 03:00","Washington, D.C.","DC","Light","nightly","&#9;I live in Wash., D.C. For weeks I had observed a bright luminous celestial body in the sky I couldn&#8217;t identify. The object would rise","8/24/10"
"7/20/10 01:32","National Forest","CA","Diamond","15 minutes","3 objects fyling north bound got to within 1000ft of them, Looked to be glowing silver orbs dripping metal as they spun around.","7/28/10"
"7/20/10 01:00","Selkirk","NY","Unknown","N/A","Between 1:00 am and 2:00 am on the day of july 20th 2010 i had looked out my window to the south and had seen bright light with some re","7/28/10"
"7/20/10 01:00","Selkirk","NY","Unknown","hour and a half","I had emailed u about the strange sighting that i had witnessed&#8230;  ((NUFORC Note:  Celestial body&#8230;star or planet??  PD))","7/28/10"
"7/20/10 00:47","Richland","WA","Changing","Not long maybe a minute","From one red line to three red balls (like red stars), to the balls to (v)(^(","7/28/10"
"7/20/10 00:35","Albany","NY","Other","A few seconds","Brilliant streak of white lite that ended in an extremly bright flash near Albany International Airport.","7/28/10"
"7/19/10 23:35","Amherst","VA","Unknown","3 minutes","Ufo seen by mother and daughter on farm road in Amherst County, Va. For the 4th time this year!!","7/28/10"
"7/19/10 23:00","Halifax (Canada)","NS","Light","N/A","Green line over Halifax","7/28/10"
"7/19/10 22:30","Kirkland","WA","Circle","4 seconds","bright white circle moving very fast north to south","7/28/10"
"7/19/10 22:22","Nevada City","CA","Unknown","3 min","My girlfriend and I witnessed a  well lit craft that was completely silent, but appeared to be flying at speeds upward of 5 hundred MPH","7/28/10"
"7/19/10 22:20","Merrill","IA","Diamond","2 minitues","Red/Bluish colored lights over Merrill Rural Areas.","7/28/10"
"7/19/10 22:00","Clemmons","NC","Disk","1 minute","Object hovered over the area then flew at a high rate of speed","7/28/10"
"7/19/10 22:00","Mebane","NC","Fireball","one minute or so","A orange glowing object changed direction in the sky without making a sound, then went into &quot;hyper speed&quot;.","7/28/10"
"7/19/10 21:30","Pahrump","NV","Light","45-60 seconds","Object appearing as sattelite with amazing speed stops and maneuvers in many ways.","7/28/10"
"7/19/10 21:00","Scandia","MN","Diamond","10-15 min.","Twin lighted objects floating at dusk, south east of Scandia, MN","7/28/10"
"7/19/10 20:00","Hendersonville","TN","Cylinder","10 minutes","Sunday july 18 2010, 8:45 pm central time my friend pulledmy hair to get me to look to the north. I observered a craft,cylinder or tube","7/28/10"
"7/19/10 19:03","Nottingham","MD","Oval","5 mins","Intense white oval shape seen in cumulus cloud after rain storm.","1/31/11"
"7/19/10 08:00","Lynn","MA","Cigar","15 Seconds","Cigar shape flying south to north with at dusk with NO LIGHTS","11/21/10"
"7/19/10 01:00","New Milford","CT","Light","1 1/2 hrs","Bright white light hovering.  ((NUFORC Note:  We suspect a star or a planet.  No photo.  PD))","7/28/10"
"7/18/10 23:00","Grapeville","PA","Flash","30 seconds","Around 23:00 hours a pulsating bright light grew bigger and brighter before dimming and got smaller before disappearing.","7/28/10"
"7/18/10 23:00","Lander","WY","Unknown","2 mins","My son and I were looking at stars when we saw a fast moving light high in the sky traveling very fast in a circle then it suddenly dis","7/19/10"
"7/18/10 22:15","Coalinga","CA","Triangle","5 min","Low flying black triangle, 3 bright lights scanning the ground, also performing acrobatics flipping end over end","7/19/10"
"7/18/10 22:00","Sicklerville","NJ","Light","1 hour","Flashing lights swirling in the night.  ((NUFORC Note:  Venus in the western sky??  Date is flawed.  Possible hoax.  PD))","7/19/10"
"7/18/10 22:00","Sicklerville","NJ","Light","1 hour","flashing lights swirling in the night.  ((NUFORC Note:  From witness #2.  Possible sighting of Venus??  PD))","7/19/10"
"7/18/10 22:00","Desert Center","CA","Oval","10 min.","Stadium sized ship slowly rotated 180 degrees then 5-6 silver balls of light slowly flew out - Desert Center, CA","7/28/10"
"7/18/10 21:30","Holden Beach","NC","N/A",":05","Holden Beach sighting","7/28/10"
"7/18/10 21:09","Crisfield","MD","Light","3 minutes","A white speck of light extremely high, changing size traveling north of Crisfield, MD.  ((NUFORC Note:  Iridium flare??  PD))","7/19/10"
"7/18/10 21:00","Merritt Island","FL","Fireball","6 minutes","Five red fireballs.","7/19/10"
"7/18/10 20:55","Baton Rouge","LA","Disk","1 Min","I NEVER THOUGHT IN MY LIFE TIME I WOULD LIVE TO SEE ANYTHING LIKE THAT. I WAS SKEPTICAL BUT NOT ANYMORE...","7/19/10"
"7/18/10 09:30","Hendersonville","TN","Cone","4-5 minutes","We saw a giant fireball pushing a long cone shape","8/24/10"
"7/18/10 04:00","Los Angeles","CA","Light","2 hrs.","((HOAX??))  They know who we are. They are calling our names.","7/19/10"
"7/18/10 02:30","Oklahoma City","OK","Unknown","9 seconds","Bright bluish light. that vanished","7/28/10"
"7/18/10 01:16","Inver Grove Heights","MN","Light","45 minutes","Bright string of stationary lights after tornadic storms baffles stormwatcher","7/19/10"
"7/18/10 01:00","Coon Rapids","MN","Formation","3 hours","formation of lights in a row very close.unmarked car showed up they took photos and left.","7/28/10"
"7/18/10 01:00","Tempe","AZ","Unknown","45 mins.","Globes of light in sky over tempe arizona, moving in a quickly repeating pattern but staying in one area.","7/19/10"
"7/18/10 01:00","Victoria (Canada)","BC","Changing","15 mins","Orange lights in Victoria, BC, Canada.","7/19/10"
"7/18/10 00:05","Orange","CA","Other","5 minutes","Bright white object very large that traveled in the sky unbelievably fast in many different directions.","7/28/10"
"7/17/10 23:45","St. Cloud","FL","Fireball","2 min","I observed an orange, glowing object floating at a low altitude similar to where a helicopter would fly. The object appeared to be an o","7/19/10"
"7/17/10 23:37","Seattle","WA","Sphere","10 minutes","Orange balls of light in Seattle night sky on July 17, 2010 at 11:37pm","7/28/10"
"7/17/10 23:30","Brookhaven","NY","Light","2 min","My Aunt and I saw 16 big, round, bright orange lights flying SILENTLY at about helicopter level heading East.  They were flying slowly","7/28/10"
"7/17/10 23:15","Seattle","WA","Sphere","10 min","This is the most awe inspiring moment of my life and i was somewhat sad too see them leave i really felt like i ment our creator.","7/19/10"
"7/17/10 23:15","Seattle","WA","Fireball","10 min","there were 20-30 objects in the sky. they all looked the same; an orb that was colored red oarnge with an yellow aurora. they were firs","7/19/10"
"7/17/10 23:15","Seattle","WA","Formation","10 min","there formation/armada was huge.","7/19/10"
"7/17/10 23:00","Dearborn","MI","Light","5 minutes","Silent orange objects flying in the night sky in Dearborn, Michigan.","7/19/10"
"7/17/10 23:00","Seattle","WA","Unknown","3 minutes","Witnessed 25+ UFO's in the sky (orange lights), all in same flight pattern.","7/19/10"
"7/17/10 23:00","Bruneau/Mountain Home (between)","ID","Triangle","1-2 Minutes on and off","3 Lights, 25 Ft. Off The Ground Forming A Triangle Flash In And Out Twice &amp; Then From Afar Coyotes Howl At It For 4-5 Minutes","7/28/10"
"7/17/10 23:00","Boone","IA","Disk","30 min","Flying obects in ia sky","7/19/10"
"7/17/10 22:30","Beaver Dam (rural)","WI","Rectangle","2 Min.","Orange glowing cube near Beaver Dam, WI","7/28/10"
"7/17/10 22:20","Blue Springs","MO","Fireball","10 min","4 orange flaming lights traveling south to north with 8-9 loud booms, and flashs to the north of our location.","7/19/10"
"7/17/10 22:00","Naperville","IL","Light","5 minutes","5 bright orange glowing lights traveling over Naperville Illinois","7/19/10"
"7/17/10 22:00","Dayton","OH","Other","2:00","At around 10 p.m. on July 17, 2010 in the area of Dayton, Ohio, my husband and I were traveling I-75 South and had just exited the Cent","7/19/10"
"7/17/10 22:00","Lehi","UT","Light","10 minutes","Strange light in sky moving erratically, stopping abruptly and changing directions.","8/24/10"
"7/17/10 22:00","Rochester","MI","Fireball","15 to 45 minutes","Fireball in the Sky","7/28/10"
"7/17/10 21:38","Tonawanda","NY","Circle","Approx.10 min","Multiple yellow globes silently streaming past house for ten min. in a long strung out disconnected line.","7/19/10"
"7/17/10 21:00","Mountain Home (observatory)","ID","N/A","5-10 seconds","Telephoned Report:  Three witnesses observe three distinctly yellow lights maneuvering around astronomical observatory.","7/19/10"
"7/17/10 19:30","Chicago","IL","Unknown","30 minuits","Ring of fire","7/28/10"
"7/17/10 19:15","West Seneca","NY","Sphere","30 seconds","Orb light seen flying westward over South Buffalo, NY.","7/19/10"
"7/17/10 15:00","Polson","MT","N/A","10","Formations were made into some wheat fields.  ((NUFORC Note:  Photos of fields indicate to us normal &quot;lodging&quot; of grain.  PD))","7/19/10"
"7/17/10 11:20","Seattle","WA","Fireball","15 minutes","Fireballs over night sky in Seattle.","7/19/10"
"7/17/10 03:30","Columbia Falls","MT","Light","10 minutes","3 lights in the sky","7/19/10"
"7/17/10 02:00","Macon","GA","Light","Several hours","Several flashing lights in various positions seen in the northern sky nightly.","8/24/10"
"7/17/10 00:30","Charubusco","NY","Light","approximately all night","bright white light floated through sky as aircraft visibly moved and changed direction then simply pretended to be a star","7/19/10"
"7/17/10 00:12","Three Rivers","CA","Light","4.5 Hours","Watched and recorded a UFO (for 4.5 hours) in the skies over the Giant Sequoia National Forest. ((NUFORC Note:  Venus or Jupiter?  PD))","7/19/10"
"7/17/10 00:00","New York City (Bronx) (Yankee Stadium)","NY","Changing","Above Yankee Stadium","I'm back with another report only this time I'm not confused.","7/19/10"
"7/16/10 23:35","San Pedro","CA","Other","25 seconds"," a bright red light  coming straight fom the top of the bldg.  ((NUFORC Note:  Student r","7/19/10"
"7/16/10 23:30","Prior Lake","MN","Fireball","4 min. approx.","Four of us saw a phenomenon of about 12 reddish lights in the late night sky south of Minneapolis MN.","7/19/10"
"7/16/10 23:00","Ft. Lauderdale (on cross fl toll road  north west of)","FL","Fireball","1 hour","Saw a large hot lava colored orb coming from the ground floating towards us","10/10/11"
"7/16/10 22:42","South Hill","WA","Disk","2 minutes","Ufo over Western Washington July 16th, 2010","7/19/10"
"7/16/10 22:42","Malibu","CA","Changing","2-3 minutes","Fire colored cylinder changing shape to circle","7/19/10"
"7/16/10 22:12","Carter Lake","IA","Sphere","5 minutes","One brilliantly illuminating ball of light that float over our heads and shorty afterwards, vanished before our eyes.","8/24/10"
"7/16/10 22:00","Columbus","IN","Disk","20 SECONDS","Pinkish white to red white disks","7/19/10"
"7/16/10 21:50","Springboro","OH","Light","8 minutes","4 lights over Springboro, OH, July 16, 2010 @ 9:45 pm   ((NUFORC Note:  See note below from MUFON FI.  PD))","7/19/10"
"7/16/10 21:45","Miami Township","OH","Changing","3 min","Very large obj. flying low in the sky with multiple luminescent lights.  ((NUFORC Note:  See note below from MUFON FI.  PD))","7/19/10"
"7/16/10 21:40","West Chester","OH","Light","5 minutes","Four light orbs that disappeared and reappeared in West Chester, OH 7/16/10   ((NUFORC Note:  See note below from MUFON FI.  PD))","7/19/10"
"7/16/10 21:30","Middletown","CT","Light","1 min","A light with a slight glow.","7/19/10"
"7/16/10 21:16","Kennewick","WA","Cylinder","N/A","BRIGHT CYLINDER SHAPE. SAW BEFORE A THUNDER AND LIGHTING STORM HIT. DID NOT MOVE.","8/19/12"
"7/16/10 20:53","Omaha","NE","Circle","5 seconds","Bright orange circle object heading North behind clouds.","7/19/10"
"7/16/10 20:00","Duluth","MN","Disk","about 1 min","Black disk shaped object moves noiselessly through air and disappears behind a tree.","7/19/10"
"7/16/10 19:30","Paola","KS","Cigar","40 Minutes","They were bright, cigar shaped,  objects that would go in and out of the cloud","7/19/10"
"7/16/10 15:47","Hemet","CA","Oval","5 seconds","UFO Caught During ABC's Electrical Brush Fires","7/19/10"
"7/16/10 11:00","Primm","NV","Other","3-5 minutes","((HOAX??))  Object hovering over my car.","8/24/10"
"7/16/10 04:00","Hoffman Estates","IL","Circle","2 mins","Just looked up and saw this circle black item just standing in the middle of the sky and then it just desapear","8/24/10"
"7/16/10 03:50","Orange","CA","Light","10 minutes","strange light seen over Orange California","7/19/10"
"7/16/10 02:45","Plymouth","MI","Triangle","10 Minutes","Quiet, low-flying triangle shaped, with red and white lights.","7/28/10"
"7/16/10 01:00","Sister Lakes","MI","Triangle","10 seconds","V shaped object, no lights quickly flew across clear sky.","7/19/10"
"7/16/10 01:00","Brevard (near; Lake Toxaway)","GA","Teardrop","around 30 seconds","Slow flashing light that disappeared quickly.","8/24/10"
"7/16/10 00:00","Greenville","OH","Fireball","30-40 seconds","A large bright orange shperical object appeared, moved across the sky and disappeared over Greenville, Ohio.","7/19/10"
"7/15/10 23:50","Ocoee","TN","Circle","Apporx. 1 hr.","Simply Incredible.","7/19/10"
"7/15/10 23:00","Graham","WA","Triangle","20 mins","Observed via a photo a triangle of lights that revealed some sort of space craft  when enlarged","12/12/11"
"7/15/10 23:00","Berry Creek","CA","Cigar","15 minutes","Two campers view one craft fly over then hold position as a second craft emerges from the first and performs impossible manuevers","7/19/10"
"7/15/10 22:50","Dundee","OR","Light","4 min","White light moving at very high altitude from SW to NE.  ((NUFORC Note:  ISS was visible at this time.  PD))","7/19/10"
"7/15/10 22:45","Raytown","MO","Sphere","2:00","Close up encounter with an object that was translucent, low luminance, floating.  ((NUFORC Note:  Anonymous source.  PD))","8/24/10"
"7/15/10 22:30","Citronelle","AL","Unknown","15 min","Light similar to star, disappeared, changed direction in matter of seconds, no sound, no blinking lights, and moved at atleast Mach 3","7/28/10"
"7/15/10 21:30","Kingston","MA","Triangle","5 seconds","Three Circular Lights in Triangle Shape South Shore, MA","10/14/13"
"7/15/10 21:30","Dallas","TX","Flash","3 minutes","Bright flashing lights that changed from red to blue to white. The UFO went from left to right and back and forth until disappearing th","7/19/10"
"7/15/10 21:00","North Hollywood","CA","Light","30 minutes","Bright White light, hovering still 30 mins, Then moving away slowly, over NW Los Angeles Co..  ((NUFORC Note:  Venus?  PD))","7/19/10"
"7/15/10 21:00","Huntington Beach","CA","Triangle","2 hours","It was a triangle with green dots.","7/19/10"
"7/15/10 21:00","Titusville","FL","Chevron","2 minutes","UFO Red Lights Sighting in Titusville","7/19/10"
"7/15/10 21:00","South Dennis","MA","Light","65 seconds","bright light ,moved at a VERY high rate of speed.From one end of the sky to the other.","1/31/11"
"7/15/10 21:00","Acusnet","MA","Light","1 sec","light passing across road","7/19/10"
"7/15/10 20:40","San Angelo","TX","Circle","2 Hrs.","It can't be an Airplane or Star, so what is it ?","7/19/10"
"7/15/10 19:45","Newport","RI","Disk","3 to 4 minutes","Dark stationary object w/ no lights; some type of stat. undercarriage.  ((NUFORC Note:  Report from Air Traffic Controller.  PD))","6/8/12"
"7/15/10 17:15","Los Feliz","CA","Other","7 minutes","((HOAX??))  walking my dog... i saw spotlights celebrating the opening of either a film or bar... living in la... one never knows.","7/19/10"
"7/15/10 17:00","Mokena","IL","Triangle","2 minutes","I saw 5 red, quick moving craft  in formation before disappearing.","3/6/15"
"7/15/10 15:00","Las Vegas","NV","Rectangle","ten mins.","Mysterious black &quot;dot&quot; buzzes Las Vegas Strip.","12/12/11"
"7/15/10 14:00","Cincinnati","OH","Triangle","5 Minutes","Triangular UFO seen in daylight, with U.S. jet chasing","10/10/11"
"7/15/10 11:30","West Linn","OR","Triangle","2-5 minutes","I will submit a picture &amp; report to the image link.  ((NUFORC Note:  Dramatic sighting over West Linn, OR, of peculiar object.  PD))","7/17/11"
"7/15/10 10:00","Provo","UT","Disk","5 seconds","I was driving Southbound I-15 between Provo and the first Springville exit by myself talking on the phone.  I looked up and out my wind","7/19/10"
"7/15/10 10:00","Davis","CA","Light","5 minutes","((HOAX??))  WIERD AS HECK","1/31/11"
"7/15/10 04:37","Ozark","MO","Unknown","4 minutes","Bright fluttering flash.","7/20/14"
"7/15/10 04:30","Chicago Heights","IL","Unknown","15 minutes","Unknown-shaped object with small dim light bobbing through the sky","7/19/10"
"7/15/10 03:00","Dyer","IN","Sphere","30-40 seconds","Glowing Blue Sphere 6-7 feet off the ground","4/18/12"
"7/15/10 03:00","Chicago","IL","Light","5 minuets","it was up there with the stars, still and brightly shining then turned orange and darted away.","11/21/10"
"7/15/10 02:00","Teton National Park","WY","Circle","10 minutes","UFO in Teton) National Park.","7/15/16"
"7/15/10 01:10","Kalamazoo","MI","Light","2min","Fast moving Orange light over Kalamazoo","7/19/10"
"7/15/10 01:00","Three Lakes","WI","Flash","30min","Strange strobe like light","5/2/11"
"7/14/10 23:50","Valentine","NE","Triangle","2 minutes","Black Triangle 100 feet above my head.","3/11/16"
"7/14/10 23:24","Las Vegas","NV","Light","9 mins","Fast moving light  , it had  levels of lights . White like colors sparkling from it as it  change pattern 2 time .","7/19/10"
"7/14/10 23:18","Regina (Canada)","SK","Flash","1 hr","8 objects high up in the sky that flash white, red, and green lights","7/19/10"
"7/14/10 23:10","Everett","WA","Formation","5 min","3 bright lights in a triangle formation over Everett","7/19/10"
"7/14/10 23:00","Dudley (S. Worcester Co.)","MA","Light","15 minute","There was an anomaly of circular light with dark, changing shapes passing in and out of it.","7/19/10"
