lat,lng,city,state,date,specs,shape,duration
25.985909,80.164824,Hallandale/Hollywood,FL,5/5/67,I observed a bright light in the distance that seemed to be making some very strange/irregular/quick movements across the night sky.  T,Triangle,~ 10 minutes
35.7564719,83.9704593,Maryville,TN,5/1/67,Star dancing UFO,Cigar,20-30 min.
36.3955891,97.8783911,Enid,OK,5/1/67,Proof in MY MIND!!!,Disk,2 min.
30.7051916,84.8429759,Chattahoochee,FL,4/25/67,The two objects left two vapor trails with 90 degree turns in them before they simply vanished.,Light,10 minutes
42.1400744,77.0308003,Gibson,NY,4/22/67,aerodynamics-defying object sighted,Oval,3 minutes
41.0534302,73.5387341,Stamford,CT,4/21/67,At approximately 7:30 P.M. I and my father and some neighbors were out in the street chatting when a large cylindrical object drifted t,Cylinder,30+ mins.
34.187044,118.3812562,North+Hollywood,CA,4/15/67,3 bright colored lights comming straight at me...,Formation,3 min
31.7618778,106.4850217,El+Paso,TX,4/15/67,Flying Lighted Chevron over the night sky.,Chevron,15 minutes
40.7556561,73.5876273,Westbury+(Long+Island),NY,4/14/67,"Sighting April 14, 1967",Formation,App. 20 minutes
36.1626638,86.7816016,Nashville,TN,4/11/67,"11 young adults sighted dark &quot;kakhi disk or saucer above treetops, daytime; followed in [car] as it [spiraled] away.",Disk,10-20 min.
25.7616798,80.1917902,Miami,FL,4/7/67,"Follow up on the Crestview Elementary sighting. Date was April 7, 1967.",Disk,10 minutes
31.7551864,106.3056405,middle+of+desert,TX,4/5/67,"Texas 1967, Triangle of lights turning around common center, with many smaller companion lights.",Light,45 minutes
31.5785074,84.15574099999999,Albany,GA,4/4/67,"I observed 7 bright lights moving in formation above the former Turner Air Force Base, in Albany Georgia, in the spring of 1967.  I ca",Unknown,15
30.8327022,83.2784851,Valdosta,GA,4/1/67,The craft moved about in the sky just like a hummingbird or a bee. It looked to be the size of a VW Bug.,Disk,2-3 minutes
25.7616798,80.1917902,Miami+(and+vicinity),FL,4/1/67,Witness tracked UFO's and USAF F-4 &quot;Phantoms&quot; on radar in Florida during 1967.,Other,5 hours
25.4687224,80.4775569,Homestead,FL,4/1/67,"Red lights along the side, white light in front,  in a search-like pattern: slow over water, very fast over land.",Unknown,2 hours
28.0592152,82.456859,Tampa+(18+miles+of)+??,FL,4/1/67,"I WAS BORN IN 1951,SO I WAS 16 YEARS OLD AT THE TIME OF THE SIGHTING. I LIVED AND STILL LIVE ABOUT 5 MILES EAST OF LAKE THONOTOSASSA.I ",Light,30-45 seconds
36.1699412,115.1398296,Las+Vegas,NV,4/1/67,pulsating white round  light that changed between white and blue,Light,2 minutes
25.9023168,80.25032709999999,Opa+Locka,FL,4/1/67,"1967 3 UFO'S above Crestview Elementary School, Opa-Locka Fla., several hundred witnesses",Oval,2 hours
25.9023168,80.25032709999999,Opa+Locka,FL,4/1/67,Verifying the 1967 UFO landing at a Miami elementary school yard.,N/A,Hours
40.94781580000001,90.3712395,Galesburg,IL,3/16/67,Close encounter with saucer shaped object.,Oval,2 to 3 minutes
41.24255309999999,82.6157331,Norwalk,OH,3/15/67,Grey Banana W/O lights or sound,Cigar,2 min.
31.4637723,100.4370375,San+Angelo,TX,3/15/67,Why would the Air Force sent a photo-recon jet to look at a weather balloon?,Circle,1 hr
44.27058539999999,71.3032723,Mt.+Washington,NH,3/10/67,Three incidents that happened to me in the White Mountains. 500 Lights On Object0: Yes,Circle,2 min
32.8609625,91.3884482,Oak+Grove,LA,3/3/67,My girlfriend and I were having a romantic evening in the front seat of my car one evening.  I looked across a field that lay in front,Unknown,30 Minutes
36.5711721,89.18617909999999,Hickman,KY,3/2/67,6 objects disappear and reappear jumping about 5 miles of airspace to dodge an airplane.,Formation,20 minutes
33.9791793,118.032844,Whittier,CA,3/1/67,Two observers witnessed 500-foot long oval craft  with lighted porthole windows flying low over Whittier.,Oval,2 seconds
41.5381535,72.80704349999999,Meriden,CT,2/20/67,Light on a dimmer switch,Unknown,6 minutes
42.6583356,71.1367953,Andover,MA,2/15/67,High altitude point of light makes high speed instantaneous 90 degree turn and  accelerates rapidly,Light,1 minute
41.2295386,73.9870847,Stony+Point,NY,2/13/67,appeared over barn with vaacum sound.     about 150 ft. long.  disappeared quietly into space,Unknown,2-3 min.
42.18877210000001,120.345792,Lakeview,OR,2/2/67,"WE SAW A QUARTER MOON  SHAPED, CREAM COLORED GLOW WITH WHITE PORTHOLE LIGHTS ON BOTH SIDES",Other,35 minutes
36.3433965,88.8503379,Martin,TN,2/1/67,"I saw a daylight disk in the afternoon followed by missing time, and seeing a small white humanoid. 500 Lights On Object0: Yes",Disk,"Not sure, missing time"
31.812438,106.4213208,Fort+Bliss,TX,2/1/67,"On an evening in February,1967 at 12;15am a friend and I were walking back to our billets from across the base at Ft. Bliss on a saturd",Disk,5+ minutes
38.9483444,95.6664279,Forbes+AFB,KS,1/15/67,I was in a van on the base after working on C-130 aircraft that night. I remember it was very cold and were in the van smoking cigarett,Disk,2-3 minutes
25.9023168,80.25032709999999,Opa+Locka,FL,1/1/67,Opa Locka 1967. Elementary school,Chevron,21 minutes
