lat,lng,city,state,date,specs,shape,duration
34.0922335,117.435048,Fontana,CA,12/31/94,"Man, wife, and neighbors witness strange, bright red light overhead.  Video-taped for 8-9 min... Obj. ascended, departed.",Light,10 minutes
40.2968979,111.6946475,Orem,UT,12/31/94,"Man &amp; wife, and four neighbors witnessed a strange ball of red, orange, and white light for 5 min.. Left trail",N/A,5 minutes
47.32926399999999,122.5801293,Gig+Harbor,WA,12/31/94,"Father, daughter, and  witnesses (astronomers) observe red obj. that ejected smaller objects.  Obj. shot off to SE.",N/A,12 minutes
38.7945166,83.5451934,West+Union,OH,12/31/94,"Young man repts. seeing orange dot, which fluttered, descended, disappeared, then suddenly reappeared w/ 3 other objs.",N/A,N/A
47.0042643,122.539846,Roy,WA,12/30/94,"Woman sees bright &quot;star,&quot; which moves toward her, glides overhead. Looks like &quot; three tubes joined together.&quot;",N/A,3 minutes
34.0522342,118.2436849,Los+Angeles,CA,12/30/94,"Three adults in car north of L.A. observed large, bright, orange ball of light move west.  Left luminous tail.",Light,2 min.
43.0722932,74.6926462,Oppenhium,NY,12/29/94,"A large kitchen table sized, ovel with lights going around it went past my house not making a sound.",Oval,about 5 min.
46.8140449,117.8818834,La+Crosse,WA,12/29/94,"Three seemingly identical black, delta-shaped, ships with a very bright yellow or white &quot;headlight.&quot;",Delta,N/A
43.446419,85.2741975,Lakeview,MI,12/29/94,"Man stopped on highway to watch bizarre lights moving in night sky.  Other cars stopped to watch them, too.",Light,5 minutes
34.1973122,118.6439809,West+Hills,CA,12/26/94,"Slow fireball, low in the sky",Fireball,5 seconds
39.1031182,84.5120196,Cincinnati,OH,12/25/94,On Christmas day we saw an orange ball of light with a ring surrounding it in the sky.,Circle,5 minutes
38.4192496,82.44515400000002,Huntington,WV,12/25/94,Kanawha River West Virgina 1994,Unknown,6 minutes
34.1489719,118.451357,Sherman+Oaks,CA,12/24/94,"Triangular, silent object, descends through clouds then ascends upwards, followed by helicopter.",Triangle,3-5 minutes
47.6062095,122.3320708,Seattle,WA,12/24/94,"Man witnesses very bright, multi-colored object pass overhead very fast.  Disappeared to the north in 20 sec..",Light,20 sec.
41.15453950000001,74.19292399999999,Sloatsburg,NY,12/23/94,"Bright white light too big to be a helicopter hovering over trees, in a blinks eye it shot up into sky.",Unknown,30 seconds
41.900101,71.0897674,Taunton,MA,12/20/94,"A humming object,that put me in a trance like experience flying over Taunton,MA",Other,30 seconds approximately
45.5016889,73.567256,Montreal+(Canada),PQ,12/17/94,hovering craft,Circle,5 mins
44.7893446,93.60183889999999,Chaska,MN,12/17/94,"Sphere above the horizon, ejecting smaller spheres",Oval,3 minutes
41.320343,93.09966999999999,Knoxville,IA,12/15/94,Hovering object seen high in night sky as a /\ (this should be like an arrowhead) changing or to a ,Changing,2 hrs?
34.39888380000001,119.5184564,Carpinteria,CA,12/15/94,I lived on the beach in Carpinteria at the time of the sighting.  The reason I am writing to you is that I have never heard of the type,Unknown,10 min.
39.768403,86.158068,Indianapolis,IN,12/15/94,"Ok, I was in 7th grade when this happend, but interested in UFO's.  I was coming out of my middle school after a basketball game.  Ther",Triangle,30 Seconds
40.9153362,81.10593089999999,Alliance,OH,12/15/94,Brightly Colored Orbs Over Portage County,Formation,30 min +
45.52597400000001,73.3406679,St-Bruno+(Canada),PQ,12/15/94,"It was very cold, so i was sitting in my car on this little side road off the trans-Canada highway through St-Julie, Quebec. I could se",Sphere,4 minutes
33.6469661,117.689218,El+Toro,CA,12/15/94,Saw a light in the valley moving back and fourth directly over the El Toro Marine Corps Air Station. It left straight up when two F/A-1,Light,3 mins
41.0997803,80.6495194,Youngstown,OH,12/15/94,"U.F.O in Youngstown,Oh",Teardrop,30 MINUTES
41.2476902,80.6715317,Vienna,OH,12/14/94,"HELP!Trumbull, Ohio, 1994, Local Authorities &amp;NBC cite Mass UFO sighting, Gov./Military Denies Incident, flimsy, but effectiveCover UP",Other,7-9 hours
35.08758359999999,84.0346315,Murphy,NC,12/13/94,"Woman reports seeing strange, lighted obj. with  &quot;arms.&quot;  Many witnesses and written reports.",N/A,N/A
36.0726354,79.7919754,Greensboro,NC,12/12/94,"U.F.O. seen over Greensboro, N.C. , unbelievable sighting of a Bright glowing object in the sky.",Oval,5 Minutes
33.4936391,117.1483648,Temecula,CA,12/10/94,"Last night, while driving home from work I spotted an unusual looking flying object.The UFO traveled slowly like a blimp.  It was t",Disk,3-4 mins
42.90823229999999,94.0845981,Lu+Verne,IA,12/9/94,Large orange ball of light moving slowly across sky.,Light,5 Seconds
41.5950989,72.6453705,Cromwell,CT,12/9/94,"Woman witnesses bizarre cluster of lights overhead, humming sound, sees strange beam of light &quot;scanning&quot; ground.  Exclnt rept.",N/A,8 min.
44.911006,116.0987364,McCall,ID,12/8/94,Couple awakened by bright lights illuminating home.  Neighbors saw same obj. hovering overhead.  Power failure reptd.,Fireball,10 seconds (?)
37.7808846,90.4217895,Farmington,MO,12/6/94,"No lights, no sound, and HUGE.  Quite an ironic sighting.",Chevron,2 minutes
33.9204354,80.3414693,Sumter,SC,12/5/94,"Large object no engine noise, hovering 75 yards away. producing a light that made no shadows. after short hover time began climbing at ",Circle,10 minutes
40.8980304,98.2131512,Phillips,NE,11/29/94,Silent bright multicolored object moved at high speed stopping abruptly to change direction. shot straight up into upper atmosphere,Light,10 minutes
39.2931174,83.9888205,Blanchester,OH,11/27/94,"triangular shaped object over SW Ohio, moving very slowly and completely silent",Triangle,2-3 minutes
47.6587802,117.4260466,Spokane,WA,11/27/94,Twin lights fly overhead,Unknown,5-10 minutes
36.0726354,79.7919754,Greensboro,NC,11/26/94,The object moved right and left very fast then a flash of light it split in two objects.,Cigar,20 mIN.
41.9583822,85.3249817,Colon,MI,11/23/94,"We were waiting for the school bus, when I looked up and saw three circular aircraft flying in a triangular form.",N/A,N/A
34.1425078,118.255075,Glendale,CA,11/23/94,The craft was a light blue shiny sphere frisbee looking object.It flew left to right  a couple of times then it flew in circles and the,Sphere,12 seconds
45.3733428,84.9553296,Petoskey,MI,11/16/94,"Object changed shape, color and path.",Triangle,20+min.
40.8687096,73.0014946,Coram,NY,11/15/94,"It was 5-10 feet above my head and my sunroof  was wide open,",Other,2 minutes
37.3184064,84.9393979,Liberty,KY,11/15/94,orange firery ball/ pouring out green and purple smoke from beneath./ at night-very visible,Fireball,15 mins
36.8354258,76.2982742,Portsmouth,VA,11/15/94,Two flashes of illuminating green light that lasted 3 seconds each &amp; lit up the surrounding area.,Flash,10 seconds
33.7489954,84.3879824,Atlanta,GA,11/15/94,HBCCUFO CANADIAN REPORT:  Oval shaped bright light.,Light,apprx&quot; 20 seconds
36.4745636,81.80483799999999,Mountain+City,TN,11/15/94,Computer engin. repts. seeing triangular ships over TN almost nightly.  Repts. overhearing radio commo. of  F-15  firing on UFO.,Triangle,20 min.
30.9251869,88.5900235,Lucedale,MS,11/15/94,I was caught in the light,Disk,3-4 min
28.8354507,82.3313955,Inverness,FL,11/14/94,A large rectangular ship making a humming sound was sighted over my house late in 1994.,Rectangle,N/A
32.715738,117.1610838,San+Diego,CA,11/14/94,Rectangle lights in circluar motion zig zagging through the sky within seconds.,Other,7 minutes
34.8734033,87.6233517,St.+Florian,AL,11/12/94,Alien Agricultural Expedition,Disk,5 min
41.3436554,86.3097278,Plymouth,IN,11/11/94,My friend and I were walking to my house when we stopped to look at the moon.  We started looking at stars and we saw a little ship com,Diamond,1.5 minutes
41.3436554,86.3097278,Plymouth,IN,11/11/94,1994 in Indiana- Black Triangle with white &amp; red lights hovering then flying away quickly,Triangle,5 mins
30.1316001,94.0154541,Vidor,TX,11/10/94,i believe i was abducted almost directly in front of my home. 500 Lights On Object0: Yes,Unknown,2 hours
29.4241219,98.49362819999999,San+Antonio,TX,11/10/94,It was in the morning and this grey ball was floating in the sky.,Circle,about 30 sec.
46.7682671,88.7531908,Alston,MI,11/5/94,"Triangular shaped UFO over house in Alston, Michigan",Triangle,1 hour
35.1846001,111.6325044,Hwy+I-40+(west+of+Flagstaff),AZ,11/5/94,The object was observed by myself and my wife while we were traveling west on I-40.,Oval,1 minute
61.678882,149.2278241,Palmer+(10+miles+north+of),AK,11/3/94,"No sound, traveled extremly fast. Appeared to dip down into the trees. It's incredible light made no reflection onto us or the groud.",Light,20 MINUTES
38.9104546,122.6102614,Lower+Lake+(Near),CA,11/1/94,&quot;The Dunn sightings&quot;  Two hunters parked at the end of a fire trail near the highest point in the area observed a bright white light in,Disk,10 minutes
42.2288084,83.7395095,Ypsilanti+(Pittsfield+Township),MI,11/1/94,"AT NIGHT ,WIND 20-25 FROM WEST MED TO HIGH CLOUDS SCATTERED OBERSEVED FUZZY LITE  OBJECT MOVING TO S/W 5-10 MPH NO SHAPE WAS NOTED CLOU",Unknown,1-3 MIN
36.011453,88.6228349,Trezevant,TN,11/1/94,Triangle UFO changes three lives. 500 Lights On Object0: Yes,Triangle,10 min
36.1049628,83.28538429999999,White+Pine,TN,10/31/94,Yellowish/orange sphere seen by 4 police officers in East Tn,Sphere,15 minutes
32.744774,116.998916,Spring+Valley,CA,10/31/94,red light over Tijuana Mexico viewed from Spring Valley,Light,45 minutes
28.4831682,82.5369872,Spring+Hill,FL,10/30/94,"WHITE DOTS OVER SPRINGHILL, FLA",Circle,20min
43.710915,83.5276722,Fish+Point,MI,10/25/94,2 round balls of fire hovering over Saginaw Bay,Fireball,10 minutes
29.4241219,98.49362819999999,San+Antonio,TX,10/25/94,"amorphous, floating ink-spot in the night sky",Other,10-20 seconds
35.2270869,80.8431267,Charlotte,NC,10/24/94,We were under brilliant illumination that was much brighter than the 2:30 pm afternoon clear day sunlight.,Disk,1/2 hour
40.245664,74.8459972,Yardville,PA,10/24/94,"On October 24th, 1994 at about 1:30pm 1:45pm It was a clear blue sky I was looking due west when I noticed High in the sky a bright red",Circle,10 to 15 minutes
37.5652016,77.5346972,(unknown),VA,10/23/94,3 lighted circular air craft,Triangle,Chimney Hill County
37.8715926,122.272747,Berkeley,CA,10/22/94,Points of light in the night sky in Berkeley followed years later by technological assault in San Jose.,Light,2 minutes
41.900101,71.0897674,Taunton,MA,10/20/94,I observed the Craft at a close enough distance to know it was not anything man made based upon my training and experience. 500 Lig,Circle,8-10 seconds
41.84087419999999,74.15243939999999,Stone+Ridge,NY,10/20/94,strange lights in field sound similar to another area sighting,Light,3-4 minutes
41.84087419999999,74.15243939999999,Stone+Ridge,NY,10/20/94,"While riding home at night, my wife, daughter, and I saw an object in the sky to our left over a cornfield.  From the center of the obj",Triangle,10 minutes
43.3269685,83.08022,Marlette,MI,10/20/94,"was comming north out of the sky. was a bright object, shot out of the sky come down in frot of the car and shot back up in the sky tow",Flash,N/A
44.2214069,80.8543847,West+Grey+(Canada),ON,10/20/94,"It was an absolute object,it had intent,and I will never forget that night!",Sphere,10 minutes
28.0186323,82.1128641,Plant+City,FL,10/20/94,"I was following it in my car for a short period of time and watched it disappear before my eyes, it was a clear morning. It amazed me. ",Disk,5 min
41.143245,81.8552196,Medina,OH,10/19/94,a huge bright orange sphere appeared and dissapeared,Sphere,20 minutes
42.3042402,76.1865964,Berkshire,NY,10/17/94,"V shaped light formation traveling in a south-west to north-east between Binghamton and Ithaca, NY",Triangle,5-10 minutes
35.4873613,80.6217341,Kannapolis,NC,10/17/94,brilliant light coming and going,Light,20 seconds
32.5448714,94.36741839999999,Marshall,TX,10/15/94,Orange fiery disk flying at tree level,Disk,5 seconds
45.1473445,122.5770322,Molalla+(near),OR,10/15/94,"black object in sky traveling above river, circle of light appearing to come from it lighting up river in just that area of light",Other,3 minutes
40.44062479999999,79.9958864,Pittsburgh,PA,10/15/94,"It was a clear night in October, about 1994.  I saw a bright white &#8220;star like&#8221; thing in the sky. It was NOT moving. I was facing down t",Light,30 seconds
40.3003752,83.06848289999999,Outside+of+Delaware,OH,10/15/94,Four UFOs and a mothership on tape,Teardrop,21:00 to 23:00
41.6347726,84.9994088,Angola,IN,10/15/94,"Designed like a spare tire, dark back lit port blueish, had been hiding in a forest .",Disk,2 to 3 minutes
43.0389025,87.9064736,Milwaukee,WI,10/15/94,"A ufo with a large circular, white light ing the center with 3 smaller, red lights making a triange shape around the white light.",Triangle,N/A
48.3681223,124.6249602,Neah+Bay,WA,10/15/94,Metallic sphere floats in the sky...,Sphere,30 minutes
35.8251273,92.4406387,Oxley,AR,10/15/94,On the way to my grandfathers house myself and my father witnessed a red fireball hovering in the middle of the old gravel road we were,Fireball,Seconds
42.4439614,76.5018807,Ithaca,NY,10/15/94,"A bright object was seen from a far distance. It gave off a bright white light, sometimes turning gold, the it would turn red and green",Light,3 hours
47.6101497,122.2015159,Bellevue,WA,10/15/94,"Former mil. officer (ret.) w/ son &amp; 4 others witnessed a very bright obj. in cloudless blue sky.  Alternated silver, black, then white.",N/A,25 min.
39.600618,82.9460133,Circleville,OH,10/15/94,"Silver disc saucer hovers above town, then disappears",Disk,30 seconds to one minute 
41.84087419999999,74.15243939999999,Stone+Ridge,NY,10/15/94,Sitting on bench at UCCC. Looked up to the West and saw an oval UFO. Closed my eyes because my mind could not believe what it was witne,Oval,30 seconds
35.3614649,86.8397236,Cornersville,TN,10/14/94,"Bright, round, white light flies over Coleman RD at night. 4 people saw that I know of. It was moving slow.",Circle,5 to 20 minutes
29.41191659999999,82.10981559999999,Citra,FL,10/14/94,We saw a perfect  Spherical ball of light in the sky that  wasn't the moon.,Sphere,2 min
36.3231066,86.7133302,Goodlettsville,TN,10/14/94,"I saw what looked like a large orange fireball hovering, it then shrunk to the size and color of a star.",Changing,2 minutes
37.7808846,90.4217895,Farmington,MO,10/13/94,I spotted what I thought was a bright landing light of a larger than usual aircraft for our airport.,Cylinder,2 min
47.2430959,68.3136517,St.+Agatha,ME,10/13/94,"UFO flap of 6 crafts hovering over 2 women in a car, near Long Lake, St. Agatha, ME.",Disk,45 minutes
27.2439349,80.82978279999999,Okeechobee,FL,10/12/94,Close encounter 5th kind - CE5.,Disk,unknown
36.8297937,84.8491126,Monticello,KY,10/12/94,Triangular/chevron small object with fixed lights at corner--very fast moving.,Chevron,1-2 minutes
42.8142432,73.9395687,Schenectady,NY,10/12/94,I had just picked up my Daugther (2yrs old) from my Mother-in-Laws and was on my way home it was a clear cold crisp day with the leaves,Other,a few minutes
43.8970929,78.86579119999999,Oshawa+(Canada),ON,10/12/94,Boomerang.,Other,15 minutes
33.9533487,117.3961564,Riverside,CA,10/11/94,"Double white lights in chevron shape flying north to south about the size of the constellation of the Pleades, covered half the sky in ",Chevron,4 seconds
40.0918895,74.35874729999999,Jackson,NJ,10/11/94,triangle UFO in jackson NJ  Countyline 526   over the old fire station next to the trailer park,Triangle,5mins
43.653226,79.3831843,Toronto+(greater+Toronto+area)+(Canada),ON,10/10/94,Large rusty sphere,Sphere,~1 hour
34.102783,91.9923249,Pinebergen,AR,10/10/94,"Round, bright, low flying object silently speeds West of Arkansas town at 11:30pm, 10/10/94.",Light,5 seconds
42.9096911,73.8951486,Burnt+Hills,NY,10/10/94,"Giant rectangular craft (resembling an upside-down aircraft carrier) over highway near Saratoga, NY.",Rectangle,2 minutes
26.1497977,97.91361119999999,Mercedes,TX,10/10/94,ufo chased by fighter jet over Rio Grande Valley. Seen on news,Cigar,1 hour
25.8575963,80.2781057,Hialeah,FL,10/9/94,sunlike sphere,Sphere,4 minutes
48.3808951,89.2476823,Thunder+Bay+(Canada),ON,10/8/94,The speed it moved is unbelievable. and the colour of light's is unmistakeable.,Oval,15 min.
26.5317866,80.0905465,Boynton+Beach,FL,10/8/94,UFO Pictures,Other,Fast
39.600618,82.9460133,Circleville,OH,10/5/94,Large object with flashing seen from 3 directions over Circleville.,Circle,30-45min
40.4437018,76.42829329999999,Fredericksburg,PA,10/1/94,"I was driving by on the road and seen this saucer , it was ON the ground near a house. I stopped down the road and got out to get a clo",Disk,5minutes
38.2554729,120.3510307,Arnold,CA,10/1/94,"A string of multicolored lights, silently gliding by above the tree tops, at 11 pm, in a high mountain town.",Other,5 minutes
36.1699412,115.1398296,Las+Vegas,NV,10/1/94,Bright green object in flight allmost colided with my aircraft.,Circle,5 seconds
38.2430811,93.3818711,Warsaw,MO,10/1/94,Triangle shaped object hovering above the water.,Cigar,10 Minutes
34.4208305,119.6981901,Santa+Barbara,CA,10/1/94,Black triangle,Triangle,3 seconds
42.1487043,72.6078672,Chicopee,MA,10/1/94,"Chicopee State Park, Craft seemed to be shooting balls of light or breaking up",Changing,5 minutes
31.223414,90.421506,Tylertown/McComb+(between;+on+Hwy.+98+),MS,10/1/94,"orange molten-metal, crescent-shaped object paralleling car for 15 - 20 minutes",Changing,20 minutes
40.7127837,74.0059413,New+York+City,NY,10/1/94,"a flying colorful disc above my car, near Erie.  ((NUFORC Note:  Possible hoax??  PD))",Disk,15 seconds
36.3378321,96.8039232,Pawnee,OK,10/1/94,It was triangle shape with white lights at each corner of it and a large red one in the middle.,Triangle,20 min
35.4492404,86.7888887,Lewisburg,TN,9/27/94,A light split into 5 lights.,Disk,about 1 minute
48.6330816,122.9289822,Orcas+Island,WA,9/24/94,Bright blue flashes in the sky and zigzagging light - 1994,Light,1-1/2 hrs
43.3255196,79.7990319,Burlington+(Canada),ON,9/24/94,i made a composite and closeup painting with a map to provide visual details of this remarkable event.,Triangle,5 minutes
41.2613129,114.1941831,Montello,NV,9/21/94,multi-colored circle of lights moving slowly in northerly direction above mountains.,Circle,1 minute
41.2613129,114.1941831,Montello,NV,9/21/94,"A necklace of colored lights against light blue sky, about 800 yards long, moving slowly north.  Blue sky could be seen through the cen",Other,30-40 sec.
41.2429494,81.71305219999999,Hinckley,OH,9/20/94,UFO Medina County 1994,Circle,5 minute
39.0725121,93.7171621,Higginsville,MO,9/20/94,We saw what we thought was a star that kept moving around and disappeared.,Other,15 minutes
38.5890723,121.302728,Rancho+Cordova,CA,9/20/94,While driving East on highway 50 fireball dropped out of sky.,Fireball,1second
41.467642,75.61877659999999,Dickson+City,PA,9/20/94,Burnt orange ball from 06:50 rising from the west for about 30 seconds until it reach the '10:30' postion in the sky before blinking ou,Fireball,30-40 seconds
40.6639916,74.2107006,Elizabeth,NJ,9/17/94,i could not identify this object with any known craft although i has study janes and nasa craft for years!,Disk,3 min
47.0798248,122.0515005,Carbonado,WA,9/16/94,IT STOPPED IN THE ROAD AHEAD SO CLOSE I COULD HAVE HIT IT WITH A ROCK,Oval,1 h
47.0798248,122.0515005,Carbonado,WA,9/16/94,IT CAME DOWN THE HILL AND INTO THE ROAD ORANGE-YELLOW BIG AS A HOUSE 50YDS AWAY,Changing,30mins
41.0478404,79.8133849,North+Washington,PA,9/15/94,F A S T -  Ionized Sphere?,Oval,4 Seconds
47.6587802,117.4260466,Spokane,WA,9/15/94,"I was able to clearly see three seperate disk shaped vehicles, with brassy looking metalic bodies that had three round nubs at the extr",Disk,2 min.
41.9270367,73.9973608,Kingston,NY,9/15/94,"Kingston, NY Sighting",Triangle,10 mins
40.4826851,79.95193069999999,Pittsburgh+(outside+of),PA,9/15/94,"While watching Prime Time live on TV, they stopped for the Crash of USAir Flight 427 and when showing the sky, the only object seen was",Disk,1 minute
48.1987118,122.1251418,Arlington,WA,9/15/94,"Comm. pilot repts. multiple, &quot;almost translucent&quot; objects streaking directly over his home in Fall l994.",N/A,10 sec.
30.4205138,97.9102647,Lake+Travis/Austin,TX,9/15/94,Myself and five other friends of mine were sitting on a rock ledge over looking lake travis. We had not been drinking or undre the infl,Other,25 seconds
36.0595148,91.9084819,Melbourne,AR,9/15/94,"I am a retired Fire Captain, City of Detroit, Mi. In 1991 We, my wife and youngest daughter, purchased a home in the &quot;Ozarks&quot;, Melbourn",Disk,10 seconds ?
34.1975048,119.1770516,Oxnard,CA,9/15/94,My husband and pulled up to Circle K to use the payphone. As I got back in the car we saw two men pointing up over the store.My husband,Disk,10 seconds
42.6583356,71.1367953,Andover,MA,9/15/94,enormous transparent cylinder/cigar shaped object w/stars(?) attached,Cigar,10-15 Seconds
41.5767602,74.4871031,Wurtsboro,NY,9/14/94,I was coming back from yankee lake when i saw it coming towards  route 17.About 11:30 P.M.,Circle,11:00
39.7284944,121.8374777,Chico,CA,9/9/94,"large solid spherical, bright emerald green with yellow fiery tail, coming across sky at a slow downward angle.  No impact felt or hear",Fireball,5-7seconds
43.1393867,80.2644254,Brantford+(Canada),ON,9/6/94,strange light that flashed,Light,10 weconds
21.313149,158.0089992,Ewa+Beach,HI,9/4/94,"09/04/94, Ewa Beach HI, Unidentified Spacecraft about 10 times larger and similar in design to our modern aircraft carriers.",Cigar,10 seconds
32.6728256,114.1468821,Wellton,AZ,9/1/94,Megatron in the bushes,Unknown,1 hour
37.7749295,122.4194155,San+Francisco,CA,9/1/94,glowing ball just under the surf about 2 1/2 feet off the beach south of san francisco/ocean beach approx 9/94,Sphere,10-15 minutes
45.0478557,123.9925014,Sitka,OR,9/1/94,"Small, silver, oval, about 1/2 mile out over bay, accelerated at enormous speeds, disappeared",Oval,1 minute
42.4390069,123.3283925,Grants+Pass,OR,9/1/94,"Thought of as a Dream for 20 Years, Recent Information Convinced me that Iv been Abducted by Aliens.",Changing,12 hours
40.7127837,74.0059413,New+York+City,NY,9/1/94,5 LIGHT THAT LOOKED LIKE STARS MOVING UP AND DOWN ON LIGHT AT A TIME,Light,3 hours
35.2481394,93.049061,PottsVille,AR,9/1/94,A bright orange sphere hovering over interstate 40 turned white then vanished.,Sphere,5 Min
37.9370132,121.2998987,Stockton+(South+of),CA,8/31/94,"I was captured, encapsulated,  I was one with that light, the objects were light.",Circle,minutes
32.715738,117.1610838,San+Diego,CA,8/28/94,"I was standing in by backyard, just past twilight, stargazing, when I noticed a large chevron shaped formation of lights, traveling fro",Chevron,15 seconds
44.012716,90.68835519999999,Fort+McCoy,WI,8/26/94,Disc shaped object darted across the sky in a reverse Z pattern.,Disk,20 seconds
33.1709559,84.5804828,Alvaton,GA,8/25/94,"We saw a bright light in the sky that ended up hovering directly above our car, was triangular, chased us before it left us alone.",Triangle,10 minutes
41.5886629,83.89105339999999,Swanton,OH,8/25/94,Football shaped object seen over house in country along with three objects hovering over road.,Other,five to ten min
32.4459968,112.8710113,Gila+Bend/Ajo,AZ,8/25/94,"2 lights moving in west sky at 8pm. one came down @ 820pm couldnt start truck, then was naked in passenger seat @ midnight",Other,20 mins
41.0256101,81.72985190000001,Wadsworth,OH,8/25/94,"It was a cloudless, bright day. As I was getting into my Chevy Cavalier I saw this flat black bowling ball shaped thing with a ring aro",Sphere,30 seconds
40.7127837,74.0059413,New+York+City,NY,8/25/94,no light and moved very slowly,Egg,a minute
40.7127837,74.0059413,New+York+City,NY,8/25/94,"Observation of egg blimp shapped object in front of World Trade Center Towers, NY.  Possibly a second sighting.",Egg,5 Mins +
44.4259092,69.0064234,Belfast,ME,8/24/94,Scared to death at a city park.  Overlooking Belfast Harbor,Triangle,20 min.
48.3808951,89.2476823,Thunder+Bay+(Canada),ON,8/22/94,I LOOKED UP IN THE DARK SKY AND SAW A BRIGHT WHITE LIGHT WHICH SLOWLY MOVED IN FRONT OF ME THEN STOPPED AND WAS TOTALLY SILENT.,Circle,20 seconds
39.600618,82.9460133,Circleville,OH,8/21/94,"On Sunday night, August 21, 1994, at 10:35p.m., a triangle-shaped craft was observed flying over U.S. Route 23 in front of the local Du",Triangle,20 seconds
32.6926512,114.6276916,Yuma,AZ,8/20/94,"Small red dot zoomed in at high speeds, came up to us. Saw the craft in slight detail.",Oval,1 minute
37.176447,94.31022279999999,Carthage,MO,8/20/94,Unidentified large flying object,Unknown,3 minutes
43.0125274,83.6874562,Flint,MI,8/20/94,"Object moved VERY slowly then accelerated incredibly fast from a stop, completely silent.",Disk,2-3 minutes
38.2975381,122.286865,Napa,CA,8/20/94,Bright light becomming glowing oval white light with two multi-colored lights zipping by at high rate of speed.,Light,2 seconds
40.0026176,74.0604141,Normandy+Beach,NJ,8/20/94,"clear skies, daylight,a triangle shaped object moving faster then the speed of sound without a any sound then divided into 2 seperate .",Triangle,4 seconds
36.0385079,111.8373843,Grand+Canyon+-+Navajo+Point,AZ,8/19/94,2 craft disappeared into space,Light,25 seconds
39.3545046,84.1271568,Morrow,OH,8/18/94,I could hit it with a baseball - the u.f.o. that is (a most VERY true story),Disk,10 minutes
