lat,lng,city,state,date,specs,shape,duration
28.5547225,81.10645199999999,Bithlo,FL,12/30/67,"On the evening of December 30, 1967, shortly after dusk, I observed along with two other witnesses, a circular craft, approximately 40",Disk,Approx. 7 hours
38.5292877,76.97525139999999,La+Plata,MD,12/15/67,"bright rotating colors, two objects, one large and one much smaller.",Circle,10 minutes
41.3139426,81.6851271,Broadview+Heights,OH,12/6/67,"Saw descending star-shaped object, slow, bright, no trails, no explosion, twice in 15 years.",Light,20 seconds
43.12784680000001,121.0480986,Silver+Lake,OR,11/20/67,"Saw a small white light that increased dramatically in size, reduced to a small light, turned red and zip......it was gone.",Unknown,1minute
48.993723,122.7471191,Blaine,WA,11/15/67,UFO flyover during war games.,Unknown,36 seconds
34.0194025,80.9440147,Fort+Jackson,SC,11/15/67,2 soldiers obseved object while on guard duty.,Disk,15 minutes
41.8781136,87.6297982,Chicago,IL,11/12/67,"Saucer shaped, with 2 and a half portholes visible, a red light atop, and it moved away at high speed",Disk,30 - 60 seconds
31.0567117,93.21312309999999,Fort+Polk,LA,11/10/67,"This was a UFO sighting by a military formation at  Ft Polk, Lousiana in 1967.",Unknown,5-10 inutes
37.8735377,122.4566392,Tiburon,CA,11/2/67,"Teardrop outlined in white light, three circular white lights in dark interior, silent.",Teardrop,20 seconds
34.774531,96.6783449,Ada,OK,10/31/67,Extreemly fast moving multi colored circle of light.,Circle,12 seconds
31.9973456,102.0779146,Midland,TX,10/31/67,I remember this event very distinctly.  However I am unsure of the date.  It&#8217;s approximate.  However I am very sure it was during a Hal,Light,5 seconds
41.0232624,73.5652049,Old+Greenwich,CT,10/20/67,Very OLD sighting of glowing blue object hovering over RR tracks/wires in SW Connecticut. 1967!,Disk,30 seconds
36.2978443,91.515973,Cherokee+Village,AR,10/17/67,Bright light - 12ft Sphere,Circle,35 minutes
38.2706059,121.944889,Travis+AFB,CA,10/15/67,UFO AT TRAVIS AFB CALIFORNIA 1967.,Unknown,?
34.4113854,118.5400858,Saugus,CA,10/15/67,"oct. 1967 late night, I was a high school student living in the boring town of Saugus, California, the nearest town was Newhaul, and th",Light,3 minutes
34.187044,118.3812562,North+Hollywood,CA,10/15/67,A fireball over the San Fernando Valley in 1967,Fireball,15+ minutes
34.3675936,77.71054819999999,Hampstead,NC,10/15/67,Hampstead North Carolina disk 1967,Disk,5 minutes
33.5206608,86.80248999999999,Birmingham,AL,10/15/67,description of a spaceship spotted over Birmingham Alabama in 1967.,Oval,five minutes
44.586581,73.3800905,Lake+Champlain+(N+end+of)+(Canada),QC,10/15/67,"Strange, circular object with a halo or glowing ring around it which moved at unbelieveable speed, almost straight up.",Circle,10-15 min.
26.5867358,80.05198589999999,Lantana,FL,10/7/67,UFO report and theory of motion.,Other,3minutes
40.8254055,74.4022355,Whippany,NJ,10/6/67,noticed lights in the sky just above tree tops,Disk,30 min
43.0481221,76.14742439999999,Syracuse,NY,10/5/67,silent luminescent disc shining in the pre-dawn sky,Disk,2 minutes
44.977753,93.2650108,Minneapolis,MN,10/1/67,"In October 1967, 2 Disks sited heading north over Minneapolis MN.",Disk,10 seconds
56.031873,121.90508,Hudson's+Hope+(Canada),BC,10/1/67,Large round silver UFO in Peace River Valley 1966-67,Sphere,2 Minutes
38.8922687,89.41313559999999,Greenville,IL,10/1/67,"My son and I went to a ballpark close by to play- we were the only ones there, I happened to look up and right over us, were 3 round uf",Circle,30 seconds
42.5681176,78.4789091,Chaffee,NY,10/1/67,34 years ago and still &quot; seeking the truth&quot;,Sphere,10 minutes
43.18332350000001,90.1979016,Lone+Rock,WI,9/30/67,"I had just had my car tuned-up that day and my mother and I were on our way to work at an ammunition plant, 2nd shift.  When the car qu",Oval,3 to5 min
35.0853336,106.6055534,Albuquerque,NM,9/22/67,A property search and a  &quot;close encounter&quot; with unknowns?,Unknown,~1hr
39.9583892,84.17216379999999,Tipp+City,OH,9/20/67,"An object , reported in Project Blue Book, followed us  for about one half mile then shot straight into the night sky.",Light,4-5 Minutes
34.165357,118.6089752,Woodland+Hills,CA,9/20/67,I noticed a light that appeard to be above the Sepulveda Mullholland pass area. The light moved vertically and horizontally stopped and,Triangle,5 minutes
38.440429,122.7140548,Santa+Rosa,CA,9/15/67,ORANGE/RED CIRCLE OR SPHERE. APPROX. - 15% TO 20% LARGER THAN FULL MOON.,Circle,7 SECONDS
29.3731277,98.6263718,Lackland+AFB,TX,9/15/67,"light changes colors, releases a smaller light and makes a u-turn",Unknown,~1 minute
21.4867858,158.0559938,Schofield+Barracks+Military+area,HI,9/15/67,A luminescent disc of light traveling at tremendous rate.,Circle,6 to 8 sec.
42.5776364,121.8661258,Chiloquin,OR,9/15/67,"It was steel gray, simigloss exterior.It was a disk. the sun was behind the horizon.It was dusk. the craft was hovering over the ri",Disk,2 minutes
38.2600168,96.8197407,Cedar+Point,KS,9/15/67,It is interesting to me tht I've had three encounters. 500 Lights On Object0: Yes,Light,5 minutes
58.9419444,153.1855555,Cook+Inlet+(at+sea),AK,9/15/67,"I am 80 years old and want to tell what went on. It was about sept. 1967, I was a crewman on the m/v Camron, a support vessel for a jac",Light,10 minutes
45.3070685,69.03339,Brownville,ME,9/10/67,Three  metallic circles saw on the western horizon.,Circle,3 minutes
33.7489954,84.3879824,Atlanta,GA,9/10/67,"Cigar shaped UFO with lights all around it stationary in the sky for 10 min, then moved and stationary for 10min, took off-gone in sec.",Cigar,20 minutes
38.7317431,82.9976742,Portsmouth,OH,9/10/67,"Starting with a single craft flying at altitude of no more than 600-800 feet, on a heading from N to S, flying over my sister's house, ",Other,30 minutes
33.8622366,118.3995194,Hermosa+Beach,CA,9/8/67,5 Red Glowing Cigar Shaped Ships Sighted at Hermosa Beach in 1967,Cigar,1-2 minutes
39.2903848,76.6121893,Baltimore,MD,9/7/67,Strange looking craft and possible lost time,Unknown,5 mins
40.2659269,96.7466913,Beatrice,NE,9/6/67,sighting of disc in Beatrice Nebraska,Disk,1-2minutes
37.7433757,87.7039056,Corydon,KY,9/5/67,Saw a silver disk pass east to west over me on a sunny September aftermoon,Disk,30 seconds
37.4701189,105.8827597,Crestone+(near+Alamosa),CO,9/3/67,"Saw 3 house size balls of fire come straight down, turn to fly horizontal straight at us for 40 miles in 3-4 seconds then pass out of s",Fireball,30 seconds
41.3136644,81.7245739,North+Royalton,OH,9/1/67,what did we see?,Disk,10 min.
37.990079,84.17965029999999,Winchester,KY,9/1/67,We observed the craft approaching the city limits from the SE at a slow pace and as we approached the intersection of Highway 15 and Ma,Cigar,15
32.6409711,90.3648139,Bentonia,MS,9/1/67,a light that did not light the ground around me but was so bright i just could look at it then it shot across the sky,Light,5 min
39.2486126,94.90024129999999,Lansing,KS,8/30/67,Two sets of lights blinking alternately.,Unknown,5 mins
39.0472046,84.55991689999999,Fort+Mitchell,KY,8/29/67,"08/29/1967  9:31 pm  saucer shaped object ,change positions, wobbled ,stopped, watched for15 minutes",Disk,15 minutes
33.9564194,118.4422317,Playa+del+Rey,CA,8/25/67,"Oval light (the size of a five story building) sighted from shore had no reflection on water, no sound and traveled at breakneck speeds",Oval,4-5 min.
46.9137655,116.8331548,Princeton,ID,8/25/67,Flying Saucer: August 1967-A Teen's Observation,Disk,30 mins.
26.1224386,80.13731740000001,Fort+Lauderdale,FL,8/24/67,"Object shot across sky,  then came to complete stop and began glowing, and growing in size,.",Cigar,3mins
40.44062479999999,79.9958864,Pittsburgh,PA,8/22/67,i looked up at the stars as it was getting darker. as i did i noticed a small point of light moving high across the sky. as i watched i,Circle,5 minutes
32.6488598,116.9946285,Azusa+Canyon+(?),CA,8/20/67,A light or object moving the stars out of an area to create a hole in the sky for possible vision from beyond?,Unknown,30-40 min.
38.7222734,86.67055169999999,Huron,IN,8/20/67,"While traveling west on Ind st hwy 60, my ex-wife and I saw a cigar shaped object houvering over the intersection of u.s. hwy 50 and In",Cigar,5 minutes
41.3890052,70.5133599,Edgartown,MA,8/20/67,WHITE SPHERE STOPS OVER HOUSE,Sphere,1-1/2 MINUTES
39.9259463,75.1196199,Camden,NJ,8/16/67,"Dark &quot;disc&quot; over Newton Creek in Camden, first appeared &quot;round&quot; and then to &quot;oval&quot; to a fine line to nothing!",Changing,5-10 minutes
28.6729103,-77.1211905,Gula,AK,8/15/67,Circle,Circle,40 min
38.9172216,97.2139094,Abilene+(near),KS,8/15/67,"Blimp shaped ufo, with loss of time.",Egg,15 minutes
37.957592,119.119943,Lee+Vining,CA,8/15/67,A large silent circular object hovered above our campsite blocking out 75% of the starry sky.,Disk,20 min
40.99787730000001,72.2925819,Sag+Harbor,NY,8/15/67,Silent green globe sighted within 200 feet!,Sphere,1 minute
44.5434095,68.4194641,Ellsworth,ME,8/15/67,Tear-drop shaped silent craft with sectional front end.,Teardrop,5 minutes
47.4668384,122.3405305,Burien,WA,8/15/67,Lights move at incredible speed over Puget Sound.,Light,2 minutes
41.174224,80.453402,West+Middlesex,PA,8/15/67,"On a hot August night, my mom and I went down to the store for milk. (I was 12).  It was 1967.Going out our road, my mom judged w",Fireball,3 hours
28.0836269,80.60810889999999,Melbourne,FL,8/15/67,Contact but not a vehicle sighting; 1967 evidence of collusion.,N/A,N/A
42.5792583,71.4378411,Westford,MA,8/15/67,It appeared to be a satellite until it descended over us at a low altitude and just hovered at 500ft until it ascended and continued on,Unknown,20 min
43.7764258,79.2317521,Scarborough+(Canada),ON,8/15/67,Silver Torpedo craft with two smaller silver spherical objects circling  around the mid section of longer craft,Cigar,2-3 Mins
35.0853336,106.6055534,Albuquerque,NM,8/15/67,three terrified kids,Cigar,half an hour
41.8781136,87.6297982,Chicago,IL,8/12/67,saw a triangular shaped object flying low and slow following power lines on RR tracks at dusk,Triangle,2 minutes
34.7464809,92.28959479999999,Little+Rock,AR,8/11/67,Orange hovering object chased by Air Force jets,Circle,2minutes
37.4694491,105.8700214,Alamosa,CO,8/8/67,Alamosa UFO disappears after flash of blinding light.,Light,20 minutes
40.6956552,73.3256753,Babylon,NY,8/8/67,Circular object with lights  around perimeter hovering over  witness,Circle,2 minutes
36.6072567,83.7142848,Middlesboro,KY,8/8/67,the bottom was gray and as large as the fild we were in.,Oval,unknown
35.3859242,94.39854749999999,Fort+Smith,AR,8/5/67,Unidentified objects witnessed by hundreds over Fort Smith Arkansas,Teardrop,3 - 4 hours
35.3859242,94.39854749999999,Fort+Smith,AR,8/5/67,Sixties mass sighiting in Fort Smith recounted by military pilot witness.,Chevron,Multiple events over 3-4 
35.3859242,94.39854749999999,Fort+Smith,AR,8/5/67,Results of research on Ft. Smith chevron sighting.,Chevron,30 seconds
51.0486151,114.0708459,Calgary+(Calgary),AB,8/3/67,Close observation of hovering saucer shaped craft about 75' above the ground. 500 Lights On Object0: Yes,Disk,5 min?
44.8341639,87.3770419,Sturgeon+Bay,WI,8/1/67,"This has happened so long ago but the event is very clear yet.  It was an evening, on the way home from watching a movie, I approached ",Cigar,2 minutes
40.683988,73.004831,Davis+Park,NY,8/1/67,"3 dim lights in triangle shape, about 400 ft high, moved west to east slowly along S. shore of Fire Island, NY",Triangle,90 seconds
43.216505,123.3417381,Roseburg,OR,8/1/67,"3 round craft , with red-blue-green swirling lights, ( no sound) , and sparks emitting from beneath them.",Sphere,15 minutes
42.3509179,73.8029028,Coxsackie,NY,8/1/67,"Greenish-red, hazy, circular object hangs in sky almost like a &quot;bat signal&quot; in Coxsackie, New York.",Circle,3-5 minutes
40.717372,73.87425,New+York+City+(Queens)(Middle+Village),NY,8/1/67,Foreign Object Just Whizzing By Lights Up the Sky in the Summer of the Late 60's.,Diamond,3-5 Minutes
44.850452,89.8505012,Marathon+County,WI,8/1/67,A very close and long encounter by my family in a very rural farm in wisconsin.,Disk,1:00
32.9786566,115.530267,Brawley,CA,8/1/67,Aircraft was hovering about 20 ft. sucking water from canal.,Disk,20 minutes
41.0256101,81.72985190000001,Wadsworth,OH,7/31/67,It travelled too fast to be man made.,Other,20-25 seconds
43.1042277,77.8844543,Churchville,NY,7/31/67,That night I witnessed a UFO changed my life forever. There have been unbelievable events ever since in my life.,Disk,02:00
26.7153424,80.0533746,West+Palm+Beach,FL,7/20/67,Object came from southwest horizon heading northeast.  Brightly colored as if burning.,Fireball,90 seconds
45.11739619999999,68.19846849999999,West+Lake,ME,7/20/67,I SAW A ORANGE GLOW LIGHT IN THE DEEP WOODS AT NIGHT MOVING SLOWLY AND CLOSE TO THE TREE TOPS 2 OF MY BUDDIES AT CAMP SAW IT ALSO,Circle,4-5 SECONDS
29.457177,94.6396378,Crystal+Beach,TX,7/16/67,"Spent a sunday in July 1967 at Crystal Beach with friends, at dusk I spotted what appeared to be a speed boat in the Gulf heading towar",Disk,3.25 hours
38.4095298,82.29459229999999,Barboursville,WV,7/16/67,"Spherical UFO, fall of 1967, Barboursville,W.Va.",Sphere,3 to 4 minutes
38.5815719,121.4943996,Sacramento,CA,7/15/67,Single star-like object splitting into three star-like objects and moving uniformly across the sky.,Light,90 - 120 seconds
41.9295602,73.3886484,Lakeville/Limerock,CT,7/15/67,"It was like the movie Close Encounters in the beginning with the lights in the Clouds,,but it was 1967,,,66",Formation,45 min
40.9378415,79.8461638,Boydstown,PA,7/15/67,Clear view in daylight,Disk,10 minutes
51.0486151,114.0708459,Calgary+(Canada),AB,7/15/67,"Daylight sighting of metallic sphere over golf course in Calgary, Alberta in Summer of late 1960's.",Sphere,5 min
39.89674249999999,79.9744992,Carmichaels,PA,7/15/67,"In 1967 our town was celebrating it's bi-centanial, a month long celebration which included several events including a temporary museum",Chevron,30 mins.
44.6688524,90.1717987,Marshfield,WI,7/15/67,"When I was a kid, not unlike most&#8230; I enjoyed sleeping outdoors with my friends to watch shooting stars and satellites while gazing at t",Disk,30-60 seconds
41.138912,104.821144,Wyoming+(rural),WY,7/12/67,My father was an over the road truck driver. I was just a young boy. When he returned from his week long run he told my mom he had seen,Cigar,N/A
35.3859242,94.39854749999999,Fort+Smith,AR,7/5/67,"Triangular lighted hovering object over Fort Smith, Arkansas in 1967 or 1968",Triangle,5 MINUTES
45.6318397,122.6716063,Vancouver,WA,7/2/67,When I was in middle school the summer of 1967 my buddy and I were camping in my back yard.Around 1:00 am we decided to take a walk,Oval,3 minutes
38.8338816,104.8213634,Colorado+Springs,CO,7/1/67,Triangular object in 1967,Triangle,1 minute
40.8200623,74.3647247,East+Hanover,NJ,7/1/67,"no moon,observed colored blinking lights apox.     150' up in southern sky.",Cigar,aprox.10min
27.8005828,97.39638099999999,Corpus+Christi,TX,7/1/67,MIB event.,Other,10 minutes
43.84551949999999,92.1890516,Chatfield,MN,7/1/67,"No sighting, but strange sounds and flickering lights after midnight.",Unknown,unknown
44.03291050000001,120.4183296,Maury+Mountains,OR,7/1/67,Possible Crashed UFO In Oregon's Maury Mountains In The Summer Of 1967.,Fireball,Unknown
34.9100883,86.42776769999999,New+Market,AL,6/30/67,Discs in V-formation flying over Northern Alabama in the summer of 1967,Triangle,1 minute
47.1342432,122.4857321,Ft.+Lewis,WA,6/30/67,"We noticed three points of light that came together to form a triangle, hovered there, and then streaked off in different directions.",Light,5 minutes
42.0697509,87.7878408,Glenview,IL,6/30/67,"Large ball of light hovering above the road in Glenview, Illinois - 25 - 30 observers - 1967 or 1968.",Circle,15 minutes +
33.5604168,81.7195533,Aiken,SC,6/30/67,Strange oval shaped silent metallic object about 2000 feet ovrehead with four oscillating lights,Oval,3 minutes
21.4954957,158.0626555,Schofield+Barracks,HI,6/30/67,"Luminescent disk traveling at fantastic speed over ocean near Schofield barracks, Hawaii",Circle,5 to 8 sec.
39.2486126,94.90024129999999,Lansing,KS,6/30/67,Silent light darts to avoid collision.,Light,5 mins
30.2751945,89.78117449999999,Slidell,LA,6/30/67,I appreciate this forum to report what I saw. I was a young lad who went outside to feed the dog in the back yard. While walking back t,Circle,about 1 minute
36.3548586,79.6644747,Reidsville,NC,6/30/67,"Round, ball like object, red with yellow streaks moves over tree tops.",Circle,15 minutes
41.60232449999999,71.25032569999999,Portmouth,RI,6/30/67,Luminous disc shaped tilted object with aura/haze around it,Disk,5 mins
41.942833,79.9844968,Waterford,PA,6/30/67,"My mother and her sister, now in their late 50's went to a field together when they were under ten years of age. They lived on farm lan",Sphere,11 hours
40.41895660000001,80.58951669999999,Weirton,WV,6/30/67,"Green glowing object in the summer in the mid 1960's, west of Pittsburgh.",Sphere,1-3 minutes
46.7180163,94.4041625,Pine+River,MN,6/30/67,Grays i seen when a small child,Light,not sure
34.4358294,119.8276389,Goleta,CA,6/30/67,Chased by Grays in Santa Barbara in 1967,Unknown,3 hours
42.833014,108.7306725,Lander,WY,6/30/67,"They were just lights, but very curious lights at that.",Light,5 - 10 minutes
39.725127,84.177855,Oakwood+(Dayton),OH,6/30/67,"In the forty years since, I have yet to see anything that will explain away what I witnessed in the middle of the night.",Circle,3 minutes
39.114053,94.6274636,Kansas+city,KS,6/30/67,Wyandotte county Kansas 1967 object appeared as aircraft suspended midair. 500 Lights On Object0: Yes,Other,Uncertain
39.9611755,82.99879419999999,Columbus,OH,6/30/67,"Fifty feet from my driveway, up to my left, out of the north sky came a large lighted object.",N/A,N/A
33.5386523,112.1859866,Glendale,AZ,6/27/67,"Glendale, AZ, 11:00 Pm, white sphere silently appeared in sky, It moved to 12 &quot; in front of my face, flew off.",Light,10 minutes
44.9288604,-7.538279500000001,none,MI,6/25/67,daylight disk at 200 meters.,Disk,2 seconds
43.6187102,116.2146068,Boise,ID,6/23/67,"Light landing on runway, traveling past end zone, travelling overland over roadless area then turning to merge into freeway traffice",Light,2 minutes
38.24935809999999,122.0399663,Fairfield,CA,6/20/67,I believe,Cigar,1 minute
44.7748748,117.8343848,Baker,OR,6/15/67,Disk shaped object with different colored revolving lights,Disk,30 minutes
42.667319,80.415132,St.+Williams+(Canada),ON,6/15/67,cigar shaped with red and green lights going from one end to the other. Then it was gone.,Cigar,30 seconds or so
32.0835407,81.09983419999999,Savannah,GA,6/15/67,Five orange glowing spheres together in a line above the treetops.,Chevron,3-4 minutes
45.2664863,72.1479889,Lake+Magog+(Canada),QC,6/15/67,Fast moving white object zig-zags across lake stops beside tree top (orange saucer) for a short time then shoots into sky.,Disk,45 seconds
40.7607793,111.8910474,Salt+Lake+City,UT,6/15/67,In June of 1967 while waiting in our car to get into a drive-in movie a saucer shaped craft hovered between us and the Wasatch Mountain,Disk,1or2 min.
39.01739630000001,122.0577477,Arbuckle,CA,6/15/67,"At dusk in 1966 or 67, three lights in formation or triangular craft with no visible substance floated silently into the West.",Triangle,3-4 mins.
36.0103561,84.26964490000002,Oak+Ridge,TN,6/15/67,Red Sphere in Oak Ridge.,Sphere,~12 minutes
43.3095164,73.6440058,Glens+Falls,NY,6/15/67,Passed over our backyard,Teardrop,15:00
40.5187154,74.4120953,Edison,NJ,6/15/67,the object was one color.orange,Other,month
35.6507888,117.66173,China+Lake,CA,6/15/67,a silver sphere was filmed with a high speed tracking camera with data bar the sphere was 30 ft in diamer flying at 1900mph at a range,Sphere,2min
42.331427,83.0457538,Detroit,MI,6/15/67,huge metal ball shaped ship hanging low in air then moved away at 2 o'clock angle at great speed.,Sphere,1min
33.4745237,112.1038591,Highway,AZ,6/15/67,1967 UFO somewhere between Utah and So. Calif. over highway finally reported!,Circle,30 minutes
40.1578402,83.07518689999999,Powell,OH,6/15/67,UFO hovers right overhead while I walk alone at night,Disk,2 hours
47.3809335,122.2348431,Kent,WA,6/15/67,IN THE SUMMER OF 1967 I saw a saucer at 35 feet above my car! I saw things that were  were concidered impossable for that time period. ,Disk,5Min. +
38.9791709,94.96857829999999,DeSoto,KS,6/15/67,A fast moving light tracking in straight lines appeared in the northern skies........,Light,10 sec.
30.8365815,83.9787808,Thomasville,GA,6/14/67,2 young men see strange barbell ufo in clear blue dauytime sky at low level.,Other,6 mins
35.0537094,94.6235579,Poteau,OK,6/12/67,Light changing color darting back and forth across the sky.,Light,15 min.
31.7618778,106.4850217,El+Paso,TX,6/10/67,2 objects dock -stay together 10 minutes then seperate in different directions -gain altitude until out of sight,Light,15 minutes
41.9778795,91.6656232,Cedar+Rapids,IA,6/6/67,Bright-as-chrome object hovering,Oval,2 min.
47.2528768,122.4442906,Tacoma,WA,6/5/67,These were black half spheres in a triangular formation,Other,1 to 2 minutes
34.6059253,86.9833417,Decatur,AL,6/4/67,"Strange light shivered across sky, stopped overhead, tried to land, stopped, and then took off out of sight in 2 seconds.",Light,2-3 minutes
43.6187102,116.2146068,Boise,ID,6/1/67,Large Mining UFO mining resourses on Earth,Disk,one hour
40.6325654,79.5897676,Hyde+Park,PA,6/1/67,"Was 12 years old,walking to buddies home it was dark.all sudden bright lights in the sky.Look like satlight maybe one mile above me.To ",Other,60 sec.
34.274646,119.2290316,Ventura,CA,6/1/67,Sighted light surrounding unknown being and heard sounds as being attempted to look inside home.,Cigar,5 - 10 minutes
39.24254,91.6454385,Laddonia,MO,6/1/67,Seeking Laddonia MO residents who witnessed UFO's on 3 consecutive nights 1967,Unknown,3 nights
42.1933915,79.2486576,Gerry,NY,6/1/67,"1967 object seen in gerry, new york made no noise as it flew  in the sky.",Disk,3or4 minutes
34.1141743,116.432235,Yucca+Valley,CA,6/1/67,"6 family members observe bright light for 5 minutes near Yucca Valley, CA 1967",Light,5 minutes
47.2031566,122.2403966,Sumner,WA,6/1/67,5 objects seen over Sumner WA June of 1967. Objects hovered very close to ground and shined lights.,Formation,10-15 min
39.1031182,84.5120196,Cincinnati,OH,6/1/67,i was a young girl and i know what a blimp looks like and this was NOT a blimp,Cigar,5-10 minutes
43.0201173,123.2931205,Myrtle+Creek,OR,6/1/67,10 PM August 1967 sphere observed by multiple witnesses moving along ridgleline 1/2 mile distance  500 Lights On Object0: Yes,Circle,initially 15 minutes last
43.4252776,88.1834277,West+Bend,WI,6/1/67,Orange neon brilliance round.,Light,15 minutes
33.7598291,87.18333489999999,Cordova,AL,6/1/67,"very large craft, siting dead still in mid air ,very low and in broad daylight, could see the seams in the metal",Disk,20 min
35.6840131,82.00927449999999,Marion,NC,6/1/67,"In 1967,  I saw a flying/floating brown sphere.  ((NUFORC Note:  Report from retired Deputy Sheriff.  PD))",Sphere,3-5 minutes
38.7747525,93.7360367,Warrensburg+on+Highway+13,MO,6/1/67,"MISSOURI INVESTIGATORS GROUP Report:  We saw two parallel lights cross in front of our windshield very, very rapidly.",Other,20 seconds
41.0170937,95.2214477,Red+Oak,IA,6/1/67,"Two unidentified extremely bright lights, one large - one smaller, clearly visible on a sunny clear day, moving at incredible speed..",Light,15 - 20 seconds
37.9161326,122.310765,El+Cerrito,CA,6/1/67,"My wife and I saw a flying saucer, which was at about 2000 ft. sitting still.  It was oval shape, silver, and looked like something you",Oval,2 minutes
32.715738,117.1610838,San+Diego,CA,6/1/67,"June 1967,   2  mirrored  objects appeared miles overhead and  were motionless for about 10 minutes then going straight up and dissappe",Circle,10 min
37.9161043,85.9562469,Fort+Knox,KY,6/1/67,"((HOAX??))  Fort Knox , Kentucky, Sighting.",Cylinder,3 minutes
44.9537029,93.0899578,St.+Paul,MN,6/1/67,Fighter Jet chases UFO,Disk,4 minutes
34.8056979,81.0114691,Edgemoor,SC,6/1/67,Myself and 3 friends witnessed a circular shaped craft in the spring of 1967 hovering over a railroad track.,Disk,2 minutes
31.7618778,106.4850217,El+Paso,TX,5/29/67,My Dad was a radar specialist.,Light,1 hour
32.5093109,92.1193012,Monroe,LA,5/15/67,My cousin's husband abd I were night fishing and saw a single light looking like a large star moving across the night sky at a pretty g,Light,1 minute
34.0777873,116.5394584,Palm+Wells,CA,5/15/67,small lighted spheres apparently hovering just above the ground; about a quarter mile away,Formation,10 MINUTES
37.8727044,122.4644171,Belvedere,CA,5/15/67,Teardrop outlined in white light with three white circular lights inside other wise dark  interior of tear shape.,Teardrop,Approx. 10 seconds
29.6516344,82.32482619999999,Gainesville,FL,5/15/67,An equilateral triangle with a red glowing light on each corner (one each corner--three total. solid sillouette dark shape about the si,Triangle,3-5 minutes
39.9611755,82.99879419999999,Columbus,OH,5/15/67,High speed lead craft leaves three others in its wake,Unknown,15 seconds
47.3809335,122.2348431,Kent,WA,5/15/67,"First it was clear, like glass, than it turned to metal, purple and silver mixing, and than solid silver.",Disk,8 minutes
39.4748693,118.7770407,Fallon,NV,5/10/67,"05/10/1967 23:00 fallon, nevada, glow on horizen, followed by, hovering colored discs, 20 minutes",Oval,"20 min,"
