lat,lng,city,state,date,specs,shape,duration
43.2311794,76.30076389999999,Phoenix,NY,5/5/94,It  had my head in a vice-like grip and was &quot;reading&quot; me.,Unknown,5 minutes
46.480562,67.42209500000001,Glassville+(Canada),NB,5/2/94,"My Dad and I were driving down the street when I looked up and saw it, it was huge, it had a triagular top and bottom with revolving li",Diamond,5 minutes
47.4941836,111.2833449,Great+Falls,MT,5/1/94,Ghost like bright sphere wobleing and hovering and folwoing me,Sphere,about 5 minuts
33.14238,116.121498,Ocotillo+Wells+(near),CA,5/1/94,Large stationary fiery ball,Fireball,4 hours
46.0980066,88.3340242,Crystal+Falls,MI,5/1/94,Multiple encounters over approximately 50 mile radius.,Triangle,1 hour or more
38.7145093,84.82272549999999,Glencoe,KY,5/1/94,Sphere hovering over pond.,Sphere,30 minutes
36.7810744,103.9695127,Capulin+Mountain,NM,4/30/94,"Globe shaped object decends at above normal speed, makes impossible turn, and changes colors in flight.",Sphere,2
43.4553461,76.5104973,Oswego,NY,4/25/94,Rusty-red colored triangular shaped object with red lights came up over the shore of Lake Ontario and flew in a quick zig zag pattern,Triangle,1 minute
35.0853336,106.6055534,Albuquerque,NM,4/25/94,Glowing sphere makes figure eight around two people.,Sphere,3 seconds
35.0853336,106.6055534,Albuquerque,NM,4/24/94,I was on my way down from the Sandia Mountain peak ( on a tramway) when I saw a bright orange flash and an ornange ball of light speed ,Sphere,2-3sec
43.7315479,79.7624177,Brampton+(near+Toronto)+(Canada),ON,4/23/94,"The whole north west sky lit up.  Near Dorsett Park, facing North west at 1:00am in the morning.  There were very few clouds in the sky",N/A,2min
28.5552719,82.3878709,Brooksville,FL,4/20/94,Huge soundless orangish/greenish hovering  ball of light that shoots out sparks.,Light,3 minutes
36.8529263,75.97798499999999,Virginia+Beach,VA,4/19/94,"I say almost disk shaped because the edges did not come to a point but were straight, could have been cigar shaped at an angle.",Disk,3-4 minutes
43.1535728,93.20103669999999,Mason+City+(south+of),IA,4/16/94,"I was going south on I35 in a Greyhound bus in northern Iowa. It was early in the am. and i was just sitting awake then suddenly, a ver",Unknown,1 min
34.5400242,112.4685025,Prescott,AZ,4/15/94,rectangular object and sound of object.,Rectangle,3 minutes
28.6436321,82.34021179999999,Brooksville+(Withlacoochie+Forest),FL,4/15/94,"Three witnesses saw a very large, chevron-shaped, black or gray object with read lights around the edges.",Chevron,20 minutes
39.60677889999999,75.83327179999999,Elkton,MD,4/15/94,The UFO had Orange and Yellow Lights. 500 Lights On Object0: Yes,Other,1-3 Minutes
34.315134,117.3552154,Summit+Valley,CA,4/14/94,lime green disk shaped and tranparent with no lights or any other noticeable markings,Disk,5 minutes
38.2526647,85.7584557,Louisville,KY,4/11/94,triangular UFO/ Missing time,Triangle,not known
31.7721106,91.8215177,Harrisonburg,LA,4/11/94,"large, well-lit saucer passes only a hundred feet above house",Disk,30 seconds
36.9922768,91.96987419999999,Willow+Springs,MO,4/10/94,"Huge Triangular Object  after dusk seen with lights outling the perimeter, and a bright light in the middle .",Triangle,20 to 30 min
42.3861485,82.9118591,Grosse+Point,MI,4/9/94,"Woman reports seeing brilliantly bright, &quot;Kelly green&quot; orb near her home in night sky.  Disappeared to west.",Light,N/A
41.4825947,73.4095652,Brookfield,CT,4/7/94,"Large, bright object crested over NW horizonmoving very fast, my friend and I both sawthe object, and another of my friendsreported sig",Light,00:00:30
42.245869,84.40134619999999,Jackson,MI,4/7/94,"Small light seen in jackson, michigan",Light,3-4 min.
42.3861485,82.9118591,Grosse+Pointe,MI,4/6/94,Green light moving at really high speeds crosses night sky and disapears,Light,3 to 5 seconds
38.5449065,121.7405167,Davis,CA,4/6/94,bright light in the sky a real close encounter.,Cigar,"15 ,20 min."
29.28898869999999,98.64478489999999,Von+Ormy,TX,4/4/94,"Summary of San Antonio MUFON investigator trainee's Von Ormy, Texas UFO investigation",Other,?
26.0112014,80.1494901,Hollywood,FL,4/4/94,For NUFORC:  this message is for contact info on orange orbs in Broward County Florida.  I thought the witness section was not for cont,Circle,N/A
26.0112014,80.1494901,Hollywood,FL,4/4/94,Orange Orbs in Broward County Florida.,Circle,2 hrs
38.759642,123.0915605,Lake+Sonoma,CA,4/3/94,While fishing on Lake Sonoma my friend and I saw two lights in the trees.  We were on a boat in the center of the lake.  The lights wer,Other,1hour 10 min
35.1424671,119.4565078,Taft,CA,4/1/94,"White light seen at 10:30 pm traveling from NW to SE at very high rate of speed.Slows momentarily to beam down conical light, then resu",Light,15 seconds
41.2804112,73.87147519999999,Cortlandt+Manor,NY,4/1/94,circular craft hovered emitting green and red.,Disk,5-7 Minutes
40.6214551,79.15253489999999,Indiana,PA,4/1/94,we saw a saucer shaped object with a halo around it behind it followed three jets with after burners engaged colors appeared to be blue,Disk,3-10 sec
44.2949636,93.268827,Faribault,MN,4/1/94,Observed a green fireball flying 30 ft above and along a river. It flew parallel to the terrain and emitted a long tall w/smoke &amp; spark,Fireball,3-4 sec
33.4509353,98.924511,Megargel,TX,4/1/94,Missing Time: 10 minutes erased from my life,Unknown,10 minutes
37.8043637,122.2711137,Oakland,CA,3/28/94,I saw the lights in an arrow formation over San Francisco for 40 minutes and they didn't move an inch.,Light,40 minutes
33.3445684,89.0453397,Sturgis,MS,3/24/94,"They  could have been traveling by power from magnetic fields, they  appeared to slip through the sky.",Disk,4 minutes
43.0125274,83.6874562,Flint,MI,3/18/94,"In the pre-dawn hours of the above date I encountered a large, triangular craft hovering silently about 100 foot above the freeway.",Triangle,5 minutes
35.5950581,82.5514869,Asheville,NC,3/15/94,Seen craft very close hovering over telephone poll not moving or making a sound.,Disk,30 min
34.46064399999999,86.23331499999999,Columbus+City,AL,3/15/94,"Large Black Cylinder Flies Above Mountain Lakes Near Guntersville, Alabama",Cylinder,3 seconds
36.0041223,120.1290272,Avenal,CA,3/15/94,"my wife and I were at a ranch late at night talking with friends about 4 or 5 miles from avenal , When we notice several small lights z",Unknown,40 or 50 minutes
36.8252277,119.7029194,Clovis,CA,3/15/94,Beam of Light near Strawberry Field,Light,5 minutes
33.4151843,111.8314724,Mesa+(north+of),AZ,3/10/94,"I saw a black craft floating in the air, no noise or anything.  When I got out of my car to see what was going on, it left.",Triangle,90 seconds
47.0378741,122.9006951,Olympia,WA,3/10/94,"Two oval shaped, firefly-like, yellow glowing craft, flew overhead at great speeds with erratic movement.",Oval,10 seconds
33.9791793,118.032844,Whittier,CA,3/10/94,it was giant I saw it with bright lights millions of lights it 2 feet above our car. I saw a windsheild in it through it I saw an objec,Circle,5:00
42.9133602,85.7053085,Wyoming,MI,3/10/94,disk shaped looked to be black with colored flashing lights on the bottom,Disk,1 min
42.3086444,83.48211599999999,Canton,MI,3/9/94,UFO Encounter in Canton Michigan.,Unknown,2 min
42.7875235,86.1089301,Holland,MI,3/8/94,UFOs observed by multiple witnesses including a police officer and confirmed on radar at the NWS,Formation,unsure
47.6627771,122.3138767,Seattle+(University+District),WA,3/8/94,"Young man and girlfriend witness an intensely bright object streak across the night sky, followed by a second object.",Fireball,5 seconds
38.5733155,109.5498395,Moab+(south+of),UT,3/3/94,Rotating triangle of lights south of Moab.,Triangle,one full minute
42.6525793,73.7562317,Albany,NY,3/3/94,A repeat and endless loop of an object downtown suny albany campus.,Rectangle,6 hous
38.5736176,97.67448379999999,Lindsborg,KS,3/2/94,Black Triangle with Slightly Askew Leading Edge,Triangle,10 seconds
39.8366528,105.0372046,Westminster,CO,3/1/94,I was riding in a car heading south on Wadsworth Blvd toward 92nd in Westminster. I looked west at the sunset and abov,Circle,30 seconds
33.6971468,117.185294,Menifee,CA,3/1/94,Sun City / Menifee UFO sightings in 1994,Unknown,4 months
42.887535,77.2816984,Canandaigua,NY,2/27/94,It was rectangular and had 6 red lights on each side.,Rectangle,5 minutes
44.5895244,75.68428580000001,Brockville+(Canada),ON,2/24/94,"I watched it for about 15 minutes.  It seemed bigger than a plane, circular and it changed colour;  white to red then green then back",Oval,~ 15 minutes
36.3082598,86.6233614,Shackle+Island+community+of+Hendersonville,TN,2/22/94,Object viewed under magnification observed lights/crafts entering and leaving illuminated object;,Changing,40 minutes
34.5199402,105.8700901,New+Mexico,NM,2/21/94,flashing bright lights following 60mph auto at its level,Light,10min
43.653226,79.3831843,Toronto+(Canada),ON,2/20/94,"Saw a metallic, daylight disk that left a wake in the clouds.",Disk,Less than 10 seconds
49.2827291,123.1207375,Vancouver+(Canada),BC,2/15/94,"1994 Sighting in Vancouver, B.C.",Triangle,2 minutes
37.7525922,83.0687816,Salyersville,KY,2/14/94,"i was driving into salyersville from south to north maybe an 1/8 of a mile from rt.7 and u.s. 460 intersection, when a dark gray triang",Triangle,1:00 min
46.4004089,117.0011889,Lewiston+(Near),ID,2/10/94,Triangular craft hovering over bridge then moving downriver.,Triangle,5 minutes
63.6941667,170.4788888,"Savoonga,+St.+Lawrence+Island",AK,2/1/94,The object was about 200 feet off the ground. There was absolutely no sound. It stayed in one spot in the air without moving.,Light,6 minutes
39.6295554,90.45591379999999,Illinois+(rural),IL,2/1/94,"A strange light on the side of a hill in a fog bank, that was the only fog for miles.",Light,2 minutes
32.7650783,117.0220495,Spring+Valley/LaMesa,CA,1/25/94,"Fireball descending towards ground, changes trajectory, streaks away with giant tale behind",Fireball,5-7 minutes
34.0522342,118.2436849,Los+Angeles,CA,1/24/94,my friend and Isaw saucer craft -silent -eight glowing orbs underneath-with colors-traveled overhead,Disk,5 minutes
45.3044062,97.0364661,Summit,SD,1/19/94,Large Silver Disk explodes over SD Antenna Field....,Disk,10 minutes
43.3246863,95.149996,Milford,IA,1/18/94,The objects hover to the west changing diffrent colors and disaprearing after 8:00,Flash,1 hour
34.0522342,118.2436849,Los+Angeles,CA,1/17/94,Fire ball after northidge quake .,Fireball,few seconds
34.469994,118.1967418,Acton,CA,1/15/94,it was like they knew i was watching them.,Unknown,30 mins
39.6302643,106.0433518,Dillon,CO,1/15/94,"ufo activity at lake dillon,colorado",Sphere,5 hrs
34.285558,118.8820414,Moorpark,CA,1/14/94,Silver Sphere in Southern California,Sphere,appx 5 min
40.6110589,111.8999353,Midvale,UT,1/14/94,"In Midvale, Utah in the early morning",Disk,1 min
29.1385785,83.03512119999999,Cedar+Key,FL,1/12/94,Huge bluish black delta  wing 50 feet or less  over my head while deer hunting from my tree stand in FL !!,Chevron,5 minutes
41.9436071,75.5991789,Susquehanna,PA,1/4/94,Large white light moving fast  above car turns into Triangular UFO and hovers over car for 5 minutes,Triangle,5 minutes
35.0437038,106.5136218,Albuquerque+(30-60+miles+west+of+city),NM,1/3/94,"Saw triangular craft approaching from horizon from the N.W., approached slowly, silently, and low to the ground.  Passed directly over ",Triangle,3-4 minutes?
40.5865396,122.3916754,Redding,CA,1/1/94,object  came  from  mountian  to  our  car  .,Triangle,all night
41.1134289,74.2454254,Ringwood,NJ,1/1/94,"Strange light, stranger disappearance",Unknown,4minutes
26.1224386,80.13731740000001,Fort+Lauderdale,FL,1/1/94,"NewYears between 3am and 4am. We were leaving work, heading to my truck when I looked in the clear sky to the north, We seen flat black",Unknown,2/5min
30.5305987,84.5448693,Interstate+10,FL,1/1/94,slow moving craft with 6 small green lights one side facing us.Moving slowly almost touching tops of trees.Making no sound and with no ,Triangle,3 min. aprox.
21.3069444,157.8583333,Honolulu,HI,1/1/94,Strange sights in the sky over Oahu from about 1994 to 2004 seen by long-time resident,Light,varies
33.9191799,118.4164652,El+Segundo,CA,1/1/94,"What I'm seeing, please help.",Other,30 minutes
